"Date/Time","City","State","Country","Shape","Duration","Summary","Posted","Image","URL","ID","madar"
"9/10/22 20:01","Gatineau","Quebec","Canada","Disk","about a quarter second","An upward facing infrared camera captured a classically shaped UAP moving left to right, inexplicably out of focus","12/22/22","Yes","https://www.nuforc.org/webreports/reports/172/S172982.html","934X2023.01.29.09.41.02",FALSE
"9/10/22 20:00","Skykomish","WA","USA","Light","3 minutes","Red orb photographed slowly moving west at about 300'","12/22/22","Yes","https://www.nuforc.org/webreports/reports/172/S172615.html","935X2023.01.29.09.41.02",FALSE
"9/10/22 06:25","Logan Township","NJ","USA","Changing","1 minute","I looked up toward South West and I though I saw a plane but there was no sound. I grabbed my phone and started shooting.","12/22/22","Yes","https://www.nuforc.org/webreports/reports/172/S172947.html","936X2023.01.29.09.41.02",FALSE
"9/8/22 06:24","Griffin","GA","USA","Unknown","1 1/2 hours","I zoomed in on the picture & captured the real image that was hovering over the neighborhood.","12/22/22","Yes","https://www.nuforc.org/webreports/reports/172/S172274.html","937X2023.01.29.09.41.02",FALSE
"9/5/22 12:51","??","NC","USA","Cigar","5 minutes","Was on jetblue going to Florida. Was at 30,000 feet in the air.","12/22/22","Yes","https://www.nuforc.org/webreports/reports/173/S173267.html","938X2023.01.29.09.41.02",FALSE
"9/5/22 10:42","Indiatlantic","FL","USA","Circle","Photo, unknown at time ta","Mom took a photo and unknown to her at the time, people were looking at an unidentified object","12/22/22","Yes","https://www.nuforc.org/webreports/reports/173/S173503.html","939X2023.01.29.09.41.02",FALSE
"9/5/22 06:13","Satsuma","FL","USA","Cylinder","A minute or two I'm guess","Cylindrical object spotted while sky watching.","12/22/22","Yes","https://www.nuforc.org/webreports/reports/173/S173502.html","940X2023.01.29.09.41.02",FALSE
"9/5/22 04:41","Burnsville","MS","USA","Other","Thirteen seconds","I was just flying my drone over the waterway in Burnsville and noticed nothing unusual until later on when going through videos.","12/22/22","","https://www.nuforc.org/webreports/reports/173/S173276.html","941X2023.01.29.09.41.02",FALSE
"9/4/22 20:02","Gatineau","Quebec","Canada","Disk","one quarter second","A bright disk captured in infrared on camera facing upwards","12/22/22","Yes","https://www.nuforc.org/webreports/reports/172/S172713.html","942X2023.01.29.09.41.02",FALSE
"9/4/22 13:46","Nampa","ID","USA","Rectangle","2 - 3 seconds at most","Never saw actual object, heard pops, saw damaged windshield later, reviewed dashcam and discovered sighting of the object and damage.","12/22/22","","https://www.nuforc.org/webreports/reports/172/S172556.html","943X2023.01.29.09.41.02",FALSE
"9/3/22 23:28","dunstable","","United Kingdom","Disk","","look bright like a star but moved across sky","12/22/22","","https://www.nuforc.org/webreports/reports/172/S172826.html","944X2023.01.29.09.41.02",FALSE
"9/1/22 22:00","Bridgman","MI","USA","Light","1hr","2-7 lights that hovered, changed directions many times, multiplied, unfathomably fast","12/22/22","","https://www.nuforc.org/webreports/reports/172/S172623.html","945X2023.01.29.09.41.02",FALSE
"9/1/22 18:12","Tiverton","RI","USA","Triangle","5 minutes","Ufo interacting with plane","12/22/22","","https://www.nuforc.org/webreports/reports/172/S172236.html","946X2023.01.29.09.41.02",FALSE
"8/31/22 22:47","Seattle","WA","USA","Light","2 minutes","What I thought was a satellite began to zig zag, stop and zig zag again.","12/22/22","","https://www.nuforc.org/webreports/reports/172/S172231.html","947X2023.01.29.09.41.02",FALSE
"8/30/22 05:26","Zuni","NM","USA","Changing","20-30 minutes","Observed unknown objects moving in early morning sky.","12/22/22","","https://www.nuforc.org/webreports/reports/172/S172275.html","948X2023.01.29.09.41.02",FALSE
"8/29/22 19:00","Pittsburgh","PA","USA","Cigar","a few minutes","I saw a disc in my backyard (see pic), then my neighbor and I saw oblong ufo (see video).","12/22/22","Yes","https://www.nuforc.org/webreports/reports/172/S172428.html","949X2023.01.29.09.41.02",FALSE
"8/28/22 09:32","Toledo","OH","USA","Cigar","2-4 minutes","Solid black no wings or tail fin. Seen while flying from Philadelphia to Las Vegas I have a 12 second video","12/22/22","Yes","https://www.nuforc.org/webreports/reports/172/S172651.html","950X2023.01.29.09.41.02",FALSE
"8/27/22 21:00","Lower Lewis Falls Camp Ground","WA","USA","Unknown","5 minutes","Lower Lewis Falls, WA - Interesting Camping Trip","12/22/22","","https://www.nuforc.org/webreports/reports/173/S173065.html","951X2023.01.29.09.41.02",FALSE
"8/27/22 01:27","Dallas","TX","USA","Light","4:30","Lying in front yard, waiting for partner to come back with house keys to get in the house.","12/22/22","","https://www.nuforc.org/webreports/reports/172/S172525.html","952X2023.01.29.09.41.02",FALSE
"8/26/22 21:45","Long Beach","CA","USA","Changing","2 min 45 seconds video","An impressive spacecraft with smaller vessels landing on and departing from it.","12/22/22","Yes","https://www.nuforc.org/webreports/reports/172/S172504.html","953X2023.01.29.09.41.02",FALSE
"8/26/22 01:00","Choctaw","OK","USA","Light","A couple minutes","Short and sweet. They came out of Ursa Major appeared as two parallel lights - side by side one brighter than the other","12/22/22","","https://www.nuforc.org/webreports/reports/172/S172258.html","954X2023.01.29.09.41.02",FALSE
"8/25/22 23:30","Byesville","OH","USA","Changing","Been every night since sa","Bright light first time speeding extremely fast watched it stop and go down that light was bright white","12/22/22","","https://www.nuforc.org/webreports/reports/173/S173013.html","955X2023.01.29.09.41.02",FALSE
"8/24/22 23:34","Crawfordsville","IN","USA","Cross","5 minutes","Was taking night time pictures of the illuminated sky over Crawfordsville, Indiana upon reviewing pictures notice multiple UFO's","12/22/22","Yes","https://www.nuforc.org/webreports/reports/172/S172449.html","956X2023.01.29.09.41.02",FALSE
"8/24/22 18:24","Alicante to Tenerife flight","","Spain","Cylinder","Several pictures","I took pictures of the horizon throw the plain window the a couple of weeks later when I was looking at my pictures I noticed these","12/22/22","Yes","https://www.nuforc.org/webreports/reports/172/S172424.html","957X2023.01.29.09.41.02",FALSE
"8/24/22 03:30","Beaufort","","","Sphere","30 minutes","My wife and I saw 2 balls af light east north east at about 20 to 30 degrees above the horizon that would move in random directions","12/22/22","","https://www.nuforc.org/webreports/reports/173/S173077.html","958X2023.01.29.09.41.02",FALSE
"8/21/22 01:02","Gatineau","Quebec","Canada","Oval","about half a second","An upward facing infrared camera captured an object that moved into the screen from the mid-right and exited from the screen top","12/22/22","Yes","https://www.nuforc.org/webreports/reports/173/S173202.html","959X2023.01.29.09.41.02",FALSE
"8/19/22 21:15","NNW of Lake George Village","New York","United States","Disk","About 30 Mins","red and white light disk shaped","12/22/22","","https://www.nuforc.org/webreports/reports/172/S172232.html","960X2023.01.29.09.41.02",FALSE
"8/19/22 09:17","nearest city glide/peel/Roseburg","OR","USA","Cigar","Under 30 seconds.","we look up in the sky and see a glowing red and green object when we pointed cameras at it when we did it vanished","12/22/22","","https://www.nuforc.org/webreports/reports/173/S173407.html","961X2023.01.29.09.41.02",FALSE
"8/19/22 06:50","Tyler","TX","USA","Diamond","Lance","2 diamond 2 part connected with a light per side each side of 3 lights of triangle lights","12/22/22","","https://www.nuforc.org/webreports/reports/173/S173289.html","962X2023.01.29.09.41.02",FALSE
"8/18/22 22:30","Boca Raton","FL","USA","Other","Many times","Planes stopping and flashing weird lights.","12/22/22","","https://www.nuforc.org/webreports/reports/173/S173068.html","963X2023.01.29.09.41.02",FALSE
"8/18/22 22:30","Choctaw","OK","USA","Light","Until 130 am august 19th","Saw lights coming out of Ursa Major area of the northern quadrant of the sky but at the tree line","12/22/22","","https://www.nuforc.org/webreports/reports/172/S172259.html","964X2023.01.29.09.41.02",FALSE
"8/15/22 21:55","Gatineau","Quebec","Canada","Other","about a quarter second","An object like a 'rod with features' was captured on an infrared camera facing upwards moving screen top to bottom","12/22/22","Yes","https://www.nuforc.org/webreports/reports/173/S173025.html","965X2023.01.29.09.41.02",FALSE
"8/15/22 20:58","Gatineau","Quebec","Canada","Other","half a second","An object moved fast downwards and left the screen then reappeared 9 seconds later moving upwards; basically, a rod with features","12/22/22","Yes","https://www.nuforc.org/webreports/reports/172/S172799.html","966X2023.01.29.09.41.02",FALSE
"8/11/22 22:38","Gatineau","Quebec","Canada","Sphere","quarter of a second","A sphere, interesting because it simply blinked on and off in about a quarter of a second; no dectable direction of flight","12/22/22","Yes","https://www.nuforc.org/webreports/reports/172/S172835.html","967X2023.01.29.09.41.02",FALSE
"8/10/22 04:35","Grand Rapids","MI","USA","Rectangle","2-4 minutes","Shimmery rectangle bar of light began to move across the sky. Moved fast and faded to nothingness.","12/22/22","Yes","https://www.nuforc.org/webreports/reports/172/S172415.html","968X2023.01.29.09.41.02",FALSE
"8/9/22 04:50","Gatineau","Quebec","Canada","Other","about half a second","For about half a second an infrared camera facing upward captured a rod-like object with features moving upscreen","12/22/22","Yes","https://www.nuforc.org/webreports/reports/173/S173092.html","969X2023.01.29.09.41.02",FALSE
"8/8/22 13:30","Dungeness Spit near Sequim","WA","USA","Oval","3 sightings over 2 minute","I saw part of one object 3 times over 2 minutes, reflecting sunlight. Seen from Dungeness Spit looking south toward Olympic Mtns.","12/22/22","","https://www.nuforc.org/webreports/reports/173/S173189.html","970X2023.01.29.09.41.02",FALSE
"8/6/22 22:31","Gatineau","Quebec","Canada","Cylinder","close to a second","A cylinder shoots into view along with a sphere; contracts into a ""barrel""; the ""barrel"" departed on the same path the cylinder entered","12/22/22","Yes","https://www.nuforc.org/webreports/reports/172/S172680.html","971X2023.01.29.09.41.02",FALSE
"8/6/22 21:40","Gatineau","Quebec","Canada","Cigar","about a quarter second","An infrared camera pointed upward captured a cigar shaped object moving down-screen","12/22/22","Yes","https://www.nuforc.org/webreports/reports/173/S173179.html","972X2023.01.29.09.41.02",FALSE
"8/6/22 21:32","Gatineau","Quebec","Canada","Cigar","about a half second","An infrared camera facing upward captured a possibly cigar-shaped object with a possible feature at its forward end","12/22/22","Yes","https://www.nuforc.org/webreports/reports/173/S173155.html","973X2023.01.29.09.41.02",FALSE
"8/6/22 21:30","Gatineau","Quebec","Canada","Egg","about a second","An infrared camera facing upward captured a spherical object moving up-screen for about a second; I liked the way it moved","12/22/22","Yes","https://www.nuforc.org/webreports/reports/173/S173180.html","974X2023.01.29.09.41.02",FALSE
"8/5/22 00:10","Viola","DE","USA","Triangle","5 minutes?","Very large triangular aircraft with very little sound flew slowly over our field and reacted to my presence","12/22/22","","https://www.nuforc.org/webreports/reports/172/S172306.html","975X2023.01.29.09.41.02",FALSE
"8/1/22 02:00","Opelousas","LA","USA","Changing","3:02","At first like a pulsating star then began darting very fast left to right and pulsating the whole time from bright to dim.","12/22/22","","https://www.nuforc.org/webreports/reports/172/S172225.html","976X2023.01.29.09.41.02",FALSE
"7/30/22 21:00","Harrisburg","PA","USA","Unknown","N/a","It's orbs all on me","12/22/22","","https://www.nuforc.org/webreports/reports/172/S172405.html","977X2023.01.29.09.41.02",FALSE
"7/30/22 01:47","North Dartmouth","MA","USA","Circle","10 seconds","Woke up to see a very bright light emitting showers of sparks moving South to North","12/22/22","","https://www.nuforc.org/webreports/reports/173/S173037.html","978X2023.01.29.09.41.02",FALSE
"7/27/22 22:20","Conway","AR","USA","Star","Shortly past sun rise","A bright small object that moves freely in the sky that seems to be attempting communication with Me","12/22/22","","https://www.nuforc.org/webreports/reports/172/S172906.html","979X2023.01.29.09.41.02",FALSE
"7/26/22 21:22","Gatineau","","Canada","Other","about a quarter second","A fast moving object was captured on an infrared camera moving downscreen to the left","12/22/22","","https://www.nuforc.org/webreports/reports/172/S172909.html","980X2023.01.29.09.41.02",FALSE
"7/22/22 21:30","Salinas","CA","USA","Unknown","10 minutes","Lights staying still in sky that turned on and off","12/22/22","","https://www.nuforc.org/webreports/reports/172/S172325.html","981X2023.01.29.09.41.02",FALSE
"7/22/22 21:19","Dansville","NY","USA","Unknown","","Ufo sighting","12/22/22","Yes","https://www.nuforc.org/webreports/reports/172/S172810.html","982X2023.01.29.09.41.02",FALSE
"7/20/22 16:50","Anchorage","AK","USA","Cylinder","Its save in my computer","We was looking out our window taking picture of the clouds because of the colors. Then this huge ufo appeared, You can see a wormhole","12/22/22","Yes","https://www.nuforc.org/webreports/reports/173/S173021.html","983X2023.01.29.09.41.02",FALSE
"7/15/22 17:33","","","","Oval","","odd light in the sky","12/22/22","Yes","https://www.nuforc.org/webreports/reports/172/S172756.html","984X2023.01.29.09.41.02",FALSE
"7/14/22 21:45","Bowling Green","KY","USA","Other","Ongoing","Many lights appeared behind my house and other homes in the neighborhood after an orb appeared in the sky the night before.","12/22/22","Yes","https://www.nuforc.org/webreports/reports/173/S173123.html","985X2023.01.29.09.41.02",FALSE
"7/12/22 19:30","Linden","PA","USA","Oval","30 seconds","Daylight sighting of Oval shaped Object.","12/22/22","","https://www.nuforc.org/webreports/reports/172/S172817.html","986X2023.01.29.09.41.02",FALSE
"7/11/22 22:37","Evansville","IN","USA","Unknown","My video is 9 sec","There was like a drone then what I can describe as a man operated drone","12/22/22","","https://www.nuforc.org/webreports/reports/173/S173144.html","987X2023.01.29.09.41.02",FALSE
"7/11/22 19:30","Canon City","CO","USA","Cross","5 minutes","Ufo","12/22/22","","https://www.nuforc.org/webreports/reports/172/S172257.html","988X2023.01.29.09.41.02",FALSE
"7/11/22 14:00","North Las Vegas","NV","USA","Sphere","1","Multiple lights seen mid-day (near area 51)","12/22/22","","https://www.nuforc.org/webreports/reports/173/S173434.html","989X2023.01.29.09.41.02",FALSE
"7/11/22 11:52","Snohomish","WA","USA","Circle","At least 3 minutes","Saw a roundish light object in the sky","12/22/22","Yes","https://www.nuforc.org/webreports/reports/172/S172611.html","990X2023.01.29.09.41.02",FALSE
"7/10/22 00:34","Eugene","OR","USA","Fireball","At least 10 mins","Glowing orb like fireball hovering in the sky.","12/22/22","Yes","https://www.nuforc.org/webreports/reports/173/S173432.html","991X2023.01.29.09.41.02",FALSE
"7/9/22 00:43","Pittsburgh","PA","USA","Other","15 mins","Are you afo showed up behind me about 40 yards away very big it used its beam and lights came out","12/22/22","Yes","https://www.nuforc.org/webreports/reports/172/S172899.html","992X2023.01.29.09.41.02",FALSE
"7/8/22 12:14","Merida","Yucatán","Mexico","Disk","10 minutes","I was on vacation in Mexico and I took my BeReal picture and I later noticed the UFO in the background.","12/22/22","Yes","https://www.nuforc.org/webreports/reports/172/S172575.html","993X2023.01.29.09.41.02",FALSE
"7/7/22 00:21","Gatineau","Quebec","Canada","Other","a quarter second","A torpedo-like object moved quickly downscreen on an infrared camera pointed upward","12/22/22","Yes","https://www.nuforc.org/webreports/reports/172/S172868.html","994X2023.01.29.09.41.02",FALSE
"7/7/22 00:18","Gatineau","Quebec","Canada","Other","about one second","Infrared camera facing upward captured two objects in one second; one moving upscreen, then one moving downscreen","12/22/22","Yes","https://www.nuforc.org/webreports/reports/172/S172665.html","995X2023.01.29.09.41.02",FALSE
"7/6/22 23:29","Gatineau","Quebec","Canada","Other","about a quarter second","An upward facing infrared camera captured an object moving right to left in the direction pointed","12/22/22","Yes","https://www.nuforc.org/webreports/reports/173/S173246.html","996X2023.01.29.09.41.02",FALSE
"7/6/22 22:47","Seary","AR","USA","Cigar","About 7 to 10 minutes","Following a small plane in sky when I noticed object .","12/22/22","Yes","https://www.nuforc.org/webreports/reports/172/S172463.html","997X2023.01.29.09.41.02",FALSE
"7/6/22 20:35","Sedona","AZ","USA","Changing","1 hour","Just a few UFOs flying around. Some flashing, some disappearing.","12/22/22","","https://www.nuforc.org/webreports/reports/173/S173263.html","998X2023.01.29.09.41.02",FALSE
"7/4/22 22:00","Ogden","UT","USA","Light","approx. 10-13seconds","Fast moving object that flew over Hill AFB to Ben Lomond Peak in >10 seconds, and made an abnormal 90-Deg hard turn without slowing","12/22/22","","https://www.nuforc.org/webreports/reports/172/S172678.html","999X2023.01.29.09.41.02",FALSE
"7/3/22 22:01","Oklahoma City","OK","USA","Cone","","It was almost triangle but it was not and it had yellow lights going down four sides, I have a picture","12/22/22","Yes","https://www.nuforc.org/webreports/reports/172/S172311.html","1000X2023.01.29.09.41.02",FALSE
"7/1/22 22:42","Gatineau","Quebec","Canada","Other","about half a second","An upward facing infrared camera captured this object moving from screen left to right in the direction pointed","12/22/22","Yes","https://www.nuforc.org/webreports/reports/172/S172983.html","1001X2023.01.29.09.41.02",FALSE
"6/28/22 22:36","Gatineau","Quebec","Canada","Light","about half a second","An infrared camera captured a seemingly large, bright object that moved across the screen from left to right on a diagonal","12/22/22","Yes","https://www.nuforc.org/webreports/reports/173/S173110.html","1002X2023.01.29.09.41.02",FALSE
"6/28/22 22:26","Gatineau","Quebec","Canada","Cigar","about a quarter second","An infrared camera facing upward captured a likely ""cigar-ish"" shaped object entering the screen downward from the right","12/22/22","Yes","https://www.nuforc.org/webreports/reports/173/S173081.html","1003X2023.01.29.09.41.02",FALSE
"6/28/22 21:14","Gatineau","Quebec","Canada","Sphere","quarter of a second","A sphere moved from the bottom to the top of the screen of an infrared camera pointed upward","12/22/22","Yes","https://www.nuforc.org/webreports/reports/172/S172836.html","1004X2023.01.29.09.41.02",FALSE
"6/28/22 20:02","Gatineau","Quebec","Canada","Changing","two seconds","a two second sequence of a spherical object that then takes on a tic tac appearance, then that of a flying ""rod"" with features","12/22/22","Yes","https://www.nuforc.org/webreports/reports/172/S172766.html","1005X2023.01.29.09.41.02",FALSE
"6/25/22 21:50","Gatineau","Quebec","Canada","Sphere","about a second","A sphere enters the screen from the top, seems to enlarge slightly, then splits into two spheres which exit the screen from the top","12/22/22","Yes","https://www.nuforc.org/webreports/reports/172/S172837.html","1006X2023.01.29.09.41.02",FALSE
"6/24/22 20:37","Ronkonkoma","NY","USA","Changing","14 seconds","I observed a shape shifting object fly at 70 feet off the ground . Started off as a 5 piece triangle morphed into spear like shape.","12/22/22","Yes","https://www.nuforc.org/webreports/reports/173/S173444.html","1007X2023.01.29.09.41.02",FALSE
"6/19/22 21:51","Gatineau","Quebec","Canada","Changing","about half a second","An upfacing infrared camera captured an object moving from screen left to right about 5 seconds after another previously posted","12/22/22","Yes","https://www.nuforc.org/webreports/reports/173/S173203.html","1008X2023.01.29.09.41.02",FALSE
"6/17/22 22:52","Gatineau","Quebec","Canada","Other","about a quarter second","An infrared camera pointed upward captured a fast moving 'something' that literally streaked from screen top to bottom","12/22/22","Yes","https://www.nuforc.org/webreports/reports/173/S173168.html","1009X2023.01.29.09.41.02",FALSE
"6/17/22 15:01","Frederick","CO","USA","Sphere","45 seconds to a minute","Standing outside enjoying the weather looking up at the sky watching birds and I Saul a cylinder silver shape","12/22/22","","https://www.nuforc.org/webreports/reports/172/S172928.html","1010X2023.01.29.09.41.02",FALSE
"6/15/22 05:30","Donna","TX","USA","Disk","I was outside in my back","Contact was made","12/22/22","","https://www.nuforc.org/webreports/reports/173/S173216.html","1011X2023.01.29.09.41.02",FALSE
"6/15/22 04:19","Gatineau","Quebec","Canada","Oval","about a second","Bright oval object moved right to left across infrared camera screen while camera was pointing upward","12/22/22","Yes","https://www.nuforc.org/webreports/reports/172/S172774.html","1012X2023.01.29.09.41.02",FALSE
"6/13/22 22:31","Silverdale","WA","USA","Circle","2 minutes","We were reviewing some photos taken couple months ago,","12/22/22","Yes","https://www.nuforc.org/webreports/reports/172/S172419.html","1013X2023.01.29.09.41.02",FALSE
"6/13/22 14:18","Bristol","RI","USA","Changing","5 minutes",",""Interdimensional Metallic Cube ""","12/22/22","","https://www.nuforc.org/webreports/reports/173/S173317.html","1014X2023.01.29.09.41.02",FALSE
"6/12/22 23:55","Splendora","TX","USA","Unknown","3 minutes","I didnt know I even took pictures of it until.  ((NUFORCNote: Lens flare.  PD))","12/22/22","Yes","https://www.nuforc.org/webreports/reports/173/S173107.html","1015X2023.01.29.09.41.02",FALSE
"6/11/22 00:02","Gatineau","Quebec","Canada","Oval","about a quarter second","An upward facing infra-red camera captured half of an object on the screen right moving downward.","12/22/22","Yes","https://www.nuforc.org/webreports/reports/173/S173304.html","1016X2023.01.29.09.41.02",FALSE
"6/6/22 21:07","Bolingbrook","IL","USA","Oval","3 minutes","Looked like they were in to enter a capsule","12/22/22","Yes","https://www.nuforc.org/webreports/reports/172/S172954.html","1017X2023.01.29.09.41.02",FALSE
"6/5/22 21:38","Gatineau","Quebec","Canada","Other","about a quarter second","An infrared camera pointed upward captured a luminous rod-shaped object moving from screen bottom to top","12/22/22","Yes","https://www.nuforc.org/webreports/reports/173/S173042.html","1018X2023.01.29.09.41.02",FALSE
"6/4/22 16:09","Cabra","Córdoba Province","Spain","Oval","02 segundos","Grabación de vídeo y al reproducirlo aparece algo durante dos o tres décimas de segundo un artefacto que parece venir de otra dimensión","12/22/22","Yes","https://www.nuforc.org/webreports/reports/173/S173160.html","1019X2023.01.29.09.41.02",FALSE
"6/3/22 22:22","Gatineau","Quebec","Canada","Other","about a quarter second","An upwardly pointed infrared camera captured a longish object moving from screen top to bottom","12/22/22","Yes","https://www.nuforc.org/webreports/reports/173/S173389.html","1020X2023.01.29.09.41.02",FALSE
"6/3/22 07:48","Idaho Falls","ID","USA","Light","2 seconds","Driving son to school in morning and there was a bright green flash of light in sky above mountain to the East of me.","12/22/22","","https://www.nuforc.org/webreports/reports/172/S172779.html","1021X2023.01.29.09.41.02",FALSE
"6/1/22 20:00","Fort Hall","ID","USA","Light","1 to 2 minutes","Was playing with friends, my older bro got mad, and he ran and thats when the light in the sky happened.","12/22/22","","https://www.nuforc.org/webreports/reports/173/S173443.html","1022X2023.01.29.09.41.02",FALSE
"5/31/22 20:30","Saint Paul","MN","USA","Rectangle","","Outside of my apartment hovering close by was a square shaped object floating it didn't make any sound at all.","12/22/22","","https://www.nuforc.org/webreports/reports/172/S172233.html","1023X2023.01.29.09.41.02",FALSE
"5/31/22 19:48","Chino","CA","USA","Triangle","15-20 seconds","Low flying triangle over the trees and completely silent.","12/22/22","","https://www.nuforc.org/webreports/reports/172/S172832.html","1024X2023.01.29.09.41.02",FALSE
"5/27/22 00:14","Gatineau","Quebec","Canada","Other","half a second","A half-second image of a manta shaped object and its ""tail"" (in the second frame) from an infrared video; camera pointed upward","12/22/22","Yes","https://www.nuforc.org/webreports/reports/172/S172587.html","1025X2023.01.29.09.41.02",FALSE
"5/27/22 00:14","Gatineau","","Canada","Other","about a quarter second","An infrared camera facing upwards captured a mantaray looking object","12/22/22","Yes","https://www.nuforc.org/webreports/reports/172/S172999.html","1026X2023.01.29.09.41.02",FALSE
"5/26/22 23:46","Gatineau","Quebec","Canada","Changing","about half a second","An object moved into the field of an infrared camera pointed upward, did a motion reversal, split and moved off screen, but intact?","12/22/22","Yes","https://www.nuforc.org/webreports/reports/173/S173335.html","1027X2023.01.29.09.41.02",FALSE
"5/26/22 23:46","Gatineau","Quebec","Canada","Other","about half a second","An infrared camera pointed upwards captured an object moving from screen left to right","12/22/22","Yes","https://www.nuforc.org/webreports/reports/172/S172986.html","1028X2023.01.29.09.41.02",FALSE
