"Date/Time","City","State","Country","Shape","Duration","Summary","Posted","Image","URL","ID","madar"
"10/24/22 02:02","Bakersfield","CA","USA","Changing","2 hours -8 hours","Yellow orange color changing shape changing object.","12/22/22","Yes","https://www.nuforc.org/webreports/reports/172/S172763.html","621X2023.01.29.09.41.02",FALSE
"10/24/22 02:00","Oxford","","USA","Circle","2 min","((Hoax?))  Dark behind the cloud","12/22/22","","https://www.nuforc.org/webreports/reports/172/S172554.html","622X2023.01.29.09.41.02",FALSE
"10/24/22 01:13","Morristown","TN","USA","Light","","Blinking and hovering light. Flashes green, red, and white. No sound.","12/22/22","Yes","https://www.nuforc.org/webreports/reports/172/S172606.html","623X2023.01.29.09.41.02",FALSE
"10/23/22 23:42","Garfield Hts","OH","USA","Unknown","25 minutes and county","Three in vertical line,two on horizontal ends flickering","12/22/22","","https://www.nuforc.org/webreports/reports/172/S172386.html","624X2023.01.29.09.41.02",FALSE
"10/23/22 23:17","Raleigh","","","Triangle","2 minutes","Rounded triangle UFO moving very quick","12/22/22","","https://www.nuforc.org/webreports/reports/172/S172730.html","625X2023.01.29.09.41.02",FALSE
"10/23/22 22:30","Lexington","SC","USA","Disk","5-8 Minutes","I was burned by UFO after jokingly trying to communicate with 1 of several crafts that were flying in the sky.","12/22/22","Yes","https://www.nuforc.org/webreports/reports/172/S172563.html","626X2023.01.29.09.41.02",FALSE
"10/23/22 21:44","Canterbury","United Kingdom","United Kingdom","Circle","2-3 mins","Circle red colour","12/22/22","","https://www.nuforc.org/webreports/reports/172/S172396.html","627X2023.01.29.09.41.02",FALSE
"10/23/22 21:39","Abiqui","NM","USA","Circle","1 hour","I have been seeing these crafts daily it almost feels like they are following me","12/22/22","Yes","https://www.nuforc.org/webreports/reports/172/S172642.html","628X2023.01.29.09.41.02",FALSE
"10/23/22 20:30","Mount Vernon","OH","USA","Triangle","I filmed for 3 1/2 minute","I filmed the object for 3 1/2 minutes, until it went straight up, and disappeared.","12/22/22","Yes","https://www.nuforc.org/webreports/reports/172/S172549.html","629X2023.01.29.09.41.02",FALSE
"10/23/22 20:15","MARIANO ROQUE ALONSO","Central Department","Paraguay","Triangle","10 a 20 segundos","Objeto de gran tamaño en forma triangular","12/22/22","","https://www.nuforc.org/webreports/reports/172/S172392.html","630X2023.01.29.09.41.02",FALSE
"10/23/22 20:01","Waterford","WI","USA","Light","6 seconds","I saw a rectangular circle like white light with a blue like hue to it above me. It went from being this square/circle like shape","12/22/22","","https://www.nuforc.org/webreports/reports/172/S172390.html","631X2023.01.29.09.41.02",FALSE
"10/23/22 19:10","Arroyo Grande","CA","USA","Triangle","I think around a minute","Triangle of lights flashing red and green. It didnt look like the airplanes I normally see - the triangle had more points of light","12/22/22","","https://www.nuforc.org/webreports/reports/172/S172389.html","632X2023.01.29.09.41.02",FALSE
"10/23/22 19:00","Columbus","OH","USA","Unknown","1-2 min","Bright sphere at night","12/22/22","","https://www.nuforc.org/webreports/reports/172/S172542.html","633X2023.01.29.09.41.02",FALSE
"10/23/22 15:02","Thane","Maharashtra","India","Triangle","30 seconds","It was like a triangular craft but with evident curves, metallic object and the sunlight was reflecting off it or I couldn't have seen","12/22/22","","https://www.nuforc.org/webreports/reports/172/S172406.html","634X2023.01.29.09.41.02",FALSE
"10/23/22 14:30","Essex Junction","VT","USA","Other","1.04 Seconds","Was flying my FPV drone and this object passes in front of me.","12/22/22","Yes","https://www.nuforc.org/webreports/reports/172/S172607.html","635X2023.01.29.09.41.02",FALSE
"10/23/22 12:27","Tonto Basin","AZ","USA","Other","Unknown","Odd object just North of Tonto Basin, AZ","12/22/22","Yes","https://www.nuforc.org/webreports/reports/172/S172394.html","636X2023.01.29.09.41.02",FALSE
"10/23/22 03:00","Magalia","CA","USA","Sphere","Approx 20 mins","I woke around 3am to a humming noise and thinking it was daytime","12/22/22","","https://www.nuforc.org/webreports/reports/172/S172962.html","637X2023.01.29.09.41.02",FALSE
"10/22/22 22:50","Oro Valley","AZ","USA","Changing","10 minutes","My mom and I saw the sky move.","12/22/22","","https://www.nuforc.org/webreports/reports/172/S172410.html","638X2023.01.29.09.41.02",FALSE
"10/22/22 22:11","Brooklyn","NY","USA","Changing","Appropriately 35 seconds","Two UFOs seen. HD Video taken with iphone 11","12/22/22","Yes","https://www.nuforc.org/webreports/reports/172/S172407.html","639X2023.01.29.09.41.02",FALSE
"10/22/22 21:54","Everett","WA","USA","Disk","It was fast so 10 seconds","It was lit up a huge saucer flying south in the sky at the speed of light and flashing","12/22/22","","https://www.nuforc.org/webreports/reports/172/S172399.html","640X2023.01.29.09.41.02",FALSE
"10/22/22 21:48","Pekin","IL","USA","Sphere","2-3 Seconds","The Orb/Sphere randomly appeared out of nowhere around mid sky. The craft hovered for about 2 seconds and then shot towards the ground.","12/22/22","","https://www.nuforc.org/webreports/reports/172/S172411.html","641X2023.01.29.09.41.02",FALSE
"10/22/22 21:36","Houston","TX","USA","Oval","15 seconds","A brown beetle shaped craft flew over Harris County Texas under cloud cover on the first night of Jupiter's shining, October 22, 2022.","12/22/22","","https://www.nuforc.org/webreports/reports/172/S172749.html","642X2023.01.29.09.41.02",FALSE
"10/22/22 21:15","Yakima","WA","USA","Unknown","At least 75 minutes","Looked like a bright twinkling star. Eraditic and abrupt change in speed with sharp right angle turns like the letter L.","12/22/22","","https://www.nuforc.org/webreports/reports/172/S172557.html","643X2023.01.29.09.41.02",FALSE
"10/22/22 20:00","Jonesboro","AR","USA","Triangle","20 sec","Saw three lights in a triangle shape about 80 over a house not moving.","12/22/22","","https://www.nuforc.org/webreports/reports/172/S172558.html","644X2023.01.29.09.41.02",FALSE
"10/22/22 20:00","Naples","FL","USA","Circle","30-45 seconds max","I thought it was a satellite, but far too close, too fast, and no actual craft seen-it was like a moving star that was moving fast","12/22/22","","https://www.nuforc.org/webreports/reports/172/S172401.html","645X2023.01.29.09.41.02",FALSE
"10/22/22 19:39","Westland","MI","USA","Circle","About a monite","I captured it on my ring cam it could be a drone but it looked odd shaped not saying it's an ufo but I couldn't make out what it was","12/22/22","Yes","https://www.nuforc.org/webreports/reports/172/S172548.html","646X2023.01.29.09.41.02",FALSE
"10/22/22 19:30","Arlington","TX","USA","Unknown","15 seconds","Green and white lights in the sky in a dark neighborhood.","12/22/22","Yes","https://www.nuforc.org/webreports/reports/173/S173064.html","647X2023.01.29.09.41.02",FALSE
"10/22/22 18:18","Murfreesboro","TN","USA","Light","Filmed 40 seconds","Seen again a spinning white light over temple","12/22/22","","https://www.nuforc.org/webreports/reports/172/S172413.html","648X2023.01.29.09.41.02",FALSE
"10/22/22 12:15","marina del rey los angeles","CA","USA","Sphere","4 seconds","oraange flew with blackhawk over jettys rock in marina del rey los angeles at 1215pm","12/22/22","Yes","https://www.nuforc.org/webreports/reports/172/S172408.html","649X2023.01.29.09.41.02",FALSE
"10/22/22 09:20","HARTSVILLE","SC","USA","Cylinder","A few minutes","We could see a bright cylinder shaped object through the trees, a minute after this a jet could be seen flying over...","12/22/22","Yes","https://www.nuforc.org/webreports/reports/172/S172692.html","650X2023.01.29.09.41.02",FALSE
"10/22/22 07:51","Chadwick","IL","USA","Cylinder","3min","Early morning sighting","12/22/22","Yes","https://www.nuforc.org/webreports/reports/172/S172421.html","651X2023.01.29.09.41.02",FALSE
"10/22/22 06:22","Berwyn","IL","USA","Changing","2 minutes","Clear morning night sky","12/22/22","","https://www.nuforc.org/webreports/reports/172/S172616.html","652X2023.01.29.09.41.02",FALSE
"10/22/22 01:30","St George","UT","USA","Light","Over 30 minutes. Months","3 sets of 2. Another showed up followed by streaking light.","12/22/22","","https://www.nuforc.org/webreports/reports/172/S172562.html","653X2023.01.29.09.41.02",FALSE
"10/22/22 01:15","Saint Louis","MO","USA","Changing","Over 2 hours","Multiple objects observed over several hours","12/22/22","Yes","https://www.nuforc.org/webreports/reports/172/S172420.html","654X2023.01.29.09.41.02",FALSE
"10/22/22 00:58","Lakewood","CO","USA","Sphere","7 Years","4 Ships going from West to East","12/22/22","","https://www.nuforc.org/webreports/reports/172/S172432.html","655X2023.01.29.09.41.02",FALSE
"10/22/22 00:53","Grandview","MO","USA","Chevron","10 seconds","I have documented witnessing this aircraft before with Missouri MUFON. I have seen this before a few times. It's the TR6 TELOS.. PLEASE","12/22/22","","https://www.nuforc.org/webreports/reports/172/S172435.html","656X2023.01.29.09.41.02",FALSE
"10/22/22 00:30","Hawthorne","NV","USA","Other","30 Seconds","I saw this weird formation of multiple cloud shaped flying objects going against the wind.","12/22/22","","https://www.nuforc.org/webreports/reports/172/S172570.html","657X2023.01.29.09.41.02",FALSE
"10/21/22 23:40","Naples","FL","USA","Triangle","5 seconds","3 triangular shaped crafts, dark, silent, no lights, very fast, in formation","12/22/22","","https://www.nuforc.org/webreports/reports/172/S172402.html","658X2023.01.29.09.41.02",FALSE
"10/21/22 22:30","Rehoboth Beach","DE","USA","Light","lengthy and continual","After retiring to bed have straight up view of heavens. Always seem waiting for me and continuing as long as I keep looking.","12/22/22","","https://www.nuforc.org/webreports/reports/172/S172422.html","659X2023.01.29.09.41.02",FALSE
"10/21/22 22:29","Oklahoma City","OK","USA","Unknown","10 minutes","At least three flashing lights on a single craft (shape not seen), relatively large, unlike any other aircraft I see regularly.","12/22/22","","https://www.nuforc.org/webreports/reports/172/S172414.html","660X2023.01.29.09.41.02",FALSE
"10/21/22 21:15","Washington DC","DC","USA","Formation","10 seconds","I was walking home and took a picture of the monument.  ((NUFORC Note:  Lens flare caused by photographing bright lights.  PD))","12/22/22","Yes","https://www.nuforc.org/webreports/reports/172/S172442.html","661X2023.01.29.09.41.02",FALSE
"10/21/22 20:51","Washington dc","DC","USA","Formation","5 sec","I was walking home and took a few pic of the monument.  ((NUFORC Note:  Lens flares.  PD))","12/22/22","Yes","https://www.nuforc.org/webreports/reports/172/S172439.html","662X2023.01.29.09.41.02",FALSE
"10/21/22 20:31","PORT ORANGE","FL","USA","Circle","","Saw bright round appeared to be rotating.","12/22/22","","https://www.nuforc.org/webreports/reports/172/S172544.html","663X2023.01.29.09.41.02",FALSE
"10/21/22 19:30","Parker","null","USA","Other","5-10 seconds","I was just sanding outside having a smoke looking up at the sky and I saw something weird. It looked like the sky was being magnified","12/22/22","","https://www.nuforc.org/webreports/reports/172/S172440.html","664X2023.01.29.09.41.02",FALSE
"10/21/22 13:12","Taos","NM","USA","Egg","10 - 15 min","Objects appears to just pop in sight. They move slowly eastward and seem to tilt so that the sun reflects back and forth.","12/22/22","Yes","https://www.nuforc.org/webreports/reports/172/S172426.html","665X2023.01.29.09.41.02",FALSE
"10/21/22 06:19","Dennis","MA","USA","Light","2 minutes","Silent, unblinking white light moving slowly ENE at a time when no air or satellite traffic in area.","12/22/22","","https://www.nuforc.org/webreports/reports/172/S172430.html","666X2023.01.29.09.41.02",FALSE
"10/21/22 06:00","Little Rock","AR","USA","Star","at least 30 minutes","white star shaped dot moving back and forth","12/22/22","","https://www.nuforc.org/webreports/reports/172/S172450.html","667X2023.01.29.09.41.02",FALSE
"10/21/22 02:50","Kansas City","MO","USA","Formation","5 min","3 lights in formation","12/22/22","","https://www.nuforc.org/webreports/reports/172/S172441.html","668X2023.01.29.09.41.02",FALSE
"10/21/22 02:30","New Port Richey","FL","USA","Disk","45 mins","Disk shape flashing colors hovering and bouncing around","12/22/22","","https://www.nuforc.org/webreports/reports/172/S172451.html","669X2023.01.29.09.41.02",FALSE
"10/20/22 23:30","North Miami","FL","USA","Circle","A few minutes","A red glowing circle was blinking and flashing, then moved to the left quickly, then diagonally back to the right, then down and disapp","12/22/22","","https://www.nuforc.org/webreports/reports/172/S172409.html","670X2023.01.29.09.41.02",FALSE
"10/20/22 23:00","Colorado Springs","CO","USA","Circle","For about 12 minutes","6 plus circle objects","12/22/22","","https://www.nuforc.org/webreports/reports/172/S172459.html","671X2023.01.29.09.41.02",FALSE
"10/20/22 22:30","Ridgeland","SC","USA","Light","30 minutes","Military helicopter following a light","12/22/22","","https://www.nuforc.org/webreports/reports/172/S172734.html","672X2023.01.29.09.41.02",FALSE
"10/20/22 22:04","Sydney mines","NS","Canada","Triangle","20 mins each object","All shapes and sizes of craft","12/22/22","","https://www.nuforc.org/webreports/reports/172/S172472.html","673X2023.01.29.09.41.02",FALSE
"10/20/22 21:55","","MI","USA","Changing","Approximately 2-3 seconds","Never have seen anything move so quickly.","12/22/22","","https://www.nuforc.org/webreports/reports/172/S172468.html","674X2023.01.29.09.41.02",FALSE
"10/20/22 21:12","Lavon","TX","USA","Light","2-3 seconds","Light white flaring light zipped in an arc under a helicopter","12/22/22","","https://www.nuforc.org/webreports/reports/172/S172467.html","675X2023.01.29.09.41.02",FALSE
"10/20/22 20:40","San Jose","CA","USA","Fireball","45 seconds","I was driving in the hway and out of the Blue in the sky. There was a small fireball and it gets bigger. We saw it about 1 min","12/22/22","","https://www.nuforc.org/webreports/reports/172/S172458.html","676X2023.01.29.09.41.02",FALSE
"10/20/22 20:22","Jacksonville","FL","USA","Cigar","5 minutes","Cigar shaped craft no sound, bright, nothing carrying it, began to move when I started filming and faded out into thin air","12/22/22","Yes","https://www.nuforc.org/webreports/reports/172/S172443.html","677X2023.01.29.09.41.02",FALSE
"10/20/22 20:04","Washington Court House","OH","USA","Circle","Seconds","Bright orange lights triangle shape","12/22/22","","https://www.nuforc.org/webreports/reports/172/S172620.html","678X2023.01.29.09.41.02",FALSE
"10/20/22 19:45","Marion","NC","USA","Fireball","5 to 7 minutes","2 objects that looked like fire ball or very strong light moving west to east","12/22/22","","https://www.nuforc.org/webreports/reports/172/S172447.html","679X2023.01.29.09.41.02",FALSE
"10/20/22 19:30","jackson","AL","USA","Cigar","1 minute","cigar shaped large craft with twinkling lights moving slowly and making no sound","12/22/22","","https://www.nuforc.org/webreports/reports/172/S172466.html","680X2023.01.29.09.41.02",FALSE
"10/20/22 19:23","Katy","TX","USA","Other","2 minutes","A 3D CD object","12/22/22","Yes","https://www.nuforc.org/webreports/reports/172/S172462.html","681X2023.01.29.09.41.02",FALSE
"10/20/22 19:22","Mandeville","LA","USA","Rectangle","8 minutes","Formation of lights moving slowly","12/22/22","Yes","https://www.nuforc.org/webreports/reports/172/S172471.html","682X2023.01.29.09.41.02",FALSE
"10/20/22 19:20","-","NM","USA","Triangle","5 sec","Two light at each end that made up a triangle. A shooting light. A light moving away from me.","12/22/22","Yes","https://www.nuforc.org/webreports/reports/172/S172446.html","683X2023.01.29.09.41.02",FALSE
"10/20/22 16:00","Falling Waters","WV","USA","Cylinder","15 seconds","Unknown object, like skinny blimp or tube","12/22/22","","https://www.nuforc.org/webreports/reports/172/S172475.html","684X2023.01.29.09.41.02",FALSE
"10/20/22 14:00","Spring Valley","CA","USA","Light","","Some flashing/pulsing lights in the midday sky that kind of milled around","12/22/22","","https://www.nuforc.org/webreports/reports/172/S172434.html","685X2023.01.29.09.41.02",FALSE
"10/20/22 13:26","Reno","NV","USA","Circle","Approximately 2 hours","Small bright lights appear in the sky, move around, and disappear","12/22/22","Yes","https://www.nuforc.org/webreports/reports/172/S172448.html","686X2023.01.29.09.41.02",FALSE
"10/20/22 13:25","Booneville","MS","USA","Cigar","15 mins","Brightest silver cigar shape, covered & moved slowly, no blinking lights.","12/22/22","Yes","https://www.nuforc.org/webreports/reports/172/S172477.html","687X2023.01.29.09.41.02",FALSE
"10/20/22 10:04","Sacramento","CA","USA","Triangle","less than a minute","UFO Hovering over apartment complexes in the area t","12/22/22","","https://www.nuforc.org/webreports/reports/172/S172648.html","688X2023.01.29.09.41.02",FALSE
"10/20/22 08:04","Garden City","ID","","Oval","40 sec","Oval white shape following a passenger plane heading east","12/22/22","","https://www.nuforc.org/webreports/reports/172/S172980.html","689X2023.01.29.09.41.02",FALSE
"10/20/22 06:20","Archbald","PA","USA","Circle","30 minutes","We were driving to Dunmore and I noticed it getting in our car it was in the western sky pulsing red green white light","12/22/22","","https://www.nuforc.org/webreports/reports/172/S172423.html","690X2023.01.29.09.41.02",FALSE
"10/20/22 06:00","Georgetown","TX","USA","Light","3 minutes","Bright light with no normal signaling lights or anything moved across the sky. Second sighting","12/22/22","","https://www.nuforc.org/webreports/reports/172/S172649.html","691X2023.01.29.09.41.02",FALSE
"10/20/22 05:25","Schurz","NV","USA","Oval","Around three minutes","Light opens in sky, rotates, then something shoots out to the mountain","12/22/22","","https://www.nuforc.org/webreports/reports/172/S172617.html","692X2023.01.29.09.41.02",FALSE
"10/20/22 04:30","Star","ID","USA","Triangle","1min","1 aircraft NE to SW. No sound. Approx 1k AGL.","12/22/22","","https://www.nuforc.org/webreports/reports/172/S172712.html","693X2023.01.29.09.41.02",FALSE
"10/20/22 04:30","Oxford","MI","USA","Circle","5 min","A round object spinning & moving very fast","12/22/22","","https://www.nuforc.org/webreports/reports/172/S172398.html","694X2023.01.29.09.41.02",FALSE
"10/20/22 03:46","La Jolla","","USA","Light","3-5 seconds","Seen headed back north on Torey Pines Road to campus, glowing light/beaming light, at 3:46AM","12/22/22","Yes","https://www.nuforc.org/webreports/reports/172/S172456.html","695X2023.01.29.09.41.02",FALSE
"10/20/22 02:12","Toledo","OH","USA","Light","10 min","This is our second time seeing this bright light","12/22/22","Yes","https://www.nuforc.org/webreports/reports/172/S172488.html","696X2023.01.29.09.41.02",FALSE
"10/20/22 01:43","Amherst","OH","USA","Circle","1-2 seconds max","We were driving and infront of us a very large blue circle craft thing, flew and disappeared infront us within 1-2 secs it was gone","12/22/22","","https://www.nuforc.org/webreports/reports/172/S172489.html","697X2023.01.29.09.41.02",FALSE
"10/20/22 01:00","denver","CO","USA","Oval","all night","ongoing nightly star like objects but much brighter & more intense flickering","12/22/22","","https://www.nuforc.org/webreports/reports/172/S172486.html","698X2023.01.29.09.41.02",FALSE
"10/19/22 22:35","Littleton","","USA","Diamond","5-7 seconds","3 diamond shaped black objects dimly lit slowly moving across Wadsworth Blvd","12/22/22","","https://www.nuforc.org/webreports/reports/172/S172493.html","699X2023.01.29.09.41.02",FALSE
"10/19/22 21:35","Bartlesville","OK","USA","Circle","happened really fast","circle, chrome metallic look, thruster and fire trail.","12/22/22","","https://www.nuforc.org/webreports/reports/173/S173027.html","700X2023.01.29.09.41.02",FALSE
"10/19/22 21:00","Phoenix","AZ","USA","Light","2 hours at least","I saw a bright star relatively high in the sky. I noted that it was moving erratically. It moved left, right, up, down, forward, back","12/22/22","","https://www.nuforc.org/webreports/reports/172/S172491.html","701X2023.01.29.09.41.02",FALSE
"10/19/22 21:00","Palm desert","CA","USA","Other","10 minutes","Right place, right time","12/22/22","","https://www.nuforc.org/webreports/reports/172/S172816.html","702X2023.01.29.09.41.02",FALSE
"10/19/22 20:00","Cottonwood","AZ","USA","Light","30 seconds","Drove directly under there lights in triangle formation.","12/22/22","","https://www.nuforc.org/webreports/reports/172/S172494.html","703X2023.01.29.09.41.02",FALSE
"10/19/22 20:00","Cana","VA","USA","Changing","Changing shape still ther","Rather not say please contact me","12/22/22","","https://www.nuforc.org/webreports/reports/172/S172479.html","704X2023.01.29.09.41.02",FALSE
"10/19/22 20:00","Centerburg","OH","USA","Circle","39 seconds","Glowingly ball of light Chang shape instantly disappearing","12/22/22","","https://www.nuforc.org/webreports/reports/172/S172474.html","705X2023.01.29.09.41.02",FALSE
"10/19/22 19:21","Whittier","CA","USA","Light","","3 bright flashes like lightning","12/22/22","","https://www.nuforc.org/webreports/reports/172/S172412.html","706X2023.01.29.09.41.02",FALSE
"10/19/22 19:17","Franklin","TN","USA","Other","6-7 minutes","This craft seemed to stay floating in one spot and did not move. It vanished for a few seconds and seemed to change shape.","12/22/22","","https://www.nuforc.org/webreports/reports/172/S172576.html","707X2023.01.29.09.41.02",FALSE
"10/19/22 19:00","Mulga","AL","USA","Changing","All week. 2-3 hours.","I have seen several that have appeared many nights in a row.","12/22/22","","https://www.nuforc.org/webreports/reports/172/S172480.html","708X2023.01.29.09.41.02",FALSE
"10/19/22 18:30","Tucson","AZ","USA","Triangle","45 seconds","Triangle Formation of 3 lights","12/22/22","","https://www.nuforc.org/webreports/reports/172/S172499.html","709X2023.01.29.09.41.02",FALSE
"10/18/22 22:45","Rosenberg","TX","USA","Delta","Approx 25 minutes","A whitish Boomarang with a shimmering cloak","12/22/22","","https://www.nuforc.org/webreports/reports/172/S172511.html","710X2023.01.29.09.41.02",FALSE
"10/18/22 20:50","Waxhaw","NC","USA","Circle","40 seconds","I sit on my Front Porch every evening..","12/22/22","","https://www.nuforc.org/webreports/reports/172/S172416.html","711X2023.01.29.09.41.02",FALSE
"10/18/22 20:35","Shoreline","","","Circle","5 hours minimum","Mother Ship takes same route over neighborhood nightly since 8/22/2022","12/22/22","","https://www.nuforc.org/webreports/reports/172/S172497.html","712X2023.01.29.09.41.02",FALSE
"10/18/22 20:15","Chocowinity","NC","USA","Light","25 Minutes","Saw a big bright light that was zigzagging all over the place that ended up splitting into two and combining back into one.","12/22/22","","https://www.nuforc.org/webreports/reports/172/S172515.html","713X2023.01.29.09.41.02",FALSE
"10/18/22 20:00","Jacksonville","FL","USA","Chevron","15 seconds","5 blacked out aircraft in perfect formation flying north to south at approximately 500 feet at a speed of around 150 - 175 kts","12/22/22","","https://www.nuforc.org/webreports/reports/172/S172516.html","714X2023.01.29.09.41.02",FALSE
"10/18/22 19:51","SAVANNAH","GA","USA","Triangle","2.00 minutes","I seen a tranlge ship moving about 20 miles per hour...","12/22/22","","https://www.nuforc.org/webreports/reports/172/S172518.html","715X2023.01.29.09.41.02",FALSE
"10/18/22 18:00","Hampden","MA","USA","Cigar","2 minutes","Clear day, no engine sounds, did not have characteristics of a plane in the sunlight.","12/22/22","","https://www.nuforc.org/webreports/reports/172/S172482.html","716X2023.01.29.09.41.02",FALSE
"10/18/22 15:30","London","London Borough of Wandsworth","United Kingdom","Circle","Few minutes","very bright light coming and going and shifting shape","12/22/22","Yes","https://www.nuforc.org/webreports/reports/172/S172522.html","717X2023.01.29.09.41.02",FALSE
"10/18/22 12:53","Sheboygan","WI","USA","Triangle","Very brief","Accidentally photographed a UFO when I was taking pictures of the waves","12/22/22","Yes","https://www.nuforc.org/webreports/reports/173/S173004.html","718X2023.01.29.09.41.02",FALSE
"10/18/22 12:30","Gadsden","AL","USA","Unknown","Less than 25 seconds","A visual distortion of objects in night sky buy ""cloaked"" object","12/22/22","","https://www.nuforc.org/webreports/reports/172/S172487.html","719X2023.01.29.09.41.02",FALSE
"10/18/22 07:25","Rancho Palos Verdes","CA","USA","Circle","5 minutes","Line of 10 black, round objects (each approximately the size of a car) ascending quickly from the ocean to the clouds","12/22/22","Yes","https://www.nuforc.org/webreports/reports/172/S172425.html","720X2023.01.29.09.41.02",FALSE
"10/18/22 05:14","Hayden","ID","USA","Circle","Less than 5 minutes","Saw three bright lights hovering over an open field. Thought they were aircraft at first, but didn't move. Eventually faded/disappeared","12/22/22","Yes","https://www.nuforc.org/webreports/reports/172/S172433.html","721X2023.01.29.09.41.02",FALSE
"10/18/22 01:47","Zuni","NM","USA","Other","4 minutes","Seen a unknown object changing shapes and colors. When inspecting the photos, we noticed several objects changing colors and shapes.","12/22/22","Yes","https://www.nuforc.org/webreports/reports/172/S172528.html","722X2023.01.29.09.41.02",FALSE
"10/17/22 22:48","Saint James","MO","USA","Unknown","5 min","3 craft flying pallalel, no sound,","12/22/22","","https://www.nuforc.org/webreports/reports/172/S172530.html","723X2023.01.29.09.41.02",FALSE
