"Date/Time","City","State","Country","Shape","Duration","Summary","Posted","Image","URL","ID","madar"
"10/8/22 20:08","San Antonio","TX","USA","Sphere","3 minutes","Sphere flew from arms length distance to above cloud level","3/6/23","","https://www.nuforc.org/webreports/reports/174/S174492.html","924X2023.03.19.11.13.07",FALSE
"10/7/22 19:25","Redding","CA","USA","Circle","One minute 25 seconds","Recording sighting in my backyard while in the hot tub.","3/6/23","Yes","https://www.nuforc.org/webreports/reports/173/S173880.html","925X2023.03.19.11.13.07",FALSE
"10/5/22 06:51","Carrollton","MO","USA","Orb","2-5 min","Was capturing the sunrise when I saw an orb","3/6/23","Yes","https://www.nuforc.org/webreports/reports/173/S173580.html","926X2023.03.19.11.13.07",FALSE
"10/5/22 05:00","Knoxville","TN","USA","Unknown","2 days","It was a spirit that had overtook my friends body","3/6/23","Yes","https://www.nuforc.org/webreports/reports/173/S173736.html","927X2023.03.19.11.13.07",FALSE
"10/1/22 15:06","Dundalk","","USA","Other","Saw for 2-3 minutes","Saw craft hovering outside of window while in flight","3/6/23","","https://www.nuforc.org/webreports/reports/174/S174176.html","928X2023.03.19.11.13.07",FALSE
"9/30/22 19:22","Daytona Beach","FL","USA","Other","Few minutes","During Hurricane Ians visit I was filming dark clouds and saw a red streak/ light in sky","3/6/23","","https://www.nuforc.org/webreports/reports/173/S173883.html","929X2023.03.19.11.13.07",FALSE
"9/30/22 13:52","Willingboro","NJ","USA","Orb","On going","I see them often","3/6/23","","https://www.nuforc.org/webreports/reports/173/S173598.html","930X2023.03.19.11.13.07",FALSE
"9/28/22 19:46","Off the coast of Florida and Mexico","FL","USA","Light","Short times.","A round light flew past the ship at our level - 10th deck - really fast - 2 nights, last night on ship 2 of them rested on the ocean","3/6/23","","https://www.nuforc.org/webreports/reports/174/S174863.html","931X2023.03.19.11.13.07",FALSE
"9/28/22 18:54","Roswell","NM","USA","Diamond","About an hour","Noticed a diamond shaped object that did not appear to move and was brighter than any star","3/6/23","Yes","https://www.nuforc.org/webreports/reports/174/S174380.html","932X2023.03.19.11.13.07",FALSE
"9/28/22 15:11","","IA","USA","Circle","at least one hour","Large white balloon spotted hovering, moving.","3/6/23","Yes","https://www.nuforc.org/webreports/reports/174/S174286.html","933X2023.03.19.11.13.07",FALSE
"9/28/22 08:00","Toronto","ON","Canada","Cigar","2-3 seconds","Pill-capsule shaped metallic object seen from plane window","3/6/23","","https://www.nuforc.org/webreports/reports/174/S174534.html","934X2023.03.19.11.13.07",FALSE
"9/25/22 19:18","Waldport","OR","USA","Triangle","I just took a picture","Took a picture while my husband was driving","3/6/23","Yes","https://www.nuforc.org/webreports/reports/174/S174003.html","935X2023.03.19.11.13.07",FALSE
"9/24/22 21:45","Gettysburg","PA","USA","Cigar","3 minutes","It was at a diagonal with at least 20 or so orange lights that looked very close together almost square-like lights","3/6/23","Yes","https://www.nuforc.org/webreports/reports/174/S174639.html","936X2023.03.19.11.13.07",FALSE
"9/24/22 21:00","Auburn","WA","USA","Disk","Approx 2 to 4 mins","Very large disk with a lot of moving lights equally separated and the lights moved in a circular direction around the edge of the disk","3/6/23","Yes","https://www.nuforc.org/webreports/reports/173/S173590.html","937X2023.03.19.11.13.07",FALSE
"9/24/22 15:13","Manhattan","NY","USA","Light","10 minutes","Metallic object flying","3/6/23","","https://www.nuforc.org/webreports/reports/173/S173553.html","938X2023.03.19.11.13.07",FALSE
"9/23/22 04:40","Windber/Bedford","PA","USA","Triangle","20 mins","Triangular craft came out of nowhere. It hovered in front of my car from a small distance.","3/6/23","","https://www.nuforc.org/webreports/reports/174/S174436.html","939X2023.03.19.11.13.07",FALSE
"9/21/22 20:40","Ennis","TX","USA","Cylinder","1 hour","Do crafts appeared in the sky","3/6/23","","https://www.nuforc.org/webreports/reports/173/S173526.html","940X2023.03.19.11.13.07",FALSE
"9/21/22 20:00","Jackson","KY","USA","Chevron","10 minutes ten min","They were flying in to a rectangle and coming out the side of the rectangle but not near as fast they were going in.","3/6/23","","https://www.nuforc.org/webreports/reports/174/S174401.html","941X2023.03.19.11.13.07",FALSE
"9/20/22 22:22","Durham","NC","USA","Unknown","N/A","I noticed an object in one of my pictures that looked like a human falling from the sky, but I wasnt quite sure what it was.","3/6/23","Yes","https://www.nuforc.org/webreports/reports/173/S173734.html","942X2023.03.19.11.13.07",FALSE
"9/19/22 18:50","Seaside","CA","USA","Circle","4 minutes","I saw 2 unidentifiable circular objects that appeared to be floating upwards in the sky in sync together.","3/6/23","Yes","https://www.nuforc.org/webreports/reports/174/S174420.html","943X2023.03.19.11.13.07",FALSE
"9/18/22 18:57","Newport","KY","USA","Other","1 minute","Looked closer to naked eye, reflected sun","3/6/23","Yes","https://www.nuforc.org/webreports/reports/173/S173646.html","944X2023.03.19.11.13.07",FALSE
"9/15/22 03:00","Greenville","OH","USA","Oval","5 seconds","Two portals open up in sky real low.  Oval white capsule came out and enter second potral,all with no sound","3/6/23","","https://www.nuforc.org/webreports/reports/174/S174355.html","945X2023.03.19.11.13.07",FALSE
"9/14/22 21:40","Waterbury","CT","USA","Oval","15 min","Very bright Oval looking light hovering very close. Too close to be a plane. Too far to be a Drone","3/6/23","Yes","https://www.nuforc.org/webreports/reports/174/S174509.html","946X2023.03.19.11.13.07",FALSE
"9/14/22 14:26","Palm Beach County","FL","USA","Changing","1 minute","Object phasing in and out of view","3/6/23","Yes","https://www.nuforc.org/webreports/reports/174/S174752.html","947X2023.03.19.11.13.07",FALSE
"9/13/22 04:45","Las Vegas","null","","Circle","8-10 minutes","I saw a large glowing light that remained stationary for 8-10 minutes","3/6/23","Yes","https://www.nuforc.org/webreports/reports/174/S174072.html","949X2023.03.19.11.13.07",FALSE
"9/12/22 22:30","holderness","NH","USA","Oval","three minutes","Bullet shaped ray/light streaks span across sky of glowing white","3/6/23","","https://www.nuforc.org/webreports/reports/173/S173908.html","950X2023.03.19.11.13.07",FALSE
"9/10/22 21:13","Centerville","UT","USA","Disk","10 Minutes","Saw 23 illuminated disks slowly flying overhead above my home in Centerville.","3/6/23","","https://www.nuforc.org/webreports/reports/173/S173863.html","951X2023.03.19.11.13.07",FALSE
"9/8/22 07:11","Franklin couny","VA","USA","Sphere","","September 1st at 7:11 am. In Gladehill VA. In the Northeast sky","3/6/23","","https://www.nuforc.org/webreports/reports/173/S173652.html","952X2023.03.19.11.13.07",FALSE
"9/6/22 22:06","Hanover","PA","USA","Unknown","About 20+ seconds","While looking out bedroom window saw a grouping of unusual lights in sky.. watched for a couple of minutes then lights started moving","3/6/23","","https://www.nuforc.org/webreports/reports/173/S173934.html","953X2023.03.19.11.13.07",FALSE
"9/4/22 15:30","Montara","California","United States","Cylinder","1-2 minutes","Large cylindrical structure was seen at the top of mountain adjacent Montara State Beach area in the vicinity of Montara CA.","3/6/23","","https://www.nuforc.org/webreports/reports/173/S173810.html","954X2023.03.19.11.13.07",FALSE
"9/3/22 05:11","Pine Grove","PA","USA","Star","4-5 minutes","Circular light resembling a star moving very erratically in the sky.","3/6/23","","https://www.nuforc.org/webreports/reports/173/S173529.html","955X2023.03.19.11.13.07",FALSE
"9/1/22 08:00","Bonney Lake","WA","USA","Orb","3 minutes","Round orb accelerating toward sky","3/6/23","","https://www.nuforc.org/webreports/reports/173/S173639.html","956X2023.03.19.11.13.07",FALSE
"8/27/22 20:40","Whitesboro","NY","USA","Cylinder","5 minutes","Cylinder shape coming over my roof, then rises and slowly hovers in sky","3/6/23","","https://www.nuforc.org/webreports/reports/173/S173961.html","957X2023.03.19.11.13.07",FALSE
"8/26/22 14:09","Justice","IL","USA","Circle","5. Min","It moved towards my area slowly and as it got closer it began to change shape","3/6/23","Yes","https://www.nuforc.org/webreports/reports/173/S173962.html","958X2023.03.19.11.13.07",FALSE
"8/26/22 05:15","Georgetown","SC","USA","Sphere","","I all most had three heart attacks in my car","3/6/23","","https://www.nuforc.org/webreports/reports/173/S173946.html","959X2023.03.19.11.13.07",FALSE
"8/23/22 21:41","Longmont","CO","USA","Fireball","2 min","One fireball light in the sky hovering over pine Trees , then 45 seconds to a minute later another fireball slowly comes down from the","3/6/23","","https://www.nuforc.org/webreports/reports/173/S173533.html","960X2023.03.19.11.13.07",FALSE
"8/18/22 18:36","Louisville","KY","USA","Rectangle","10-secs","UAP was described as a ""tumbling"" (rotating) cube which flew upweards and out of site.","3/6/23","","https://www.nuforc.org/webreports/reports/173/S173713.html","961X2023.03.19.11.13.07",FALSE
"8/18/22 15:00","DuPont","WA","USA","Orb","5 minutes","I was walking my dog with my husband on Mounts Road traveling South.","3/6/23","","https://www.nuforc.org/webreports/reports/174/S174067.html","962X2023.03.19.11.13.07",FALSE
"8/17/22 17:36","Anchorage","AK","USA","Sphere","very brief","Approximately 3 objects observed, along with passenger jet in Anchorage","3/6/23","Yes","https://www.nuforc.org/webreports/reports/173/S173854.html","963X2023.03.19.11.13.07",FALSE
"8/16/22 22:03","Wakefield","England","United Kingdom","Cigar","15-20 second","LARGE White with mid glow cigar/rugby ball shape","3/6/23","Yes","https://www.nuforc.org/webreports/reports/173/S173900.html","964X2023.03.19.11.13.07",FALSE
"8/11/22 14:00","Deridder","LA","USA","Unknown","2 mins","Dark object/ thought it was a big black bird from a distant","3/6/23","","https://www.nuforc.org/webreports/reports/174/S174308.html","965X2023.03.19.11.13.07",FALSE
"8/9/22 15:42","Mt. Rainier National Park- Ashford, WA","WA","USA","Cylinder","","Possible UFO in a picture of Mt. Rainier.","3/6/23","Yes","https://www.nuforc.org/webreports/reports/174/S174456.html","966X2023.03.19.11.13.07",FALSE
"8/8/22 17:35","Linthicum","MD","USA","Sphere","1 picture","While taking picture of a rainbow for my wife who is disabled, I took the picture and after cleaning out photos from my phone","3/6/23","Yes","https://www.nuforc.org/webreports/reports/173/S173832.html","967X2023.03.19.11.13.07",FALSE
"8/8/22 15:30","North Highlands","","","Circle","5 minutes","Saw round shaped object in sky at 3:30 pm object just hovered for a few minutes","3/6/23","Yes","https://www.nuforc.org/webreports/reports/174/S174292.html","968X2023.03.19.11.13.07",FALSE
"8/8/22 13:55","Woodley","Oxfordshire","United Kingdom","Cigar","13 minutes","The craft appeared to be a high level balloon but moved in a triangular section obviously powered .","3/6/23","Yes","https://www.nuforc.org/webreports/reports/174/S174495.html","969X2023.03.19.11.13.07",FALSE
"8/8/22 10:22","West midlands","Solihull","United Kingdom","Oval","20","I sighted 3 objects traveling in line high in the atmosphere.","3/6/23","Yes","https://www.nuforc.org/webreports/reports/174/S174504.html","970X2023.03.19.11.13.07",FALSE
"8/7/22 17:27","Simpsonville","SC","USA","Teardrop","","Was taking pictures of the sky noticed the tear drop or bullet shaped object going in two opposite directions over split seconds","3/6/23","","https://www.nuforc.org/webreports/reports/173/S173896.html","971X2023.03.19.11.13.07",FALSE
"8/6/22 12:00","Marienville","PA","USA","Sphere","4-5 minutes","Daytime silver, very bright object followed by dull grey then another bright star super bright silver","3/6/23","","https://www.nuforc.org/webreports/reports/173/S173925.html","972X2023.03.19.11.13.07",FALSE
"8/3/22 22:30","San Antonio","TX","USA","Triangle","From that day until now","We have experience this phenomenon since August 3 and every day since. One of these stars actually grabbed my car in mid air.","3/6/23","","https://www.nuforc.org/webreports/reports/174/S174896.html","973X2023.03.19.11.13.07",FALSE
"7/31/22 05:04","","","USA","Orb","10 min","I caught the white orb on camera I also had what look like a star w blinking lights like a rainbow","3/6/23","","https://www.nuforc.org/webreports/reports/173/S173582.html","974X2023.03.19.11.13.07",FALSE
"7/28/22 22:30","South Shields","","United Kingdom","Oval","10-20 seconds","We watched glowing oval shape object fly past us","3/6/23","","https://www.nuforc.org/webreports/reports/173/S173596.html","975X2023.03.19.11.13.07",FALSE
"7/25/22 23:15","Garden city","SC","USA","Fireball","1 hour","Multiple orbs of light over the ocean","3/6/23","","https://www.nuforc.org/webreports/reports/174/S174426.html","976X2023.03.19.11.13.07",FALSE
"7/23/22 21:30","Allentown","PA","USA","","","Spike in magnetometer field","3/6/23","","https://www.nuforc.org/webreports/reports/173/S173697.html","977X2023.03.19.11.13.07",FALSE
"7/23/22 16:00","Wright City","MO","USA","Sphere","15-20 minutes","Several spheres looking like Mylar balloons, but doing incredible manuevers, about 100 yards above.","3/6/23","","https://www.nuforc.org/webreports/reports/174/S174212.html","978X2023.03.19.11.13.07",FALSE
"7/22/22 22:50","McKinney","TX","USA","Cigar","sev mins","Witnesses reported a gray cigar-shaped object traveling north.","3/6/23","","https://www.nuforc.org/webreports/reports/173/S173728.html","980X2023.03.19.11.13.07",FALSE
"7/22/22 22:30","Redding","CA","USA","Cylinder","2 min","The cylinder seemed transparent with swirling red,orange and yellow particles and a detached sphere behind it.","3/6/23","","https://www.nuforc.org/webreports/reports/174/S174745.html","981X2023.03.19.11.13.07",FALSE
"7/21/22 22:01","Muskegon","MI","USA","Diamond","2 seconds","We were Taking photographs of lightning strikes when we saw a disc come from under the lake","3/6/23","Yes","https://www.nuforc.org/webreports/reports/174/S174150.html","982X2023.03.19.11.13.07",FALSE
"7/20/22 21:00","Hurley","NY","USA","Circle","Dont know","Looked at moon saw strange light next to it took pictures","3/6/23","Yes","https://www.nuforc.org/webreports/reports/174/S174118.html","983X2023.03.19.11.13.07",FALSE
"7/18/22 16:00","Trenton","TX","USA","Triangle","Between 5 and 10 seconds","This thing appeared to be huge. Only caught a glimpse because it was mostly cloudy. The altitude appeared to be very high.","3/6/23","","https://www.nuforc.org/webreports/reports/173/S173627.html","984X2023.03.19.11.13.07",FALSE
"7/17/22 13:51","Caribou","ME","USA","Unknown","It stayed","Weird and exciting","3/6/23","","https://www.nuforc.org/webreports/reports/173/S173903.html","985X2023.03.19.11.13.07",FALSE
"7/15/22 22:34","Johnstown","PA","USA","Triangle","10 seconds","Lights; triangle shaped fast than slow","3/6/23","","https://www.nuforc.org/webreports/reports/173/S173532.html","986X2023.03.19.11.13.07",FALSE
"7/15/22 18:30","yarmouth","ME","USA","Circle","10-15 minutes","We saw a white dot in the blue sky that stayed still for a prolonged period of time.","3/6/23","","https://www.nuforc.org/webreports/reports/174/S174297.html","987X2023.03.19.11.13.07",FALSE
"7/15/22 15:33","Pilot Mountain","NC","USA","Disk","5 min","Awakened by bright light feeling house went on porch saw disk with lights","3/6/23","","https://www.nuforc.org/webreports/reports/174/S174445.html","988X2023.03.19.11.13.07",FALSE
"7/12/22 10:00","Arnolds Cove","","Canada","Cylinder","5 minutes","Floated across the sky from the west to east over the Come by chance refinery.","3/6/23","","https://www.nuforc.org/webreports/reports/174/S174368.html","989X2023.03.19.11.13.07",FALSE
"7/9/22 15:15","Spencerville","IN","USA","Disk","1-2 mins","round object traveling from right to left (E-W) at a high rate of speed. The object was traveling faster than anything he had ever seen","3/6/23","","https://www.nuforc.org/webreports/reports/173/S173718.html","993X2023.03.19.11.13.07",FALSE
"7/6/22 23:46","Lancaster","PA","USA","Circle","3-5 minutes","Absolutely silent UFO hovering over my car.","3/6/23","","https://www.nuforc.org/webreports/reports/174/S174037.html","994X2023.03.19.11.13.07",FALSE
"7/4/22 21:22","Middleburg","FL","USA","Disk","20 seconds","Was watching fireworks and saw this red orb in the sky that wasnt moving for falling like the fireworks. Got a photo of it as well.","3/6/23","Yes","https://www.nuforc.org/webreports/reports/173/S173586.html","995X2023.03.19.11.13.07",FALSE
"7/4/22 00:47","Vandergrift","PA","USA","Formation","Approximately couple minu","5 blue strobe lights grayish silver craft in a protective formation headed or led by bright white orb to left of the craft","3/6/23","","https://www.nuforc.org/webreports/reports/174/S174128.html","996X2023.03.19.11.13.07",FALSE
"7/2/22 01:13","San Jacinto","CA","USA","Oval","2-3 minutes","My son and I were traveling in a sedan EASTbound, from Nuevo, CA. and noticed this oval shaped floating object!!","3/6/23","","https://www.nuforc.org/webreports/reports/173/S173739.html","998X2023.03.19.11.13.07",FALSE
"6/29/22 00:00","Carson City","NV","USA","Other","10-15 seconds","Blue Bioluminescent like object that appeared to be ""swimming"" across the sky.","3/6/23","","https://www.nuforc.org/webreports/reports/174/S174899.html","999X2023.03.19.11.13.07",FALSE
"6/26/22 18:27","Spring Valley","CA","USA","Circle",">15 minutes","It appeared to be a large, round object, motionless, at an extreme altitude..","3/6/23","Yes","https://www.nuforc.org/webreports/reports/174/S174408.html","1000X2023.03.19.11.13.07",FALSE
"6/20/22 21:00","","ON","Canada","Cylinder","26 seconds","Took a video of a travelling cylinder shape object next to the airplane I was sitting in.","3/6/23","","https://www.nuforc.org/webreports/reports/174/S174675.html","1001X2023.03.19.11.13.07",FALSE
"6/19/22 17:47","McKees Rocks","PA","USA","Sphere","seconds","Silver object came out of the north and crossed overhead.","3/6/23","","https://www.nuforc.org/webreports/reports/173/S173700.html","1002X2023.03.19.11.13.07",FALSE
"6/19/22 01:15","Davisville","","","Changing","3 minutes","It was a slow moving object that shot off a ring of smoke or mist","3/6/23","Yes","https://www.nuforc.org/webreports/reports/173/S173929.html","1004X2023.03.19.11.13.07",FALSE
"6/17/22 15:30","Coppell","TX","USA","Cylinder","55 Seconds","Sighted Cylinder Coned Craft, Brass Colored, Looked Like Two Helium Balloons, Spinning, Flashing","3/6/23","","https://www.nuforc.org/webreports/reports/174/S174006.html","1005X2023.03.19.11.13.07",FALSE
"6/16/22 20:50","Sydney","New South Wales","Australia","Other","Few seconds","Huge boomerang shape wing","3/6/23","","https://www.nuforc.org/webreports/reports/174/S174397.html","1006X2023.03.19.11.13.07",FALSE
"6/16/22 18:40","Gresham","OR","USA","Orb","15. Seconds","Visual sighting of 3. Orbs at high speeds.","3/6/23","","https://www.nuforc.org/webreports/reports/174/S174077.html","1007X2023.03.19.11.13.07",FALSE
"6/15/22 06:30","caraguatatuba","São Paulo","Brazil","Disk","2 minutes","Brilliant ufo on atlantic rainforest","3/6/23","","https://www.nuforc.org/webreports/reports/174/S174793.html","1008X2023.03.19.11.13.07",FALSE
"6/10/22 01:00","Houston","TX","USA","Changing","10 minutes","A large ship hovering over a warehouse","3/6/23","Yes","https://www.nuforc.org/webreports/reports/173/S173817.html","1009X2023.03.19.11.13.07",FALSE
"6/6/22 14:30","Chillicothe","OH","USA","Disk","Im not exactly sure","All I remember is what I assume the end of the abduction was.","3/6/23","","https://www.nuforc.org/webreports/reports/173/S173704.html","1010X2023.03.19.11.13.07",FALSE
"6/6/22 13:00","Uluru / The Olgas (Kata Juta)","Northern Territory","Australia","Orb","5-10 secs","Silver metallic orb sitting perfectly still then zoomed away easily and very fast after 5 or so seconds","3/6/23","","https://www.nuforc.org/webreports/reports/173/S173841.html","1011X2023.03.19.11.13.07",FALSE
"6/6/22 06:00","Oakland","","","Changing","3 seconds","Undocumented craft or animal","3/6/23","Yes","https://www.nuforc.org/webreports/reports/174/S174139.html","1012X2023.03.19.11.13.07",FALSE
"6/6/22 06:00","oakland","CA","USA","Changing","sighting was maybe 2 secs","there was a small 2ft bird like creature or odd craft. flew past my mini 2 camera while in flight","3/6/23","","https://www.nuforc.org/webreports/reports/173/S173967.html","1013X2023.03.19.11.13.07",FALSE
"6/6/22 05:34","Mary Esther","FL","USA","Other","Around two to three secs","Little Green lighted circular ball traveling south to North","3/6/23","","https://www.nuforc.org/webreports/reports/174/S174497.html","1014X2023.03.19.11.13.07",FALSE
"6/2/22 21:04","Searcy","AR","USA","Circle","At least 5 minutes","Circular spinning light with a glow all the way around","3/6/23","","https://www.nuforc.org/webreports/reports/173/S173800.html","1016X2023.03.19.11.13.07",FALSE
"6/2/22 15:37","Box Hill South","Victoria","Australia","Chevron","around 3 seconds","Poto shot","3/6/23","Yes","https://www.nuforc.org/webreports/reports/173/S173774.html","1017X2023.03.19.11.13.07",FALSE
"5/27/22 05:04","Sleepy Hollow","IL","USA","Rectangle","Seconds","Rectangle shaped floating object crossed in front of my mom&I-Driving&disappeared-Resembled a pick up truck size w/out a cab/wheels","3/6/23","","https://www.nuforc.org/webreports/reports/173/S173973.html","1018X2023.03.19.11.13.07",FALSE
"5/21/22 13:22","Fond Du Lac","WI","USA","Disk","2 minutes","Daylight sighting of a large silver disc type object.","3/6/23","","https://www.nuforc.org/webreports/reports/174/S174791.html","1019X2023.03.19.11.13.07",FALSE
"5/16/22 16:19","Kill Devil Hills","NC","USA","Disk","Not sure","I didnt notice until someone pointed it out","3/6/23","Yes","https://www.nuforc.org/webreports/reports/174/S174283.html","1020X2023.03.19.11.13.07",FALSE
"5/13/22 17:30","45 min-ish In-Flight from SLC to DAL over Utah Mountains","UT","USA","Sphere","1 second","saw a sphere zoom past while travelling in an Airplane","3/6/23","","https://www.nuforc.org/webreports/reports/174/S174241.html","1021X2023.03.19.11.13.07",FALSE
"5/8/22 22:38","Tennille","GA","USA","Fireball","I minute","I was recording a white blinkin light moving erratically across state Hwy 68 when a fireball looking object quickly came from west","3/6/23","","https://www.nuforc.org/webreports/reports/173/S173716.html","1022X2023.03.19.11.13.07",FALSE
"5/3/22 15:00","Las vegas","NV","USA","Orb","2009 n 2022","Inciden","3/6/23","","https://www.nuforc.org/webreports/reports/174/S174102.html","1023X2023.03.19.11.13.07",FALSE
"5/1/22 22:00","Austin","TX","USA","Other","Maybe 1 minute","It looked like a swirling school of fish made out of lights","3/6/23","","https://www.nuforc.org/webreports/reports/173/S173745.html","1025X2023.03.19.11.13.07",FALSE
"5/1/22 15:06","Pasadena","CA","USA","Light","< 5 minutes","Video of zigzagging light during the day.","3/6/23","","https://www.nuforc.org/webreports/reports/173/S173611.html","1026X2023.03.19.11.13.07",FALSE
"4/26/22 04:47","San Dimas","CA","USA","Sphere","Like 5 min","Saw 2 bright sphere , 1 disappeared 1 change shape like a banana shape small then big very low for 5 min it disappeared faded Light","3/6/23","","https://www.nuforc.org/webreports/reports/174/S174263.html","1027X2023.03.19.11.13.07",FALSE
"4/22/22 06:25","Gray","TN","USA","Cigar","Several minutes","My husband and I were looking at it and rear-ended car in front of us","3/6/23","","https://www.nuforc.org/webreports/reports/174/S174362.html","1028X2023.03.19.11.13.07",FALSE
"4/16/22 04:44","Vandergrift","PA","USA","Formation","3 minutes then sonic boom","4 Grey craft around strobe blue craft all heading toward large white orb","3/6/23","","https://www.nuforc.org/webreports/reports/174/S174526.html","1029X2023.03.19.11.13.07",FALSE
"4/12/22 20:00","Stoke-on-Trent","Staffordshire","United Kingdom","Other","5mins","A vertical thin bright light and ufos coming out of nowhere","3/6/23","","https://www.nuforc.org/webreports/reports/174/S174269.html","1030X2023.03.19.11.13.07",FALSE
"4/1/22 21:55","Kansas City","MO","USA","Rectangle","8 to 10 minutes","Black rectangular craft with white, green and red lights on sides","3/6/23","","https://www.nuforc.org/webreports/reports/173/S173647.html","1031X2023.03.19.11.13.07",FALSE
"3/19/22 10:10","","","United Kingdom","Sphere","5 seconds","Sphere with reflective rectangles on floating past/below airplane as I flew from England to Scotland","3/6/23","","https://www.nuforc.org/webreports/reports/174/S174518.html","1032X2023.03.19.11.13.07",FALSE
"3/13/22 08:00","Hallandale","FL","USA","Other","5 days","After waking up and taking a shower I noticed on my right bicep a strange mark shaped like a circle with","3/6/23","Yes","https://www.nuforc.org/webreports/reports/174/S174490.html","1033X2023.03.19.11.13.07",FALSE
"3/5/22 22:55","Brecon","Powys","United Kingdom","Triangle","Five to ten minutes","Not sure what to put in this bit.","3/6/23","Yes","https://www.nuforc.org/webreports/reports/173/S173954.html","1034X2023.03.19.11.13.07",FALSE
"3/3/22 19:30","Nashville","TN","USA","Circle","20 - 25 sec","Lighted up as passenger jet was flying past it","3/6/23","","https://www.nuforc.org/webreports/reports/174/S174424.html","1035X2023.03.19.11.13.07",FALSE
"2/15/22 04:00","Dahlonega","GA","USA","Light","Approx 5 minutes","Sudden bright white almost blue light appears","3/6/23","Yes","https://www.nuforc.org/webreports/reports/173/S173546.html","1036X2023.03.19.11.13.07",FALSE
