"Date/Time","City","State","Country","Shape","Duration","Summary","Posted","Image","URL","ID","madar"
"1/12/23 19:30","CHESTERFIELD","MO","USA","Unknown","a couple seconds","A massive black object with no lights flying ultra low over our home.","3/6/23","","https://www.nuforc.org/webreports/reports/173/S173898.html","611X2023.03.19.11.13.07",FALSE
"1/12/23 19:24","Lindsay","CA","USA","Light","Everynight past 3 years","Almost every night for the last 3 years these lights that change color green or orange show up wherever I am they just hover and follow","3/6/23","Yes","https://www.nuforc.org/webreports/reports/173/S173957.html","612X2023.03.19.11.13.07",FALSE
"1/12/23 18:55","ORLANDO","FL","USA","Light","10 mins","Balls of light in the sky flying in a row","3/6/23","","https://www.nuforc.org/webreports/reports/173/S173884.html","613X2023.03.19.11.13.07",FALSE
"1/12/23 18:36","Kirkland","AZ","USA","Circle","20-35 seconds","3 white/orange rings of light","3/6/23","","https://www.nuforc.org/webreports/reports/174/S174188.html","614X2023.03.19.11.13.07",FALSE
"1/12/23 18:08","","","USA","Cigar","7 or more","There was one triangle shaped craft and many dots around it.","3/6/23","Yes","https://www.nuforc.org/webreports/reports/174/S174623.html","615X2023.03.19.11.13.07",FALSE
"1/12/23 17:30","Orlando","FL","USA","Unknown","unknown","An emerald green sphere in the sky noted in picture and when enhanced it appears to be a spacecraft.","3/6/23","Yes","https://www.nuforc.org/webreports/reports/173/S173963.html","616X2023.03.19.11.13.07",FALSE
"1/12/23 11:00","El Centro","CA","USA","Circle","2hrs","While looking at my security camera I noticed 2 silver objects hovering above ground.","3/6/23","","https://www.nuforc.org/webreports/reports/173/S173971.html","617X2023.03.19.11.13.07",FALSE
"1/12/23 05:12","Dobson","NC","USA","Triangle","a few seconds","Heard odd sound, saw triangular craft, three red lights, flying low as it passed overhead.","3/6/23","","https://www.nuforc.org/webreports/reports/174/S174082.html","618X2023.03.19.11.13.07",FALSE
"1/12/23 00:30","Winston-Salem","NC","USA","Cigar","1-2 minutes","My sister and I heard low humming that shook the house at around 12:30 AM, my sister viewed the cigar shaped craft go over some trees.","3/6/23","","https://www.nuforc.org/webreports/reports/173/S173942.html","619X2023.03.19.11.13.07",FALSE
"1/11/23 22:37","Colchester","VT","USA","Oval","Several hours","These oval crafts surrounded by white lights hovering and moving around in the sky I have been observing for the past twelve years. In","3/6/23","","https://www.nuforc.org/webreports/reports/173/S173867.html","620X2023.03.19.11.13.07",FALSE
"1/11/23 21:31","Big cypress national preserve","FL","USA","Sphere","about 10 minutes","While driving down this very long route in the middle of nowhere florida I spotted these very bright flying objects","3/6/23","Yes","https://www.nuforc.org/webreports/reports/174/S174483.html","621X2023.03.19.11.13.07",FALSE
"1/11/23 20:01","wilmington","DE","USA","Fireball","","Me and everyone outside saw it from the street.","3/6/23","","https://www.nuforc.org/webreports/reports/173/S173861.html","622X2023.03.19.11.13.07",FALSE
"1/11/23 19:55","Palm Bay","FL","USA","Cigar","15 seconds","Bright green object flew over house","3/6/23","","https://www.nuforc.org/webreports/reports/173/S173862.html","623X2023.03.19.11.13.07",FALSE
"1/11/23 19:35","Altadena","CA","USA","Oval","fly over 5 seconds","Almost invisible except for oval ring glowing a slight green","3/6/23","","https://www.nuforc.org/webreports/reports/173/S173866.html","624X2023.03.19.11.13.07",FALSE
"1/11/23 19:22","Palm Bay","FL","USA","Unknown","2-3 minutes","2 stationary lights in separate locations became mobile","3/6/23","","https://www.nuforc.org/webreports/reports/173/S173860.html","625X2023.03.19.11.13.07",FALSE
"1/11/23 19:10","HONOLULU","HI","USA","Sphere","3 minutes","A brilliant small circle of light, high in the sky, no sound, travelled from the South Shore near Honolulu to the Northeast Oahu","3/6/23","","https://www.nuforc.org/webreports/reports/173/S173871.html","626X2023.03.19.11.13.07",FALSE
"1/11/23 18:41","Quincy","IL","USA","Changing","10 minutes-ish","Object floatimg and strobing brightness, after time it moves changes color etc. Not normal, not helicopter or plane or drone","3/6/23","Yes","https://www.nuforc.org/webreports/reports/174/S174227.html","627X2023.03.19.11.13.07",FALSE
"1/11/23 18:39","Pleasant Valley","AK","USA","Disk","17 seconds","I was driving home when I looked up at a large bright disk like object and after a few moments it flew down and away.","3/6/23","","https://www.nuforc.org/webreports/reports/173/S173930.html","628X2023.03.19.11.13.07",FALSE
"1/11/23 18:20","Oro Valley","AZ","USA","Light","5-15 seconds","Lighted object traveling north bound at a high elevation and at a high rate of speed curved to the Northeast","3/6/23","Yes","https://www.nuforc.org/webreports/reports/173/S173865.html","629X2023.03.19.11.13.07",FALSE
"1/11/23 12:18","","","USA","Circle","Minutes","It was a busy night. I assumed it was dps drones. Seemed to intuitive movements as I watched going up and down looking like it was surv","3/6/23","","https://www.nuforc.org/webreports/reports/173/S173856.html","630X2023.03.19.11.13.07",FALSE
"1/11/23 11:44","Delray Beach","FL","USA","Chevron","90 seconds","I looked up and saw 2 black V shaped objects at a higher altitude moving very fast with no vapor trail sound or exhaust","3/6/23","","https://www.nuforc.org/webreports/reports/173/S173842.html","631X2023.03.19.11.13.07",FALSE
"1/11/23 08:00","Broomfield","CO","USA","Circle","minutes","Jan 11th I saw an object in the sky that matched the object over Billings, MT.","3/6/23","","https://www.nuforc.org/webreports/reports/174/S174512.html","632X2023.03.19.11.13.07",FALSE
"1/11/23 05:10","Tallahassee","FL","USA","Other","30 second","It appeared to look similar to the starlink satellite picture but disappeared from sight and couldn't be tracked even in my vehicle.","3/6/23","","https://www.nuforc.org/webreports/reports/173/S173844.html","633X2023.03.19.11.13.07",FALSE
"1/11/23 02:33","Newberg","OR","USA","Triangle","Roughly 13 minutes","This craft was MASSIVE","3/6/23","","https://www.nuforc.org/webreports/reports/174/S174385.html","634X2023.03.19.11.13.07",FALSE
"1/11/23 01:30","gresham","OR","USA","Cylinder","3 seconds","Black silhouetted object, no lights, no noise, barely discernible because the object blended into the night sky so well","3/6/23","","https://www.nuforc.org/webreports/reports/174/S174779.html","635X2023.03.19.11.13.07",FALSE
"1/11/23 00:00","Polk City","FL","USA","Other","2 minutes 4 minutes","Looked like a jelly fish shaped force field with 2 lights that separated from it and went in different directions and one lit up","3/6/23","","https://www.nuforc.org/webreports/reports/173/S173830.html","636X2023.03.19.11.13.07",FALSE
"1/10/23 22:45","Corona","CA","USA","Fireball","Objects spotted 2 minutes","Several Craft changing shape","3/6/23","Yes","https://www.nuforc.org/webreports/reports/173/S173872.html","637X2023.03.19.11.13.07",FALSE
"1/10/23 21:42","Kingwood","NJ","USA","Light","3 minutes","Two bright white objects","3/6/23","","https://www.nuforc.org/webreports/reports/173/S173822.html","638X2023.03.19.11.13.07",FALSE
"1/10/23 21:13","Hamilton","VA","USA","Changing","A minute","A flashing orb that projected different shapes and disappeared","3/6/23","","https://www.nuforc.org/webreports/reports/173/S173864.html","639X2023.03.19.11.13.07",FALSE
"1/10/23 19:58","Kawartha lakes","ON","Canada","Light","I saw it for 15 minutes","A light in the sky that was blue green and red","3/6/23","","https://www.nuforc.org/webreports/reports/173/S173850.html","640X2023.03.19.11.13.07",FALSE
"1/10/23 18:45","Spicewood","TX","USA","Fireball","15 seconds","Sitting in the second level of my home at around 6:45 p.m. saw a really bright light that resembled a ball of fire with a tail","3/6/23","","https://www.nuforc.org/webreports/reports/173/S173849.html","641X2023.03.19.11.13.07",FALSE
"1/10/23 17:10","Danville","CA","USA","Light","1 minute at least","Stationary Craft of a luminous appearance at high altitude","3/6/23","Yes","https://www.nuforc.org/webreports/reports/174/S174009.html","642X2023.03.19.11.13.07",FALSE
"1/10/23 16:50","Oxnard","CA","USA","Other","3 minutes","Beautiful Blue Ball of Light with a Light Blue Image right behind","3/6/23","Yes","https://www.nuforc.org/webreports/reports/174/S174062.html","643X2023.03.19.11.13.07",FALSE
"1/10/23 15:05","Cumming","GA","USA","Egg","45 seconds","White craft with no wings, exhaust, lights moving fast and pretty low","3/6/23","Yes","https://www.nuforc.org/webreports/reports/173/S173846.html","644X2023.03.19.11.13.07",FALSE
"1/10/23 15:00","Sebring","FL","USA","Other","2-3 seconds","Silver reflective circle high up in sky","3/6/23","","https://www.nuforc.org/webreports/reports/173/S173840.html","645X2023.03.19.11.13.07",FALSE
"1/10/23 07:15","Salem","OR","USA","Cigar","15 minutes","Large fat cigar shaped 2 miles south of Salem hovering with 2 large lights light head lights thought it was a bus size drone","3/6/23","","https://www.nuforc.org/webreports/reports/173/S173879.html","646X2023.03.19.11.13.07",FALSE
"1/10/23 00:20","Sunrise","FL","USA","Orb","15 minutes","Noticed one bright orange ball in sky then two more balls coming from that one and the two were moving.","3/6/23","","https://www.nuforc.org/webreports/reports/173/S173829.html","647X2023.03.19.11.13.07",FALSE
"1/10/23 00:00","Ocala","FL","USA","Fireball","White","Bright blue light appeared in sky nw of my location about 2 miles out got bright cought fire turned into two","3/6/23","","https://www.nuforc.org/webreports/reports/173/S173827.html","648X2023.03.19.11.13.07",FALSE
"1/9/23 23:51","Orlando","FL","USA","Fireball","10 minutes","Saw fire ball flying","3/6/23","","https://www.nuforc.org/webreports/reports/173/S173848.html","649X2023.03.19.11.13.07",FALSE
"1/9/23 23:50","Carrollwood","FL","USA","Cone","Revised 8 mins on and off","3 craft seen with Orange glow seen twice from larger of craft in an area not known for sightings.","3/6/23","","https://www.nuforc.org/webreports/reports/173/S173831.html","650X2023.03.19.11.13.07",FALSE
"1/9/23 23:50","Vero Beach","FL","USA","Changing","2 minutes","Two strange vapor trails and an exposion","3/6/23","","https://www.nuforc.org/webreports/reports/173/S173837.html","651X2023.03.19.11.13.07",FALSE
"1/9/23 20:00","Wilmington","OH","USA","Unknown","Zero","Followup to my earlier report","3/6/23","","https://www.nuforc.org/webreports/reports/173/S173851.html","652X2023.03.19.11.13.07",FALSE
"1/9/23 19:21","Linden","MI","USA","Formation","60 seconds","Many orbs flying east sooooo fast","3/6/23","","https://www.nuforc.org/webreports/reports/173/S173825.html","653X2023.03.19.11.13.07",FALSE
"1/9/23 17:50","Milford","CT","USA","Unknown","5 seconds","18 btw. I was outside with friend. Saw white circle then turn into flames, then go down right to left. Then 5 min later same thing L-R","3/6/23","Yes","https://www.nuforc.org/webreports/reports/173/S173819.html","654X2023.03.19.11.13.07",FALSE
"1/9/23 17:35","Chesterfield","VA","USA","Cylinder","5 seconds","Thought it was small meteor or back of a missile (Ive never seen one). But it was extraordinary fast with no sound. Parallel to tree.","3/6/23","","https://www.nuforc.org/webreports/reports/173/S173821.html","655X2023.03.19.11.13.07",FALSE
"1/9/23 17:27","Calverton","NY","USA","Light","10 seconds","Started as a very faint light that began to move at almost lighting speed that eventually turned into a massive ball of fire","3/6/23","","https://www.nuforc.org/webreports/reports/173/S173818.html","656X2023.03.19.11.13.07",FALSE
"1/9/23 17:25","Bridgewater","NJ","USA","Circle","10-15 seconds","Flying ball of extreme bright pulsating white light","3/6/23","","https://www.nuforc.org/webreports/reports/173/S173826.html","657X2023.03.19.11.13.07",FALSE
"1/9/23 16:30","Yokohama","Kanagawa Prefecture","Japan","Formation","10","4-6 ufos flying slowly in a parallel formation","3/6/23","Yes","https://www.nuforc.org/webreports/reports/173/S173835.html","658X2023.03.19.11.13.07",FALSE
"1/9/23 14:36","Winter Park","FL","USA","Circle","2 minutes","I saw a blue light not moving in the Sky and other lights coming afterwards like shooting starts. This is happening very daily","3/6/23","Yes","https://www.nuforc.org/webreports/reports/173/S173852.html","659X2023.03.19.11.13.07",FALSE
"1/9/23 08:00","Wilmington","OH","USA","Unknown","Approximately 20 minutes","Colorful spot in the sky","3/6/23","","https://www.nuforc.org/webreports/reports/173/S173834.html","660X2023.03.19.11.13.07",FALSE
"1/9/23 04:05","Joplin","MO","USA","Light","15+ minutes","White light moving left and right slowly cycling bright to dim","3/6/23","","https://www.nuforc.org/webreports/reports/173/S173806.html","661X2023.03.19.11.13.07",FALSE
"1/9/23 03:55","Tohatchi","NM","USA","Orb","15 mins","Big bright spherical orbs moving in many directions and stationary like flying in maneuvers.","3/6/23","Yes","https://www.nuforc.org/webreports/reports/173/S173983.html","662X2023.03.19.11.13.07",FALSE
"1/8/23 21:45","Northglenn","CO","USA","Light","10 seconds","Fast moving lights.","3/6/23","","https://www.nuforc.org/webreports/reports/173/S173807.html","663X2023.03.19.11.13.07",FALSE
"1/8/23 17:54","North York","ON","Canada","Light","52 seconds","It had an orange yellow light in the center and it was definitely not an airplane. It was traveling straight across.","3/6/23","","https://www.nuforc.org/webreports/reports/173/S173799.html","664X2023.03.19.11.13.07",FALSE
"1/8/23 17:30","Lakeville","MA","USA","Light","slow decent for hours","This report is a further defined description on the previous observations","3/6/23","","https://www.nuforc.org/webreports/reports/173/S173839.html","665X2023.03.19.11.13.07",FALSE
"1/8/23 17:21","Madison","WI","USA","Chevron","10 minutes","Took my dog outside and instantly noticed lights in the sky.","3/6/23","","https://www.nuforc.org/webreports/reports/173/S173801.html","666X2023.03.19.11.13.07",FALSE
"1/8/23 08:35","Spokane valley","WA","USA","Other","2 hours","Our backyard camera recorded this strange object","3/6/23","Yes","https://www.nuforc.org/webreports/reports/174/S174097.html","667X2023.03.19.11.13.07",FALSE
"1/8/23 05:30","Niantic","","USA","Circle","About 5 seconds","Bright small circle shaped object with no aircraft signals and moving at fast rate making movements that were not aircraft like","3/6/23","","https://www.nuforc.org/webreports/reports/173/S173788.html","668X2023.03.19.11.13.07",FALSE
"1/8/23 04:00","New York","NY","USA","Disk","10 seconds","UFO in Manhattan","3/6/23","","https://www.nuforc.org/webreports/reports/173/S173787.html","669X2023.03.19.11.13.07",FALSE
"1/7/23 23:59","Olympia","WA","USA","Circle","?Not visible, only camera","Took a pic of full moon for an screensaver. Immediately noticed on the pic. Tried for more, was visible on phone & disappeared b4 more","3/6/23","Yes","https://www.nuforc.org/webreports/reports/173/S173820.html","670X2023.03.19.11.13.07",FALSE
"1/7/23 22:30","Tucson","AZ","USA","Changing","30 min","Big blurry star, looked though binoculars clearly one object changing shape dozens of yellow lights no aircraft running lights","3/6/23","","https://www.nuforc.org/webreports/reports/173/S173786.html","671X2023.03.19.11.13.07",FALSE
"1/7/23 21:12","Wichita","KS","USA","Triangle","One minute","I went outside, looked north, saw one orange light start to move then another appearing to do the same, shortly after both fading.","3/6/23","Yes","https://www.nuforc.org/webreports/reports/174/S174064.html","672X2023.03.19.11.13.07",FALSE
"1/7/23 18:19","Bagdad","FL","USA","Rectangle","Seconds","Taking picture of moon and after looking at photo saw two rectangular shaped orbs in photo","3/6/23","Yes","https://www.nuforc.org/webreports/reports/173/S173785.html","673X2023.03.19.11.13.07",FALSE
"1/7/23 18:00","Waverly","AL","USA","Circle","1 hour","We were getting in the car and we saw one chasing the other","3/6/23","","https://www.nuforc.org/webreports/reports/174/S174157.html","674X2023.03.19.11.13.07",FALSE
"1/7/23 17:48","West haven","CT","USA","Circle","Maybe 4 minutes","Orange balls","3/6/23","","https://www.nuforc.org/webreports/reports/173/S173782.html","675X2023.03.19.11.13.07",FALSE
"1/7/23 09:41","Chino ca","CA","USA","Light","It lasted for maybe 3min","Noticed the lights while on freeway. So a bright light then 4 lights then one light disappeared, then I saw two lights again","3/6/23","Yes","https://www.nuforc.org/webreports/reports/174/S174081.html","676X2023.03.19.11.13.07",FALSE
"1/6/23 23:50","Jensen Beach","FL","USA","Changing","","I saw this when taking a photo of the full moon on 1/6/23 right before and after midnight.","3/6/23","Yes","https://www.nuforc.org/webreports/reports/173/S173916.html","677X2023.03.19.11.13.07",FALSE
"1/6/23 23:30","Riverview","FL","USA","Egg","Almost 45 minutes","Unusually large, bright, orange, stagnant object","3/6/23","","https://www.nuforc.org/webreports/reports/173/S173779.html","678X2023.03.19.11.13.07",FALSE
"1/6/23 21:00","Greeneville","TN","USA","Triangle","Approximately 60 seconds","UFO with two 3 lights in triangular shape","3/6/23","","https://www.nuforc.org/webreports/reports/173/S173773.html","679X2023.03.19.11.13.07",FALSE
"1/6/23 20:40","Gladstone","Queensland","Australia","Other","10 seconds","Aircraft flying very low to ground, no sound emitted, size of a large plane but looked like a massive drone","3/6/23","","https://www.nuforc.org/webreports/reports/174/S174229.html","680X2023.03.19.11.13.07",FALSE
"1/6/23 20:17","Chandler","AZ","USA","Star","10 seconds","Bright star moving across sky unnaturally fast from directly above me to the horizon in about 10 seconds without dimming and was silent","3/6/23","","https://www.nuforc.org/webreports/reports/173/S173805.html","681X2023.03.19.11.13.07",FALSE
"1/6/23 17:50","Prince Frederick","MD","USA","Light","2 times, 5 seconds each","A circle of light appeared above the cloud cover, moved in an erratic zigzag pattern and then disappeared.","3/6/23","","https://www.nuforc.org/webreports/reports/173/S173768.html","682X2023.03.19.11.13.07",FALSE
"1/6/23 17:12","Austin","TX","USA","Cylinder","10 minutes","Craft with 2 small contrails below it craft was stationary","3/6/23","","https://www.nuforc.org/webreports/reports/173/S173933.html","683X2023.03.19.11.13.07",FALSE
"1/6/23 16:12","Spokane Valley","WA","USA","Other","6 minutes","Meteorites/Space Junk?","3/6/23","","https://www.nuforc.org/webreports/reports/173/S173777.html","684X2023.03.19.11.13.07",FALSE
"1/6/23 15:38","Savannah","GA","USA","Disk","About 15 to 20 seconds","Saucer Shaped Object","3/6/23","","https://www.nuforc.org/webreports/reports/173/S173771.html","685X2023.03.19.11.13.07",FALSE
"1/6/23 15:20","Great Smokies National Park","NC","USA","Cylinder","Seconds","Massive, moving behind ridgeline","3/6/23","Yes","https://www.nuforc.org/webreports/reports/173/S173790.html","686X2023.03.19.11.13.07",FALSE
"1/6/23 08:10","Waynesboro","PA","USA","Unknown","","I saw it moving quickly and noticed it wasnt a plane.","3/6/23","Yes","https://www.nuforc.org/webreports/reports/173/S173784.html","687X2023.03.19.11.13.07",FALSE
"1/6/23 05:40","Chino Valley","AZ","USA","Light","30 minutes","Red light that changed colors","3/6/23","","https://www.nuforc.org/webreports/reports/173/S173809.html","688X2023.03.19.11.13.07",FALSE
"1/6/23 05:25","Bayville","NY","USA","Light","20 min","Blinking/flashing/shimmering lights in the sky","3/6/23","Yes","https://www.nuforc.org/webreports/reports/173/S173781.html","689X2023.03.19.11.13.07",FALSE
"1/6/23 03:00","approx 1000 nm north of Kauai Hawaii","CO","USA","Triangle","approx 15 minutes","3 smaller star-like objects moving around a brighter one making rapid speed changes and directions.","3/6/23","Yes","https://www.nuforc.org/webreports/reports/173/S173783.html","690X2023.03.19.11.13.07",FALSE
"1/6/23 02:00","Harlech","Gwynedd","United Kingdom","Disk","I hour observed 2-3 am","Many many bright lights travelling East to West over Irish sea","3/6/23","","https://www.nuforc.org/webreports/reports/173/S173763.html","691X2023.03.19.11.13.07",FALSE
"1/5/23 21:12","Spartanburg","SC","USA","Changing","2 min","In the sky right above my house but this time u was driving and it followed","3/6/23","","https://www.nuforc.org/webreports/reports/173/S173937.html","692X2023.03.19.11.13.07",FALSE
"1/5/23 21:00","Port Charlotte","FL","USA","Circle","3 mins","My granddaughter and I witness a circular object with bright lights in the sky.","3/6/23","","https://www.nuforc.org/webreports/reports/173/S173756.html","693X2023.03.19.11.13.07",FALSE
"1/5/23 19:45","Crofton/ Gambrills","MD","USA","Sphere","> 2 hrs.","It was a sphere shaped object with jagged edges the remained in place, but changed colors.","3/6/23","Yes","https://www.nuforc.org/webreports/reports/173/S173770.html","694X2023.03.19.11.13.07",FALSE
"1/5/23 18:40","Wall Township","NJ","USA","Unknown","approximately 2 minutes","There were four lights moving in unison with no sound at all.","3/6/23","","https://www.nuforc.org/webreports/reports/173/S173752.html","695X2023.03.19.11.13.07",FALSE
"1/5/23 18:15","Miami","MA","USA","Light","Unsure.","I took a picture of the beautiful moon and the lights showed in in the cloud below the moon.","3/6/23","Yes","https://www.nuforc.org/webreports/reports/173/S173765.html","696X2023.03.19.11.13.07",FALSE
"1/5/23 18:03","Nazareth","PA","USA","Cylinder","2 minutes","Looked out towards my window and saw an unidentified object floating in the air.","3/6/23","Yes","https://www.nuforc.org/webreports/reports/173/S173741.html","697X2023.03.19.11.13.07",FALSE
"1/5/23 08:00","Kingman","AZ","USA","Other","Noticed after photo","When looking back over sunrise photos from this morning","3/6/23","Yes","https://www.nuforc.org/webreports/reports/173/S173748.html","698X2023.03.19.11.13.07",FALSE
"1/5/23 07:30","Longview","NC","USA","Cigar","3 minutes","Pill shaped object, looked like a blinking star.","3/6/23","Yes","https://www.nuforc.org/webreports/reports/173/S173749.html","699X2023.03.19.11.13.07",FALSE
"1/4/23 21:51","Brook Highland","AL","USA","Unknown","30 seconds","Took a video of a craft shining many colors without having any aircraft type identifying lights. Object flew towards Lake Purdy","3/6/23","","https://www.nuforc.org/webreports/reports/173/S173823.html","700X2023.03.19.11.13.07",FALSE
"1/4/23 21:40","Between Maine & Binghamton","NY","USA","Oval","2-3 minutes","Saw bright oval/shaped craft","3/6/23","","https://www.nuforc.org/webreports/reports/173/S173737.html","701X2023.03.19.11.13.07",FALSE
"1/4/23 21:15","Forney","TX","USA","Chevron","Half Hour","Chevron shape hovering in place","3/6/23","Yes","https://www.nuforc.org/webreports/reports/173/S173978.html","702X2023.03.19.11.13.07",FALSE
"1/4/23 16:06","Duson","LA","USA","Cylinder","Less than 5 minutes","No way it was another airplane or chopper","3/6/23","Yes","https://www.nuforc.org/webreports/reports/173/S173793.html","703X2023.03.19.11.13.07",FALSE
"1/4/23 02:08","Tel aviv","","Israel","Light","4 hours","A craft appeared in my bedroom and a being emerged conversing with me.","3/6/23","","https://www.nuforc.org/webreports/reports/174/S174290.html","704X2023.03.19.11.13.07",FALSE
"1/4/23 01:15","Brisbane","Queensland","Australia","Light","5sec","Ive seen a couple of these lately and theyre all a bit different from one another but this latest one was very bright and was contrll","3/6/23","","https://www.nuforc.org/webreports/reports/173/S173708.html","705X2023.03.19.11.13.07",FALSE
"1/4/23 00:30","Fresno","CA","USA","Circle","3 min","There was bright white maybe silver lights and then a lil bit of blue or green lights .","3/6/23","","https://www.nuforc.org/webreports/reports/173/S173750.html","706X2023.03.19.11.13.07",FALSE
"1/3/23 23:38","Charlotte","NC","USA","Cylinder","Ufo sighting","I was walking alone just going for my usual midnight walk","3/6/23","","https://www.nuforc.org/webreports/reports/173/S173772.html","707X2023.03.19.11.13.07",FALSE
"1/3/23 23:30","New Castle","PA","USA","Cigar","20 mins","25 Cigar Bright Shaped high as plane","3/6/23","","https://www.nuforc.org/webreports/reports/173/S173778.html","708X2023.03.19.11.13.07",FALSE
"1/2/23 22:00","Seattle","WA","USA","Orb","2-3 mins","Bright gold sphere aircraft pulsating, flies to west horizon and erupts in red light","3/6/23","","https://www.nuforc.org/webreports/reports/173/S173723.html","709X2023.03.19.11.13.07",FALSE
"1/2/23 21:30","Wilmington","","USA","Oval","","Sighted a large dark oval shaped figure with 3 red lights in a trangle formation","3/6/23","","https://www.nuforc.org/webreports/reports/173/S173910.html","710X2023.03.19.11.13.07",FALSE
"1/2/23 19:09","Near Hagerstown","MD","USA","Triangle","Approx 6 PM -11 PM","Latest was bottom view almost directly overhead, 3 lights equidistant apart side lite up, short jerky moves at times, seen East to West","3/6/23","","https://www.nuforc.org/webreports/reports/173/S173703.html","711X2023.03.19.11.13.07",FALSE
"1/2/23 19:00","Lakeville","MA","USA","Changing","4 hours +","This is 4th report, the sighting evolves each time I'm out observing.. picking up on more details of the crafts.","3/6/23","","https://www.nuforc.org/webreports/reports/173/S173709.html","712X2023.03.19.11.13.07",FALSE
"1/2/23 01:00","Albany","NY","USA","Cigar","3-5 minutes","Object came down from the sky","3/6/23","","https://www.nuforc.org/webreports/reports/174/S174125.html","713X2023.03.19.11.13.07",FALSE
