"Date/Time","City","State","Country","Shape","Duration","Summary","Posted","Image","URL","ID","madar"
"9/8/22 20:40","Taunton","MA","USA","Other","30 seconds","I saw a crescent shaped yellow white object spinning downward then it faded into the sky","10/8/22","","https://www.nuforc.org/webreports/reports/171/S171837.html","420X2022.11.14.18.04.39",FALSE
"9/8/22 19:58","Farmington","MO","USA","Star","3 minutes","Bright yellow Light moving at steady speed across field.","10/8/22","","https://www.nuforc.org/webreports/reports/171/S171785.html","421X2022.11.14.18.04.39",FALSE
"9/8/22 18:20","Lancaster","PA","USA","Sphere","Around 7 seconds","White Sphere","10/8/22","","https://www.nuforc.org/webreports/reports/171/S171656.html","422X2022.11.14.18.04.39",FALSE
"9/8/22 08:30","Palm Beach Gardens","FL","USA","Sphere","5 mins","glowing disk surrounded by a white aura and moving slowly","10/8/22","Yes","https://www.nuforc.org/webreports/reports/171/S171643.html","423X2022.11.14.18.04.39",FALSE
"9/8/22 06:25","Jamaica","VA","USA","Star","10 minutes","Saw one stationary star-shaped object and two others that disappeared when I glanced at them.","10/8/22","Yes","https://www.nuforc.org/webreports/reports/171/S171646.html","424X2022.11.14.18.04.39",FALSE
"9/8/22 04:30","Reading","PA","USA","Circle","1 hour","This was pulsing multi colored lights","10/8/22","","https://www.nuforc.org/webreports/reports/171/S171652.html","425X2022.11.14.18.04.39",FALSE
"9/7/22 23:13","Manhattan","NY","USA","Changing","9:00pm~through 2:00 am","Irrefutable","10/8/22","Yes","https://www.nuforc.org/webreports/reports/171/S171748.html","426X2022.11.14.18.04.39",FALSE
"9/7/22 23:00","andrews","NC","USA","Changing","we watched for 30 minutes","my sister and i both videoed at the same time","10/8/22","Yes","https://www.nuforc.org/webreports/reports/171/S171737.html","427X2022.11.14.18.04.39",FALSE
"9/7/22 19:45","Mobile","AL","USA","Light","10 minutes","Red lights one after the other, quiet following same pattern in sky from north to east. Three at one time side by side then single fil","10/8/22","","https://www.nuforc.org/webreports/reports/171/S171642.html","428X2022.11.14.18.04.39",FALSE
"9/7/22 19:30","Pendleton","OR","USA","Light","60 seconds","Bright light over a hill around twilight. Thought was star or venus but it moved straight up at a steady pace, almost like a distant r","10/8/22","","https://www.nuforc.org/webreports/reports/171/S171650.html","429X2022.11.14.18.04.39",FALSE
"9/7/22 17:15","Salford","","United Kingdom","Disk","Minute or two","Metallic disc spotted below heavy clouds","10/8/22","Yes","https://www.nuforc.org/webreports/reports/171/S171668.html","430X2022.11.14.18.04.39",FALSE
"9/7/22 06:35","Miramar","FL","USA","Oval","A split second","at a red light","10/8/22","Yes","https://www.nuforc.org/webreports/reports/171/S171645.html","431X2022.11.14.18.04.39",FALSE
"9/7/22 06:35","Ft Lauderdale","FL","USA","Circle","A split second","Huge ufo craft above","10/8/22","Yes","https://www.nuforc.org/webreports/reports/171/S171647.html","432X2022.11.14.18.04.39",FALSE
"9/7/22 05:50","Mount Maunganui","Bay of Plenty Region","New Zealand","Light","16 seconds","8 quarter sized orange/white balls of light, one at a time appeared in 2 second intervals between them, one at a time.","10/8/22","","https://www.nuforc.org/webreports/reports/172/S172081.html","433X2022.11.14.18.04.39",FALSE
"9/7/22 03:30","Tehachapi","CA","USA","Triangle","From 3:30 am to 530 am","I saw what I thought was a very bright and close airplane but it was not moving.","10/8/22","Yes","https://www.nuforc.org/webreports/reports/171/S171928.html","434X2022.11.14.18.04.39",FALSE
"9/6/22 21:30","Rogersville","TN","USA","Light","10min","we have 10min video but i cant send it says to big (33mb), i downloaded to laptop from phone on itunes","10/8/22","","https://www.nuforc.org/webreports/reports/171/S171689.html","435X2022.11.14.18.04.39",FALSE
"9/6/22 20:11","Chokio","MN","USA","Light","5-7 mins","Fireball looking thing appeared on the west sky","10/8/22","Yes","https://www.nuforc.org/webreports/reports/171/S171625.html","436X2022.11.14.18.04.39",FALSE
"9/6/22 19:51","Arches National Park","UT","","Other","15 minutes","I filmed a white comet shaped object moving very slowly in the sky","10/8/22","Yes","https://www.nuforc.org/webreports/reports/172/S172123.html","437X2022.11.14.18.04.39",FALSE
"9/6/22 19:44","Huntington Beach","CA","USA","Light","2 minutes","Sitting in my back yard and noticed a light coming out of the clouds.","10/8/22","","https://www.nuforc.org/webreports/reports/171/S171707.html","438X2022.11.14.18.04.39",FALSE
"9/6/22 19:42","Santa Moinca","CA","USA","Diamond","8 seconds","4 white lights in a diamond shape, expanded, contracted and flew towards the ocean.","10/8/22","","https://www.nuforc.org/webreports/reports/171/S171654.html","439X2022.11.14.18.04.39",FALSE
"9/6/22 02:36","Rocklin","CA","USA","Rectangle","2 minutes","Object changed from half Oval to Rectangle.","10/8/22","","https://www.nuforc.org/webreports/reports/172/S172161.html","440X2022.11.14.18.04.39",FALSE
"9/6/22 01:18","Huntington Beach","CA","USA","Light","Five minutes","Rapid blinking of light","10/8/22","","https://www.nuforc.org/webreports/reports/171/S171708.html","441X2022.11.14.18.04.39",FALSE
"9/6/22 01:18","Huntington Beach","CA","USA","Star","5 minutes","It came from SW Direction heading NE with wrapping flashing lights that change colors every so often.","10/8/22","","https://www.nuforc.org/webreports/reports/171/S171663.html","442X2022.11.14.18.04.39",FALSE
"9/5/22 22:30","Middletown","OH","USA","Light","30 seconds, maybe less","Incredibly bright flash, small sphere of light in distant sky streaks off","10/8/22","","https://www.nuforc.org/webreports/reports/171/S171944.html","443X2022.11.14.18.04.39",FALSE
"9/5/22 16:41","","","USA","Other","12 seconds","Unknown object flys at my drone along waterway","10/8/22","","https://www.nuforc.org/webreports/reports/172/S172221.html","444X2022.11.14.18.04.39",FALSE
"9/5/22 15:58","Mendenhall Glacier","BC","Canada","Cone","","We didnt notice these Orbs until we was looking at the pictures of our cruise to Alaska.","10/8/22","Yes","https://www.nuforc.org/webreports/reports/172/S172180.html","445X2022.11.14.18.04.39",FALSE
"9/5/22 04:41","Gardnerville","NV","USA","Cigar","45 seconds approx","Cigar shaped, translucent, moving white lights. Moving west to east on a very northern horizon. Able to take 2 photos.","10/8/22","Yes","https://www.nuforc.org/webreports/reports/171/S171674.html","446X2022.11.14.18.04.39",FALSE
"9/5/22 03:15","Newnan","","Georgia","Sphere","I saw it on the ground","I saw it flying over my car the Frist time I was going to work then the next day I saw it again that when I got my mom to come see it","10/8/22","Yes","https://www.nuforc.org/webreports/reports/171/S171740.html","447X2022.11.14.18.04.39",FALSE
"9/4/22 20:51","Creston area","BC","Canada","Disk","3-10 sec","tried to capture a mountain fire, but it was dark so I put on the flash took 2 more, flash showed the 2 objects","10/8/22","Yes","https://www.nuforc.org/webreports/reports/171/S171594.html","448X2022.11.14.18.04.39",FALSE
"9/4/22 15:30","Montara","CA","USA","Cylinder","1-2 minutes","Large cylindrical structure was seen at the top of mountain adjacent Montara State Beach area in the vicinity of Montara CA.","10/8/22","","https://www.nuforc.org/webreports/reports/171/S171911.html","449X2022.11.14.18.04.39",FALSE
"9/4/22 13:40","Albuquerque","NM","USA","Sphere","Approx. 20 seconds","Sphere and oblong shaped crafts spotted motionless a few hundred feet in the air.","10/8/22","","https://www.nuforc.org/webreports/reports/171/S171926.html","450X2022.11.14.18.04.39",FALSE
"9/4/22 02:00","Darrington","WA","USA","Star","1 hour","Light Craft","10/8/22","Yes","https://www.nuforc.org/webreports/reports/171/S171649.html","451X2022.11.14.18.04.39",FALSE
"9/4/22 00:17","Sherwood","ND","USA","Light","10 minutes","Found taking pictures of aurora borealis","10/8/22","Yes","https://www.nuforc.org/webreports/reports/172/S172139.html","452X2022.11.14.18.04.39",FALSE
"9/3/22 22:30","lincoln","VT","USA","Circle","15-20 minutes","a large glowing reddish orange circle/sphere","10/8/22","","https://www.nuforc.org/webreports/reports/171/S171660.html","453X2022.11.14.18.04.39",FALSE
"9/3/22 17:00","Hedgesville","WV","USA","Circle","Every night all night","Seen at day and night 5 bball sized orange spheres that spyed on us without lights on. Metallic softball sized spheres, large entity","10/8/22","Yes","https://www.nuforc.org/webreports/reports/171/S171640.html","454X2022.11.14.18.04.39",FALSE
"9/2/22 21:45","Cardiff","City and County of Cardiff","United Kingdom","Triangle","5min","Was low in the sky, but passed me overhead","10/8/22","","https://www.nuforc.org/webreports/reports/171/S171794.html","455X2022.11.14.18.04.39",FALSE
"9/2/22 20:40","Fairmont","WV","USA","Sphere","Roughly 3-4 seconds","Orange sphere in the sky","10/8/22","","https://www.nuforc.org/webreports/reports/171/S171746.html","456X2022.11.14.18.04.39",FALSE
"9/2/22 19:30","Saint Petersburg","FL","USA","Oval","One minutes","4 or 5 hazy white lights that made the shape of an oval that moved back and forth from east to west of a distance of about one mile.","10/8/22","","https://www.nuforc.org/webreports/reports/171/S171852.html","457X2022.11.14.18.04.39",FALSE
"9/2/22 18:20","CLIFTON PARK","NY","USA","Changing","3 weeks comes and goes","2 illuminated craft that changes shape(video)","10/8/22","Yes","https://www.nuforc.org/webreports/reports/171/S171713.html","458X2022.11.14.18.04.39",FALSE
"9/2/22 18:00","Stony Brook","NY","USA","Oval","5 minutes","Bean shaped object","10/8/22","Yes","https://www.nuforc.org/webreports/reports/171/S171540.html","459X2022.11.14.18.04.39",FALSE
"9/1/22 23:45","Hartly","DE","USA","Other","About 3 seconds","A faded contrail type of craft moving quickly over a friend's house","10/8/22","","https://www.nuforc.org/webreports/reports/172/S172041.html","460X2022.11.14.18.04.39",FALSE
"9/1/22 21:59","hingham","MA","USA","Cylinder","2 mins","I was outiide with andrew gardside and we say all 69 of the ship show we we very scared and thoguh we were going to die.","10/8/22","Yes","https://www.nuforc.org/webreports/reports/171/S171710.html","461X2022.11.14.18.04.39",FALSE
"9/1/22 09:14","","MT","USA","Disk","Duration of a minute or t","We were driving thru Montana on the way to Washington. My dad pointed out that a hot air balloon was in the sky so I took pics","10/8/22","Yes","https://www.nuforc.org/webreports/reports/171/S171549.html","462X2022.11.14.18.04.39",FALSE
"9/1/22 01:23","Chesapeake","","USA","Delta","","I was in my room and I seen three entities with a light. Now I suffer with headaches things talking to me all the time","10/8/22","","https://www.nuforc.org/webreports/reports/171/S171886.html","463X2022.11.14.18.04.39",FALSE
"8/31/22 23:32","Oklahoma City","OK","USA","Light","30 seconds","A light approximately mid-cloud level went across the sky within 15-30 seconds","10/8/22","","https://www.nuforc.org/webreports/reports/171/S171651.html","464X2022.11.14.18.04.39",FALSE
"8/31/22 22:11","Vandalia","OH","USA","Star","15 mins","Looked like a regular star in the sky","10/8/22","","https://www.nuforc.org/webreports/reports/171/S171509.html","465X2022.11.14.18.04.39",FALSE
"8/31/22 20:00","Caledonia","IL","USA","Changing","30 minutes","At height of a plane nearby","10/8/22","Yes","https://www.nuforc.org/webreports/reports/171/S171511.html","466X2022.11.14.18.04.39",FALSE
"8/31/22 19:48","Rancho Palos Verdes","CA","USA","Disk","1 Minute","See video","10/8/22","","https://www.nuforc.org/webreports/reports/171/S171508.html","467X2022.11.14.18.04.39",FALSE
"8/31/22 03:46","Naperville","IL","USA","Circle","About 1 minute 5 sec","Wasnt a plane","10/8/22","","https://www.nuforc.org/webreports/reports/171/S171505.html","468X2022.11.14.18.04.39",FALSE
"8/30/22 22:53","Dartmouth","NS","Canada","Circle","At least 5 minutes","Not sure what it is. Flashes green, red, blue, and white. Had to use zoom on my phone so video is grainy.","10/8/22","","https://www.nuforc.org/webreports/reports/171/S171491.html","469X2022.11.14.18.04.39",FALSE
"8/30/22 02:11","Las Vegas","NV","USA","Disk","2 mins","Took a picture with an iPhone pro max 13","10/8/22","Yes","https://www.nuforc.org/webreports/reports/171/S171488.html","470X2022.11.14.18.04.39",FALSE
"8/29/22 19:33","Chandigarh","Chandigarh","India","Circle","More than 20 seconds.","Similar to a star and going in a straight line.","10/8/22","","https://www.nuforc.org/webreports/reports/171/S171455.html","471X2022.11.14.18.04.39",FALSE
"8/28/22 12:34","San Diego","CA","USA","Light","10-15 minutes","Intermittently blinking white light in mid day light at apparent high altitude seemed stationary then moved west","10/8/22","Yes","https://www.nuforc.org/webreports/reports/171/S171677.html","472X2022.11.14.18.04.39",FALSE
"8/28/22 07:30","Pendleton","OR","USA","Diamond","3 min long","I was walking my dog on Willow Dr Pendleton Oregon.","10/8/22","","https://www.nuforc.org/webreports/reports/171/S171452.html","473X2022.11.14.18.04.39",FALSE
"8/27/22 22:20","Miami","FL","USA","Circle","Miami beach","Was sitting on the beach and multiple flying objects came and shined lights on me and I e when away like 3 more can I have pics a","10/8/22","Yes","https://www.nuforc.org/webreports/reports/172/S172179.html","474X2022.11.14.18.04.39",FALSE
"8/27/22 22:00","Birmingham","AL","USA","Changing","Continuous","I see these moving & blinking stars everynight.","10/8/22","Yes","https://www.nuforc.org/webreports/reports/171/S171445.html","475X2022.11.14.18.04.39",FALSE
"8/27/22 02:29","South of Sudbury","ON","Canada","Unknown","Approximately 15 to 20 se","multiple firework like explosions in orbit or beyond through binoculars","10/8/22","Yes","https://www.nuforc.org/webreports/reports/172/S172215.html","476X2022.11.14.18.04.39",FALSE
"8/26/22 22:12","Hillsboro","IL","USA","Sphere","","A bright star like but larger disappearing sphere and reforming","10/8/22","","https://www.nuforc.org/webreports/reports/171/S171410.html","477X2022.11.14.18.04.39",FALSE
"8/26/22 19:15","Newtripoli","PA","USA","Fireball","15 min","fireball that split into two but also had a shine like metal","10/8/22","Yes","https://www.nuforc.org/webreports/reports/171/S171932.html","478X2022.11.14.18.04.39",FALSE
"8/26/22 12:30","Itaúna","Minas Gerais","Brazil","Unknown","2 minites","we saw a luminous sphere intelligently and linearly trace the night sky of the small town of Itaúna.","10/8/22","","https://www.nuforc.org/webreports/reports/171/S171666.html","479X2022.11.14.18.04.39",FALSE
"8/25/22 23:57","Pittsburgh","PA","USA","Rectangle","3 to 5 minutes","While taking photos of granddaughters dorm the UFO showed in the photo.","10/8/22","Yes","https://www.nuforc.org/webreports/reports/171/S171403.html","480X2022.11.14.18.04.39",FALSE
"8/25/22 18:30","Belfast","Antrim","United Kingdom","Unknown","","These are on google maps","10/8/22","Yes","https://www.nuforc.org/webreports/reports/171/S171815.html","481X2022.11.14.18.04.39",FALSE
"8/25/22 00:00","N/A","","Vietnam","Disk","See pictures","Google Earth","10/8/22","Yes","https://www.nuforc.org/webreports/reports/171/S171396.html","482X2022.11.14.18.04.39",FALSE
"8/24/22 23:25","West haven","CT","USA","Light",".54 seconds","One large bright light was shooting out what seemed to be other ships","10/8/22","","https://www.nuforc.org/webreports/reports/171/S171494.html","483X2022.11.14.18.04.39",FALSE
"8/24/22 03:00","Lisbon","ME","USA","Rectangle","","White weirdly shaped rectangular ship","10/8/22","","https://www.nuforc.org/webreports/reports/171/S171705.html","484X2022.11.14.18.04.39",FALSE
"8/23/22 21:46","Wellfleet","Siguiri Prefecture","Guinea","Cigar","9:48 PM","Flying cigar shape.  ((NUFORC Note:","10/8/22","Yes","https://www.nuforc.org/webreports/reports/171/S171711.html","485X2022.11.14.18.04.39",FALSE
"8/22/22 15:33","","","USA","","","Already other reports that's the location in picture","10/8/22","Yes","https://www.nuforc.org/webreports/reports/171/S171400.html","486X2022.11.14.18.04.39",FALSE
"8/22/22 05:00","Palmdale","FL","USA","Circle","About 2 minutes in all","I woke up to a large circular bright light coming over the trees and watched it fly across the sky until it was the size of the starts","10/8/22","Yes","https://www.nuforc.org/webreports/reports/171/S171736.html","487X2022.11.14.18.04.39",FALSE
"8/21/22 23:30","Payson az","AZ","USA","Circle","1 ht","In payson campground near Munds park","10/8/22","","https://www.nuforc.org/webreports/reports/171/S171323.html","488X2022.11.14.18.04.39",FALSE
"8/21/22 21:30","Minneapolis","MN","USA","Circle","5 minutes","Two stars moving quickly across the night sky.","10/8/22","","https://www.nuforc.org/webreports/reports/171/S171314.html","489X2022.11.14.18.04.39",FALSE
"8/20/22 21:48","Everett","","USA","Light","20 sec","AGIAN A 10 LIGHT UP SHIPS IN ON STRAIT LINE AND DISAPPEARED NEVER SEEN THIS. LOOKED LIKE SOMETHING I'VE AND OTHER PPL NEVER SEEN","10/8/22","","https://www.nuforc.org/webreports/reports/171/S171297.html","490X2022.11.14.18.04.39",FALSE
"8/20/22 21:11","Minneapolis","MN","USA","Circle","5 to 7 minutes","3, 3-4 inch red circles - in a straight line - equal distance apart in sky, to outer atmosphere, 2 seconds, in order. 4th after.","10/8/22","","https://www.nuforc.org/webreports/reports/171/S171648.html","491X2022.11.14.18.04.39",FALSE
"8/20/22 21:00","New Westminster","BC","Canada","Circle","Approximately 5-6 minutes","Our family of 6 saw this, 3 adults and 3 children, ages 3, 9, and 17.","10/8/22","","https://www.nuforc.org/webreports/reports/171/S171295.html","492X2022.11.14.18.04.39",FALSE
"8/20/22 13:13","Essex","CT","USA","Sphere","Didnt see lights until","didnt see the lights until we reviewed that days photos","10/8/22","Yes","https://www.nuforc.org/webreports/reports/171/S171531.html","493X2022.11.14.18.04.39",FALSE
"8/19/22 23:44","Sweet","ID","USA","Chevron","About a minute and turned","It was a bright light that had different colors in went straight for about a minute then I got out of the car to take a picture","10/8/22","Yes","https://www.nuforc.org/webreports/reports/171/S171256.html","494X2022.11.14.18.04.39",FALSE
"8/19/22 22:16","Prior Lake","MN","USA","Light","2-4 minutes","Saw UFO from my car","10/8/22","Yes","https://www.nuforc.org/webreports/reports/171/S171252.html","495X2022.11.14.18.04.39",FALSE
"8/19/22 22:00","Cooperstown","NY","USA","Other","45 seconds to a minute","A long shape moving horizontally then recessed into the sky while fading out","10/8/22","","https://www.nuforc.org/webreports/reports/171/S171248.html","496X2022.11.14.18.04.39",FALSE
"8/19/22 21:57","Coquitlam","","","","I watched it traveling s","We watched it fly over head and just past the house it blipped out . Didappeared","10/8/22","Yes","https://www.nuforc.org/webreports/reports/171/S171253.html","497X2022.11.14.18.04.39",FALSE
"8/19/22 21:56","Point pleasant","NJ","USA","Changing","5 times -8 hours","I work security at the beach and every time I have been there I see things all over The sky","10/8/22","","https://www.nuforc.org/webreports/reports/171/S171362.html","498X2022.11.14.18.04.39",FALSE
"8/19/22 21:54","Barre","VT","USA","Cigar","About 3 or 4 minutes","I was shooting long exposures and saw a line with small round lights along the length.","10/8/22","Yes","https://www.nuforc.org/webreports/reports/171/S171259.html","499X2022.11.14.18.04.39",FALSE
"8/19/22 21:51","Rapid City","MI","USA","","1 minute","An object in the shape of a straight line about an inch from our viewing area moving slowly across the sky","10/8/22","Yes","https://www.nuforc.org/webreports/reports/171/S171245.html","500X2022.11.14.18.04.39",FALSE
"8/19/22 21:48","Hooksett","NH","USA","Cylinder","2 minutes","Long cylindrical lighted object moving towards the east.","10/8/22","","https://www.nuforc.org/webreports/reports/171/S171238.html","501X2022.11.14.18.04.39",FALSE
"8/19/22 21:48","Marcellus","NY","USA","Disk","25 seconds","Finishing dinner, looked over the golf course and saw a craft moving through the air. Was low to the ground, aircraft level.","10/8/22","Yes","https://www.nuforc.org/webreports/reports/171/S171229.html","502X2022.11.14.18.04.39",FALSE
"8/19/22 21:47","Colonie NY ... a few miles west of Albany","NY","USA","Other","Half a minute","White, like a light bar, moving slowly easterly across the night sky","10/8/22","","https://www.nuforc.org/webreports/reports/171/S171234.html","503X2022.11.14.18.04.39",FALSE
"8/19/22 21:46","Black butte","OR","USA","Light","1-2 minutes","This doesnt look like the Starlink videos as it just disappeared well within the horizon.","10/8/22","","https://www.nuforc.org/webreports/reports/171/S171258.html","504X2022.11.14.18.04.39",FALSE
"8/19/22 21:46","Davison","MI","USA","Cigar","20 seconds","Looked up and saw a worm shaped slow moving object in the sky, it shortly vanished into thin air.","10/8/22","","https://www.nuforc.org/webreports/reports/171/S171235.html","505X2022.11.14.18.04.39",FALSE
"8/19/22 21:46","Tigard","OR","USA","Cigar","3 seconds","Train looking shape in sky for 3 seconds and disappeared","10/8/22","Yes","https://www.nuforc.org/webreports/reports/171/S171257.html","506X2022.11.14.18.04.39",FALSE
"8/19/22 21:46","Bridgton","ME","USA","Light","1 minute","Linear bright structure","10/8/22","Yes","https://www.nuforc.org/webreports/reports/171/S171230.html","507X2022.11.14.18.04.39",FALSE
"8/19/22 21:45","Richmond","Quebec","Canada","Changing","20 Seconds","We saw 2 dots in the sky that appeared to be stars but were fading into each other but only captured on camera the straight line","10/8/22","","https://www.nuforc.org/webreports/reports/171/S171249.html","508X2022.11.14.18.04.39",FALSE
"8/19/22 21:45","Topsham","ME","USA","Cigar","+/- 30 seconds","Thin Vertical Cylinder","10/8/22","","https://www.nuforc.org/webreports/reports/171/S171239.html","509X2022.11.14.18.04.39",FALSE
"8/19/22 21:45","Searsmont","ME","USA","Other","2 minutes","Linear white light","10/8/22","","https://www.nuforc.org/webreports/reports/171/S171240.html","510X2022.11.14.18.04.39",FALSE
"8/19/22 21:45","Thornton","NH","USA","Formation","50-60 seconds","We saw a string of lights moving through the sky silently and then faded into nothing.","10/8/22","","https://www.nuforc.org/webreports/reports/171/S171232.html","511X2022.11.14.18.04.39",FALSE
"8/19/22 21:45","Searsmont","ME","USA","Other","2 minutes","Linear white light","10/8/22","","https://www.nuforc.org/webreports/reports/171/S171228.html","512X2022.11.14.18.04.39",FALSE
"8/19/22 21:45","Indian Lake","NY","USA","Cigar","15 seconds","Sitting out in front of campfire facing west with lake in front , saw bright straight line moving slowly in uniform towards the east","10/8/22","Yes","https://www.nuforc.org/webreports/reports/171/S171241.html","513X2022.11.14.18.04.39",FALSE
"8/19/22 21:45","Bennington","VT","USA","Other","fifteen sec. approx","Long string of bright lights in straight formation with border around them approx 200 feet in length, no sound or FAA strobes .","10/8/22","","https://www.nuforc.org/webreports/reports/171/S171242.html","514X2022.11.14.18.04.39",FALSE
"8/19/22 21:44","Wolfeboro","NH","USA","Changing","2-5min","Appearing over the tree line in the mountains, long thin white light appearing to change shape","10/8/22","Yes","https://www.nuforc.org/webreports/reports/171/S171262.html","515X2022.11.14.18.04.39",FALSE
"8/19/22 21:43","Ajax","ON","Canada","Cylinder","40 seconds","I looked up and noticed a cylinder/submarine with not lights surrounding it, it had a light glow around it that was noticeable to see","10/8/22","","https://www.nuforc.org/webreports/reports/171/S171247.html","516X2022.11.14.18.04.39",FALSE
"8/19/22 21:05","Point pleasant","NJ","USA","Changing","I saw it for three hours","Ive seen hundreds of objects five straight times Ive sent you guys at least 20 videos now and I have not heard one word From u","10/8/22","","https://www.nuforc.org/webreports/reports/171/S171459.html","517X2022.11.14.18.04.39",FALSE
"8/19/22 21:00","Lakewood","NY","USA","Cigar","60-90 seconds","We saw a long straight light about two finger widths that moved across the sky and then abruptly turned or disappeared","10/8/22","","https://www.nuforc.org/webreports/reports/171/S171231.html","518X2022.11.14.18.04.39",FALSE
"8/19/22 20:58","Henniker","NH","USA","Cigar","30 seconds","We saw this light just floating and went across the sky really slowly and was white and slowly disappeared","10/8/22","Yes","https://www.nuforc.org/webreports/reports/171/S171246.html","519X2022.11.14.18.04.39",FALSE
"8/19/22 20:50","North PEI Brackley beach","Prince Edward Island","Canada","Disk","Unknown","Strange object above.","10/8/22","","https://www.nuforc.org/webreports/reports/171/S171282.html","520X2022.11.14.18.04.39",FALSE
"8/19/22 20:27","Rhode Island","RI","USA","Cigar",")","2 orange streaks","10/8/22","","https://www.nuforc.org/webreports/reports/171/S171319.html","521X2022.11.14.18.04.39",FALSE
"8/19/22 11:14","","","","","","Cumulative Report 3","10/8/22","","https://www.nuforc.org/webreports/reports/171/S171211.html","522X2022.11.14.18.04.39",FALSE
"8/19/22 09:59","Amboy","WA","USA","Unknown","Close to 60 seconds","Looked like a lighted train in the sky","10/8/22","","https://www.nuforc.org/webreports/reports/171/S171254.html","523X2022.11.14.18.04.39",FALSE
"8/19/22 09:45","Baldwinsville","NY","USA","Cigar","20-30 seconds","Almost home when my wife alerted me to look up. Hard to say what its altitude was - maybe 2500 and moving very slowly","10/8/22","Yes","https://www.nuforc.org/webreports/reports/171/S171267.html","524X2022.11.14.18.04.39",FALSE
