"Date/Time","City","State","Country","Shape","Duration","Summary","Posted","Image","URL","ID","madar"
"9/22/22 21:15","Knoxville","TN","USA","Light","5 minutes","A single flashing red light moving frenetically in a random geometric pattern.","10/8/22","","https://www.nuforc.org/webreports/reports/171/S171948.html","208X2022.11.14.18.04.39",FALSE
"9/22/22 21:15","Gulf Breeze","FL","USA","Triangle","1 minute","Orange shape","10/8/22","","https://www.nuforc.org/webreports/reports/172/S172061.html","209X2022.11.14.18.04.39",FALSE
"9/22/22 21:10","El Mirage","AZ","USA","Other","","I was laying in my bed at night and saw it in the sky","10/8/22","","https://www.nuforc.org/webreports/reports/171/S171941.html","210X2022.11.14.18.04.39",FALSE
"9/22/22 20:44","Hinckley","MN","USA","Light","10 mins","Orange red lights","10/8/22","","https://www.nuforc.org/webreports/reports/171/S171946.html","211X2022.11.14.18.04.39",FALSE
"9/22/22 20:35","Miles","TX","USA","Teardrop","2 seconds","Miles highschool track Field Heading North at 100° from horizon","10/8/22","","https://www.nuforc.org/webreports/reports/171/S171947.html","212X2022.11.14.18.04.39",FALSE
"9/22/22 20:29","Stoney Fork","PA","USA","Rectangle","Not sure","This was caught on a trail camera","10/8/22","Yes","https://www.nuforc.org/webreports/reports/172/S172189.html","213X2022.11.14.18.04.39",FALSE
"9/22/22 19:53","Sattley","CA","USA","Rectangle","Don't know","I have never seen a bright light or star where I saw this. It looked like it was not moving. When I took picture with phone it looks li","10/8/22","","https://www.nuforc.org/webreports/reports/171/S171957.html","214X2022.11.14.18.04.39",FALSE
"9/22/22 19:05","Green Cove Springs","FL","USA","Cigar","30 seconds","Looking forward out of our windshield we saw a bright reflection of the what we thought was a plane but apparently it was clearly not.","10/8/22","","https://www.nuforc.org/webreports/reports/171/S171951.html","215X2022.11.14.18.04.39",FALSE
"9/22/22 14:16","Tyrone","PA","USA","Circle","Pennsylvania","It was flying around the housing development I live in","10/8/22","","https://www.nuforc.org/webreports/reports/171/S171917.html","216X2022.11.14.18.04.39",FALSE
"9/22/22 13:45","Monmouth","OR","USA","Sphere","5 minutes","Silver sphere spotted heading towards Corvallis oregon on 99 south","10/8/22","","https://www.nuforc.org/webreports/reports/171/S171945.html","217X2022.11.14.18.04.39",FALSE
"9/22/22 09:11","Dallas","TX","USA","Delta","4 seconds","Dark Triangular UFO","10/8/22","Yes","https://www.nuforc.org/webreports/reports/171/S171921.html","218X2022.11.14.18.04.39",FALSE
"9/22/22 06:40","San Bernardino","CA","USA","Oval","Lasted 20secs","Heading to work and it just a appears in the sky comes close and just does a  J  turn and hyperdrives out too space","10/8/22","","https://www.nuforc.org/webreports/reports/171/S171922.html","219X2022.11.14.18.04.39",FALSE
"9/22/22 03:54","Chino Hills","CA","USA","Sphere","About one second","Ring camera in garage captured orb exiting car approaches camera then launches towards sky.","10/8/22","","https://www.nuforc.org/webreports/reports/171/S171918.html","220X2022.11.14.18.04.39",FALSE
"9/22/22 03:00","Shaftsbury","VT","USA","Unknown","at least 10 minutes","large aircraft blinking red and green lights alternately","10/8/22","","https://www.nuforc.org/webreports/reports/172/S172043.html","221X2022.11.14.18.04.39",FALSE
"9/21/22 23:28","Robertsdale","AL","USA","Light","3 to 5 minutes","Watched what appeared as a star move across the sky multiple directions","10/8/22","","https://www.nuforc.org/webreports/reports/172/S172098.html","222X2022.11.14.18.04.39",FALSE
"9/21/22 22:45","Birmingham","AL","USA","Unknown","7 min","Two very large, very bright round lights, flash on/off","10/8/22","","https://www.nuforc.org/webreports/reports/171/S171927.html","223X2022.11.14.18.04.39",FALSE
"9/21/22 22:19","Marathon","FL","USA","Triangle","9-12 seconds","Large Dark triangle shaped craft without lights 60-80ft wingspan and was silent as a whisper","10/8/22","","https://www.nuforc.org/webreports/reports/171/S171931.html","224X2022.11.14.18.04.39",FALSE
"9/21/22 22:09","Buffalo","NY","USA","Star","5min","star-like ball of light travelling in a b-line in a NE direction from Lake Erie direction against the wind","10/8/22","","https://www.nuforc.org/webreports/reports/172/S172168.html","225X2022.11.14.18.04.39",FALSE
"9/21/22 22:00","Fayetteville","TN","USA","Circle","Approximately 3 min","I was coming home , from about 200 yards away I saw what I thought was a Chinese lantern fl stationary roughly 30 to 50 feet above the.","10/8/22","","https://www.nuforc.org/webreports/reports/171/S171988.html","226X2022.11.14.18.04.39",FALSE
"9/21/22 21:50","Waterbury","CT","USA","Light","No more than 10 minutes","Flashing red/white lights - whirring sound when lights were 'on'/visible - no sound when lights were ""off""/not visible","10/8/22","","https://www.nuforc.org/webreports/reports/171/S171943.html","227X2022.11.14.18.04.39",FALSE
"9/21/22 21:33","Brevard","NC","USA","Changing","Still continuing","Moves in erratic, zig zag and extremely fast motions, appearing and reappearing at unnatural distances.","10/8/22","","https://www.nuforc.org/webreports/reports/171/S171929.html","228X2022.11.14.18.04.39",FALSE
"9/21/22 21:21","PORT WASHINGTON","NY","USA","Circle","2 minutes","Swirling hovering sound and a round object circling fast","10/8/22","Yes","https://www.nuforc.org/webreports/reports/171/S171949.html","229X2022.11.14.18.04.39",FALSE
"9/21/22 20:52","Venice","FL","USA","Unknown","20 seconds","Observed unidentified flying object(s)","10/8/22","","https://www.nuforc.org/webreports/reports/171/S171933.html","230X2022.11.14.18.04.39",FALSE
"9/21/22 20:50","Naples","NY","USA","Fireball","12 minutes","Saw 5 objects the most I have ever seen in 1 night","10/8/22","","https://www.nuforc.org/webreports/reports/171/S171934.html","231X2022.11.14.18.04.39",FALSE
"9/21/22 20:23","Las Vegas","NV","USA","Other","Approx. 30 second","Looking in sky to spot satellites","10/8/22","","https://www.nuforc.org/webreports/reports/172/S172056.html","232X2022.11.14.18.04.39",FALSE
"9/21/22 19:42","Lapeer","MI","USA","Rectangle","A few seconds","Picture captured of something in sky","10/8/22","","https://www.nuforc.org/webreports/reports/171/S171924.html","233X2022.11.14.18.04.39",FALSE
"9/21/22 19:31","San Marcos","CA","USA","Formation","4 minutes","Two red lights in formation, roughly 400 feet apart, moving south close to horizon","10/8/22","","https://www.nuforc.org/webreports/reports/172/S172039.html","234X2022.11.14.18.04.39",FALSE
"9/21/22 14:35","Sacramento","CA","USA","Formation","15 minutes","Looked up and in distance at very high altitude we saw a group of 4 objects surrounding 1 object and 10 others in irregular line nearby","10/8/22","","https://www.nuforc.org/webreports/reports/171/S171936.html","235X2022.11.14.18.04.39",FALSE
"9/21/22 12:30","Norristown","PA","USA","Light","A few minutes","Multiple flashing lights not in a line like starlink","10/8/22","","https://www.nuforc.org/webreports/reports/171/S171937.html","236X2022.11.14.18.04.39",FALSE
"9/21/22 10:24","","","USA","Other","","The Entity, that stood on the Tower.","10/8/22","","https://www.nuforc.org/webreports/reports/171/S171875.html","237X2022.11.14.18.04.39",FALSE
"9/21/22 10:20","Osceola","IA","USA","Unknown","About a hour.","The UFOs flew over my apartment and picked up a car and dropped it.","10/8/22","","https://www.nuforc.org/webreports/reports/171/S171879.html","238X2022.11.14.18.04.39",FALSE
"9/21/22 09:56","","","USA","Other","","The old, woman.","10/8/22","","https://www.nuforc.org/webreports/reports/171/S171876.html","239X2022.11.14.18.04.39",FALSE
"9/21/22 09:42","Manila","","Philippines","Sphere","20 mins","White spheres","10/8/22","Yes","https://www.nuforc.org/webreports/reports/171/S171888.html","240X2022.11.14.18.04.39",FALSE
"9/21/22 05:10","The Woodlands/Spring","TX","USA","Chevron","10-15 seconds","Saw 3 lights in triangle shape move in L shape. Moved way too fast to be any airplane.","10/8/22","","https://www.nuforc.org/webreports/reports/171/S171882.html","241X2022.11.14.18.04.39",FALSE
"9/21/22 03:05","Beverly Hills","CA","USA","Delta","2 to 5 minutes","Observed UFO flying West to East at a high rate of speed.","10/8/22","","https://www.nuforc.org/webreports/reports/171/S171880.html","242X2022.11.14.18.04.39",FALSE
"9/20/22 22:48","Rural/Not Applicable","WV","USA","Changing","1 minute 34 seconds","Smoking a cigarette and walking the dog in the yard late in the evening when I looked up and saw the object. Shot a video on an iPhone.","10/8/22","","https://www.nuforc.org/webreports/reports/171/S171950.html","243X2022.11.14.18.04.39",FALSE
"9/20/22 22:02","Arlington","WA","USA","Light","2 minutes","Light seen in sky","10/8/22","","https://www.nuforc.org/webreports/reports/171/S171960.html","244X2022.11.14.18.04.39",FALSE
"9/20/22 20:09","Westland","MI","USA","Light","","Seen a light hovering thought it was a plane but it went backward then shot forward","10/8/22","","https://www.nuforc.org/webreports/reports/172/S172135.html","245X2022.11.14.18.04.39",FALSE
"9/20/22 20:00","Greenville","NC","USA","Unknown","1.5 hours","Orange/White light changing from extremely bright to nothing","10/8/22","","https://www.nuforc.org/webreports/reports/171/S171878.html","246X2022.11.14.18.04.39",FALSE
"9/20/22 17:35","Shorewood","WI","USA","Sphere","5 Minutes","Two spherical objects flew over my house in a straight line from south to north","10/8/22","","https://www.nuforc.org/webreports/reports/171/S171938.html","247X2022.11.14.18.04.39",FALSE
"9/20/22 05:46","West Milford","NJ","USA","Light","2 mins","Bright white light, heading from northwest to southeast. Swerving flight path","10/8/22","","https://www.nuforc.org/webreports/reports/171/S171899.html","248X2022.11.14.18.04.39",FALSE
"9/20/22 01:34","","","USA","Circle","1 minute","Unknown orb left visible trail on camera 2 minutes after initial photo","10/8/22","Yes","https://www.nuforc.org/webreports/reports/171/S171881.html","249X2022.11.14.18.04.39",FALSE
"9/20/22 01:00","Phoenixville","PA","USA","Light","5 minutes","Indistinct object with rapidly changing lights of different colors sighted moving erratically in Phoenixville","10/8/22","","https://www.nuforc.org/webreports/reports/171/S171890.html","250X2022.11.14.18.04.39",FALSE
"9/20/22 01:00","West Bloomfield","NY","USA","Unknown","20-30 minutes","Slipping into bed when I noticed a distant bright which stopped, moved back, wiggled, and faded out","10/8/22","","https://www.nuforc.org/webreports/reports/171/S171900.html","251X2022.11.14.18.04.39",FALSE
"9/19/22 23:20","","","USA","Circle","","Shadowed beings,' with red glowing eyes.","10/8/22","Yes","https://www.nuforc.org/webreports/reports/171/S171885.html","252X2022.11.14.18.04.39",FALSE
"9/19/22 22:07","Half Moon Bay","CA","USA","Light","3 seconds","I saw two high-altitude soft cool light glows, one following the other which is exactly what I saw on the 9th of September of this year","10/8/22","","https://www.nuforc.org/webreports/reports/171/S171904.html","253X2022.11.14.18.04.39",FALSE
"9/19/22 22:00","Lebanon","OR","USA","Light","15seconds","It flew into an invisible object.","10/8/22","","https://www.nuforc.org/webreports/reports/171/S171889.html","254X2022.11.14.18.04.39",FALSE
"9/19/22 21:50","Ocean City","MD","USA","Formation","Approximately 10-15 mins","Red lights in the sky","10/8/22","Yes","https://www.nuforc.org/webreports/reports/171/S171902.html","255X2022.11.14.18.04.39",FALSE
"9/19/22 21:32","Wexford","","Ireland","Circle","40 secondss","Flashing circular moving across the sky at rapid speed","10/8/22","","https://www.nuforc.org/webreports/reports/171/S171915.html","256X2022.11.14.18.04.39",FALSE
"9/19/22 21:15","between lindale texas and canton texas","TX","USA","Triangle","30 seonds","basically just a row of windows? traveling low and slow over the highway then just fading out.","10/8/22","","https://www.nuforc.org/webreports/reports/171/S171906.html","257X2022.11.14.18.04.39",FALSE
"9/19/22 21:01","Vista","CA","USA","Changing","The past 15 minutes","First there were 2 orange big lights, they disappeared and c/m and back smaller as 5 lights and were spinning in a circle","10/8/22","","https://www.nuforc.org/webreports/reports/171/S171908.html","258X2022.11.14.18.04.39",FALSE
"9/19/22 21:00","Wilmington","NC","USA","Cigar","6 seconds","it was a flying stick with large windows about 6 with white light coming out of the windows, it was flying fast and went quickly.","10/8/22","","https://www.nuforc.org/webreports/reports/171/S171894.html","259X2022.11.14.18.04.39",FALSE
"9/19/22 20:55","Arcola","TX","USA","Formation","~12 seconds","Bright lights in a V or horseshoe formation that disappeared rapidly.","10/8/22","Yes","https://www.nuforc.org/webreports/reports/171/S171907.html","260X2022.11.14.18.04.39",FALSE
"9/19/22 20:41","Ventura","CA","USA","Rectangle","30 secs","Ladder with lights","10/8/22","","https://www.nuforc.org/webreports/reports/171/S171920.html","261X2022.11.14.18.04.39",FALSE
"9/19/22 20:28","Valdosta","GA","USA","Changing","","Line moving very fast , lights then became a circle type then a sprial","10/8/22","","https://www.nuforc.org/webreports/reports/171/S171897.html","262X2022.11.14.18.04.39",FALSE
"9/19/22 20:28","Dallas","GA","USA","Light","10 seconds","Multiple straight lights traveling low.  ((NUFORC Note:  Starlink satellittes.  PD))","10/8/22","","https://www.nuforc.org/webreports/reports/171/S171895.html","263X2022.11.14.18.04.39",FALSE
"9/19/22 20:15","McCormick","SC","USA","Rectangle","one to two minutes","A string of rectangle e=devices in a straight line moving across the sky","10/8/22","","https://www.nuforc.org/webreports/reports/171/S171901.html","264X2022.11.14.18.04.39",FALSE
"9/19/22 19:51","","","USA","Circle","","Shadowed Beings With Red Glowing Eyes","10/8/22","Yes","https://www.nuforc.org/webreports/reports/171/S171909.html","265X2022.11.14.18.04.39",FALSE
"9/19/22 19:45","Lackawanna","NY","USA","Cigar","10min","Flashing light standing pretty still in the sky seemed to fade in and out","10/8/22","","https://www.nuforc.org/webreports/reports/171/S171910.html","266X2022.11.14.18.04.39",FALSE
"9/19/22 19:31","Dothan","AL","USA","Cigar","10 seconds","It's was cigar 5 bright lights. I walked outside after a misunderstanding with my girlfriend. As soon as I got outside I looked up and","10/8/22","","https://www.nuforc.org/webreports/reports/171/S171891.html","267X2022.11.14.18.04.39",FALSE
"9/19/22 19:15","Phoenix","AZ","USA","Light","20","Unexplained light over Southeastern Phoenix Metro","10/8/22","Yes","https://www.nuforc.org/webreports/reports/171/S171892.html","268X2022.11.14.18.04.39",FALSE
"9/19/22 19:00","West Plains","MO","USA","Other","8 months","Sighting first in Rolla then followed to St. Charles and West Plains, Mo.","10/8/22","","https://www.nuforc.org/webreports/reports/171/S171952.html","269X2022.11.14.18.04.39",FALSE
"9/19/22 12:30","Fowler","CA","USA","Oval","12:30am to 4:30am","It keeps triggering my ring camera's.","10/8/22","","https://www.nuforc.org/webreports/reports/171/S171896.html","270X2022.11.14.18.04.39",FALSE
"9/19/22 01:41","Jamestown","TN","USA","Light","2-3 minutes","Have 1:42 of mystery light within close proximity","10/8/22","","https://www.nuforc.org/webreports/reports/172/S172076.html","271X2022.11.14.18.04.39",FALSE
"9/19/22 00:05","Winterport","ME","USA","Triangle","5 minutes","I saw one small Aircraft do what looked like a traffic pattern and another seem do a decent through the cloud layer.","10/8/22","","https://www.nuforc.org/webreports/reports/171/S171912.html","272X2022.11.14.18.04.39",FALSE
"9/18/22 23:48","Fairbanks","AK","USA","Circle","Approx 10-12 seconds?","Saw a satellite then saw a light pacing behind it.","10/8/22","Yes","https://www.nuforc.org/webreports/reports/171/S171866.html","273X2022.11.14.18.04.39",FALSE
"9/18/22 23:30","Palo Alto","CA","USA","Triangle","4 min","Angular shaped vessel, bright lights surrounding it at the top.","10/8/22","Yes","https://www.nuforc.org/webreports/reports/171/S171867.html","274X2022.11.14.18.04.39",FALSE
"9/18/22 22:01","Douglasville","GA","USA","Light","Watched for about 2 min","Flickering light red and white in color","10/8/22","","https://www.nuforc.org/webreports/reports/171/S171868.html","275X2022.11.14.18.04.39",FALSE
"9/18/22 21:35","Sarasota","FL","USA","Changing","Maybe 2 minutes","Unidentified orb-ish light, almost jellyfish/ stingray like","10/8/22","","https://www.nuforc.org/webreports/reports/171/S171870.html","276X2022.11.14.18.04.39",FALSE
"9/18/22 21:18","Hot Springs Village","AR","USA","Triangle","","Bright lights shoots down at times","10/8/22","","https://www.nuforc.org/webreports/reports/171/S171869.html","277X2022.11.14.18.04.39",FALSE
"9/18/22 21:00","Aventura","FL","USA","Changing","Ongoing for the past hour","Its between oval and square shape that keeps turning colors and intensity, on one same spot","10/8/22","Yes","https://www.nuforc.org/webreports/reports/171/S171873.html","278X2022.11.14.18.04.39",FALSE
"9/18/22 20:58","London","London Borough of Islington","United Kingdom","Oval","About a minute or so.","I was standing in my balcony and say one light yellow like fire ball thats moving then disappeared and appeared 2 and vanished","10/8/22","","https://www.nuforc.org/webreports/reports/171/S171864.html","279X2022.11.14.18.04.39",FALSE
"9/18/22 20:16","Boca Raton","FL","USA","Circle","12 seconds","On my nest during a storm I saw this","10/8/22","","https://www.nuforc.org/webreports/reports/171/S171893.html","280X2022.11.14.18.04.39",FALSE
"9/18/22 19:40","Colorado springs","CO","USA","Sphere","","A random white orb appeared in the sky and was moving very slow. No other lights were on it","10/8/22","","https://www.nuforc.org/webreports/reports/171/S171871.html","281X2022.11.14.18.04.39",FALSE
"9/18/22 19:40","Colorado springs","CO","USA","Sphere","40 seconds","A random white orb appeared in the sky and was moving very slow. No other lights were on it","10/8/22","","https://www.nuforc.org/webreports/reports/171/S171872.html","282X2022.11.14.18.04.39",FALSE
"9/18/22 02:33","Everett","WA","USA","Unknown","8-15 seconds","UFO Does loopty loop then disappears","10/8/22","","https://www.nuforc.org/webreports/reports/171/S171849.html","283X2022.11.14.18.04.39",FALSE
"9/18/22 00:20","Henrietta","NY","USA","Circle","~1 second","circle craft came out from the area where the moon was,flew down and to the left incredibly fast,then quicky dropped below the treeline","10/8/22","","https://www.nuforc.org/webreports/reports/171/S171854.html","284X2022.11.14.18.04.39",FALSE
"9/17/22 23:58","Stephenville","NF","Canada","Cylinder","Not sure","3 Crafts Over Home","10/8/22","Yes","https://www.nuforc.org/webreports/reports/171/S171860.html","285X2022.11.14.18.04.39",FALSE
"9/17/22 23:37","Las Vegas","","USA","Triangle","Approximately 4 seconds","V Shaped UFO with white bright light under each side","10/8/22","","https://www.nuforc.org/webreports/reports/172/S172062.html","286X2022.11.14.18.04.39",FALSE
"9/17/22 21:35","Coon Rapids","MN","USA","Circle","3 minutes","Green pulsating Light, moving sporadically, changing directions. Stopping near a bright visible star","10/8/22","Yes","https://www.nuforc.org/webreports/reports/171/S171855.html","287X2022.11.14.18.04.39",FALSE
"9/17/22 21:32","Milwaukee","WI","USA","Fireball","about 15 seconds","Fireball over Lake Michigan, silent, changing direction before disappearing into clouds","10/8/22","","https://www.nuforc.org/webreports/reports/171/S171916.html","288X2022.11.14.18.04.39",FALSE
"9/17/22 21:27","Charlotte","NC","USA","Diamond","2 minutes","Sitting with my mom and sister on my deck in my backyard and saw a blinding diamond shaped light for roughly two minutes.","10/8/22","","https://www.nuforc.org/webreports/reports/171/S171862.html","289X2022.11.14.18.04.39",FALSE
"9/17/22 20:52","Washington","VA","USA","Light","Approximately 35 minutes","2 lights synchronized side by side darting in the sky and occasionally come together and then repeat side by side","10/8/22","","https://www.nuforc.org/webreports/reports/171/S171843.html","290X2022.11.14.18.04.39",FALSE
"9/17/22 20:28","Deland","FL","USA","Triangle","5-6 minutes","I was filming the launch of the SpaceX capsule and saw the Object below the space X rocket","10/8/22","Yes","https://www.nuforc.org/webreports/reports/171/S171969.html","291X2022.11.14.18.04.39",FALSE
"9/17/22 20:18","Troy","MI","USA","Circle","1 minute","Round bright object hovering at dusk","10/8/22","","https://www.nuforc.org/webreports/reports/171/S171857.html","292X2022.11.14.18.04.39",FALSE
"9/17/22 20:00","Hummelstown","PA","USA","Light","Approximately 10 minutes","Cluster of red moving lights","10/8/22","","https://www.nuforc.org/webreports/reports/171/S171858.html","293X2022.11.14.18.04.39",FALSE
"9/17/22 19:28","Aberdeen","SD","USA","Fireball","Hours","Its came, floated around and slowly faded","10/8/22","Yes","https://www.nuforc.org/webreports/reports/171/S171840.html","294X2022.11.14.18.04.39",FALSE
"9/17/22 17:45","Turner","ME","USA","Oval","2 Minutes or more","Silent, high altitude fast moving.","10/8/22","","https://www.nuforc.org/webreports/reports/171/S171848.html","295X2022.11.14.18.04.39",FALSE
"9/17/22 16:50","Frome","Somerset","United Kingdom","Changing","about 2 mins","It was very high in the sky and the sky was clear.","10/8/22","Yes","https://www.nuforc.org/webreports/reports/171/S171817.html","296X2022.11.14.18.04.39",FALSE
"9/17/22 13:40","Provo","UT","USA","Sphere","5 minutes","Witnessed a spherical object hovering motionless 2000' in the air. After several minutes it made a rapid, controlled descent.","10/8/22","Yes","https://www.nuforc.org/webreports/reports/171/S171841.html","297X2022.11.14.18.04.39",FALSE
"9/17/22 02:20","","","","Circle","","Entitys that are shadowed silhouettes some are transparent with entirely bright blood red glowing eyes and the entitys have powers","10/8/22","Yes","https://www.nuforc.org/webreports/reports/171/S171850.html","298X2022.11.14.18.04.39",FALSE
"9/17/22 00:15","Cliffside Park","NJ","USA","Light","Approx 5 minutes","Bright light extending from dark cloud formation over river, moving very slowly and deliberately","10/8/22","","https://www.nuforc.org/webreports/reports/171/S171839.html","299X2022.11.14.18.04.39",FALSE
"9/16/22 23:45","Waterford","ME","USA","Light",">25 minutes","Light about the size of a satellite, moving Side to side, up and down, small circles, and figure eights","10/8/22","","https://www.nuforc.org/webreports/reports/171/S171826.html","300X2022.11.14.18.04.39",FALSE
"9/16/22 23:30","Pearl city","HI","USA","Cylinder","Thirty minutes","Moving across the sky above pearl city hawaii","10/8/22","","https://www.nuforc.org/webreports/reports/171/S171884.html","301X2022.11.14.18.04.39",FALSE
"9/16/22 22:00","Ridley Park","PA","USA","Cylinder","1.5 hours","At least 3 crafts circling PA NJ DE area","10/8/22","","https://www.nuforc.org/webreports/reports/171/S171820.html","302X2022.11.14.18.04.39",FALSE
"9/16/22 21:46","Napa","CA","USA","Light","45 seconds","IFO sighting SF Bay area","10/8/22","","https://www.nuforc.org/webreports/reports/171/S171824.html","303X2022.11.14.18.04.39",FALSE
"9/16/22 21:30","Vassalboro","ME","USA","Circle","2-3 mins","9 objects over few minutes time","10/8/22","","https://www.nuforc.org/webreports/reports/171/S171823.html","304X2022.11.14.18.04.39",FALSE
"9/16/22 21:09","Downtown St. Louis","MO","USA","Fireball","2 minutes","Orange Reddish Fireballs Multiplying","10/8/22","","https://www.nuforc.org/webreports/reports/171/S171859.html","305X2022.11.14.18.04.39",FALSE
"9/16/22 21:01","Schenectady","NY","USA","Circle","Approximately 6 minutes","Glowing balls that looked like round fireballs travelling one minute behind each other going in the same direction.","10/8/22","","https://www.nuforc.org/webreports/reports/171/S171905.html","306X2022.11.14.18.04.39",FALSE
"9/16/22 21:00","St Louis","MO","USA","Fireball","About 5 min is all I saw","4 fireballs falling merged into 1, than split into 4 and left 5th ball behind stationary. Than the 4 stopped falling and 2 more appeare","10/8/22","","https://www.nuforc.org/webreports/reports/171/S171825.html","307X2022.11.14.18.04.39",FALSE
"9/16/22 20:30","Wrightsville Beach","NC","USA","Changing","2 minutes","*Update* 2 UFOs Spotted Fri 9/16/22 @8:30PM Over Wrightsville Beach, NC","10/8/22","","https://www.nuforc.org/webreports/reports/171/S171903.html","308X2022.11.14.18.04.39",FALSE
"9/16/22 20:30","Wrightsville Beach","NC","USA","Sphere","2 minutes","Spotted 2 UFOs, one white one red & white, above Wrightsville Beach","10/8/22","Yes","https://www.nuforc.org/webreports/reports/171/S171831.html","309X2022.11.14.18.04.39",FALSE
"9/16/22 20:20","Silver Bay","NY","USA","Light","3 minutes","3 lights in a row moving same speed","10/8/22","","https://www.nuforc.org/webreports/reports/171/S171833.html","310X2022.11.14.18.04.39",FALSE
"9/16/22 20:10","Lamoille Canyon","NV","USA","Light","1 to 2 minutes","I have a video. It moved down and over then stopped then moved again and stopped then disappeared.","10/8/22","","https://www.nuforc.org/webreports/reports/171/S171861.html","311X2022.11.14.18.04.39",FALSE
"9/16/22 20:00","Springfield","NH","USA","Triangle","Approximately an hour","Sitting at a campfire in front yard. A guest noticed an triangle shaped area of the sky with no stars showing.","10/8/22","","https://www.nuforc.org/webreports/reports/171/S171955.html","312X2022.11.14.18.04.39",FALSE
