"Date/Time","City","State","Country","Shape","Duration","Summary","Posted","Image","URL","ID","madar"
"9/16/22 16:30","Silver Bay","NY","USA","Cigar","Clear view approx 7 minu","I was out on the point for a wedding rehearsal, and I noticed something shimmering in sky.","10/8/22","","https://www.nuforc.org/webreports/reports/171/S171835.html","313X2022.11.14.18.04.39",FALSE
"9/16/22 07:00","Asheville","","","Circle","45 minutes","Large circle of lights","10/8/22","","https://www.nuforc.org/webreports/reports/171/S171874.html","314X2022.11.14.18.04.39",FALSE
"9/16/22 06:10","Coweta","OK","USA","Circle","1 or 2 minutes","Very fast moving bright circular craft that made no sound coming out of the west, flew overhead and faded to a dull hew then vanished","10/8/22","","https://www.nuforc.org/webreports/reports/171/S171774.html","315X2022.11.14.18.04.39",FALSE
"9/16/22 00:05","Irvington/Newark border","NJ","USA","Circle","30-60 seconds","Seen hovering on a residential street before passing slowly diagonally over houses","10/8/22","","https://www.nuforc.org/webreports/reports/171/S171777.html","316X2022.11.14.18.04.39",FALSE
"9/15/22 22:45","China","ME","USA","Light","2 minutes","Two solid lights moving in unison, one fluctuating in luminosity.","10/8/22","","https://www.nuforc.org/webreports/reports/171/S171847.html","317X2022.11.14.18.04.39",FALSE
"9/15/22 22:39","De Pere","WI","USA","Light","5 seconds","Blue light that rapidly grew, broke off into 3, ""fell"" a small bit, and disappeared","10/8/22","","https://www.nuforc.org/webreports/reports/171/S171778.html","318X2022.11.14.18.04.39",FALSE
"9/15/22 22:37","Arlington Heights","IL","USA","Chevron","1 second","while driving saw a neon green long rectangular object with a pointed end heading towards the southwest","10/8/22","","https://www.nuforc.org/webreports/reports/171/S171779.html","319X2022.11.14.18.04.39",FALSE
"9/15/22 21:49","Marysville","OH","USA","Light","16 seconds","Bright ""white sparking"" lights really high in night sky.","10/8/22","","https://www.nuforc.org/webreports/reports/171/S171829.html","320X2022.11.14.18.04.39",FALSE
"9/15/22 21:40","North Las Vegas","NV","USA","Light","3 minutes","Set of three bright white lights moving in formation","10/8/22","","https://www.nuforc.org/webreports/reports/171/S171772.html","321X2022.11.14.18.04.39",FALSE
"9/15/22 21:10","Woonsocket","RI","USA","Circle","30 minutes","Semi circle of lights hovering","10/8/22","Yes","https://www.nuforc.org/webreports/reports/171/S171780.html","322X2022.11.14.18.04.39",FALSE
"9/15/22 21:00","Mount Pleasant","TX","USA","Circle","About 2-3 minutes total","First dot making triangular patterns. The next two criss crossed straight lines. The final one flew west in a straight line","10/8/22","","https://www.nuforc.org/webreports/reports/171/S171783.html","323X2022.11.14.18.04.39",FALSE
"9/15/22 20:58","Mayville","WI","USA","Other","3 seconds","Saw a faint red lit dark object move very fast in a non linear manner and disappear rapidly all within 3 seconds or so.","10/8/22","","https://www.nuforc.org/webreports/reports/171/S171784.html","324X2022.11.14.18.04.39",FALSE
"9/15/22 20:04","Amherst","MA","USA","Light","","2 of them were extremely bright white lights with halos they were approximately a mile up and moving about 300-400 mph.","10/8/22","","https://www.nuforc.org/webreports/reports/171/S171832.html","325X2022.11.14.18.04.39",FALSE
"9/15/22 20:00","Kiawah Island","SC","USA","Circle","Hour or more","Noticed a reddish circular object in the sky that appeared at to be moving and then seemed to hover.","10/8/22","Yes","https://www.nuforc.org/webreports/reports/171/S171781.html","326X2022.11.14.18.04.39",FALSE
"9/15/22 19:06","Gharbia in the nile delta","Gharbia Governorate","Egypt","Fireball","4 minutes","Bright light object same speed as iss","10/8/22","","https://www.nuforc.org/webreports/reports/171/S171792.html","327X2022.11.14.18.04.39",FALSE
"9/15/22 17:15","Morris Plains","NJ","USA","Circle","15","Filmed a craft that disappeared and reappeared","10/8/22","Yes","https://www.nuforc.org/webreports/reports/171/S171786.html","328X2022.11.14.18.04.39",FALSE
"9/15/22 13:05","Thornton","CO","USA","Circle","4-5 seconds","I witnessed a group of 6 or 7 golden objects move across the sky & as I tracked them they came together as one and disappeared.","10/8/22","","https://www.nuforc.org/webreports/reports/171/S171797.html","329X2022.11.14.18.04.39",FALSE
"9/15/22 10:10","Luttrell-manerdville","TN","USA","Cylinder","Slow speed apx 10min","It was slow moving, top and bottom flashing white lights","10/8/22","","https://www.nuforc.org/webreports/reports/171/S171782.html","330X2022.11.14.18.04.39",FALSE
"9/15/22 09:30","Apopka","FL","USA","Other","5 - 10 minutes","I have photos. Also, there was a rocket launching immediately after the sighting, but there were no scheduled rocket launches, today.","10/8/22","Yes","https://www.nuforc.org/webreports/reports/171/S171789.html","331X2022.11.14.18.04.39",FALSE
"9/15/22 04:50","Milan","MI","USA","Triangle","10 seconds","Flew right over the road","10/8/22","","https://www.nuforc.org/webreports/reports/172/S172049.html","332X2022.11.14.18.04.39",FALSE
"9/15/22 03:14","Mansfield","MA","USA","Light","Every night","UFOS OVER MY HOUSE EVERY NIGHT. GOVERNMENT DRONES CIRCLING","10/8/22","","https://www.nuforc.org/webreports/reports/171/S171796.html","333X2022.11.14.18.04.39",FALSE
"9/15/22 00:01","South Dennis","MA","USA","Other","1 minute","2 sets of blinking red lights pass very close to eachother","10/8/22","","https://www.nuforc.org/webreports/reports/171/S171799.html","334X2022.11.14.18.04.39",FALSE
"9/14/22 21:30","Furteventura - Costa Calma beach","","Spain","Light","10 minutes","We saw a green flashing orb like light moving at rapid spees","10/8/22","Yes","https://www.nuforc.org/webreports/reports/171/S171809.html","335X2022.11.14.18.04.39",FALSE
"9/14/22 21:30","Berwyn","PA","USA","Cylinder","seconds","Long line of white light moving quickly and grew a large circle on the front end then poof, disappeared.","10/8/22","","https://www.nuforc.org/webreports/reports/171/S171845.html","336X2022.11.14.18.04.39",FALSE
"9/14/22 21:30","Ellabell","GA","USA","Changing","ongoing","Third time we gave witnessed these UAPs","10/8/22","","https://www.nuforc.org/webreports/reports/171/S171801.html","337X2022.11.14.18.04.39",FALSE
"9/14/22 20:11","Mt Charleston","NV","USA","Light","30 seconds","Brighter than any star, moving what looked like faster than any aircraft","10/8/22","","https://www.nuforc.org/webreports/reports/171/S171800.html","338X2022.11.14.18.04.39",FALSE
"9/14/22 20:00","Gulf Shores","AL","USA","Light","Over a span of 20 minutes","lights splitting, dividing, and then disappearing.","10/8/22","","https://www.nuforc.org/webreports/reports/171/S171771.html","339X2022.11.14.18.04.39",FALSE
"9/14/22 19:30","Baldwin","FL","USA","Light","An hour or 2?","bright orb of light then big aircraft followed. Then I seen what looked like to be a rocket launch. Then the orb&aircraft chased","10/8/22","","https://www.nuforc.org/webreports/reports/171/S171776.html","340X2022.11.14.18.04.39",FALSE
"9/14/22 18:25","Lake Tapps WA 98391","","USA","Sphere","2 minutes","orbs spinning and colliding into each other, shooting out tinier white orbs.","10/8/22","Yes","https://www.nuforc.org/webreports/reports/172/S172105.html","341X2022.11.14.18.04.39",FALSE
"9/14/22 09:20","Duluth","GA","USA","Other","1 hour","Saw it come off the moon or appeared to and watched it slowly move a ross the sky left of the moon then it just stayed put hovering","10/8/22","Yes","https://www.nuforc.org/webreports/reports/171/S171755.html","342X2022.11.14.18.04.39",FALSE
"9/14/22 07:08","Corydon","IN","USA","Triangle","45 minutes to an hour","We were rounding a 90% turn on a small country road and they were waiting as we came out of the sharp turn","10/8/22","","https://www.nuforc.org/webreports/reports/171/S171795.html","343X2022.11.14.18.04.39",FALSE
"9/14/22 06:00","Tamarac","FL","USA","Light","5 m","Walking my dog in the morning","10/8/22","","https://www.nuforc.org/webreports/reports/171/S171811.html","344X2022.11.14.18.04.39",FALSE
"9/14/22 00:01","Urjala","","Finland","Unknown","My life","Rape","10/8/22","","https://www.nuforc.org/webreports/reports/171/S171751.html","345X2022.11.14.18.04.39",FALSE
"9/13/22 23:32","Largo","FL","USA","Triangle","10-15 seconds","Black triangle craft with 3 dull white lights at each point","10/8/22","","https://www.nuforc.org/webreports/reports/171/S171798.html","346X2022.11.14.18.04.39",FALSE
"9/13/22 22:00","Pawley's Island","SC","USA","Light","10 seconds","Group sees an ornage light eject multiple other lights","10/8/22","Yes","https://www.nuforc.org/webreports/reports/171/S171828.html","347X2022.11.14.18.04.39",FALSE
"9/13/22 21:32","Duluth","MN","USA","Rectangle","Maybe in 5 min","Bright orange light in the sky is wat caught my attention","10/8/22","Yes","https://www.nuforc.org/webreports/reports/171/S171788.html","348X2022.11.14.18.04.39",FALSE
"9/13/22 21:30","Myakka City","FL","USA","Light","5 minutes","As it moved over very slowly it had a weird forward movement.","10/8/22","","https://www.nuforc.org/webreports/reports/171/S171757.html","349X2022.11.14.18.04.39",FALSE
"9/13/22 21:17","Aiken","SC","USA","Light","15 minutes that I saw","Changed colors, moved erratically","10/8/22","","https://www.nuforc.org/webreports/reports/171/S171821.html","350X2022.11.14.18.04.39",FALSE
"9/13/22 21:10","Chester Springs","PA","USA","Diamond","10 minutes","A very bright light moving very erratic","10/8/22","","https://www.nuforc.org/webreports/reports/171/S171763.html","351X2022.11.14.18.04.39",FALSE
"9/13/22 21:05","Manchester","Lancashire","United Kingdom","Star","3-4 minutes","Fast to slow moving","10/8/22","","https://www.nuforc.org/webreports/reports/171/S171752.html","352X2022.11.14.18.04.39",FALSE
"9/13/22 20:43","Dover","DE","USA","Light","4-5 minutes","Ball of light","10/8/22","","https://www.nuforc.org/webreports/reports/171/S171762.html","353X2022.11.14.18.04.39",FALSE
"9/13/22 20:10","Mesa","AZ","USA","Light","10 min","Stationary Flashing Bright Green Light","10/8/22","Yes","https://www.nuforc.org/webreports/reports/171/S171760.html","354X2022.11.14.18.04.39",FALSE
"9/13/22 20:05","Paulsboro","NJ","USA","Disk","2 minutes","A craft that turns invisible","10/8/22","","https://www.nuforc.org/webreports/reports/171/S171745.html","355X2022.11.14.18.04.39",FALSE
"9/13/22 19:57","Farmington","MO","USA","Fireball","2 Minutes","As I watched if go past the field across the street I shined a light at it and the ufos light dimes and vanished","10/8/22","","https://www.nuforc.org/webreports/reports/171/S171814.html","356X2022.11.14.18.04.39",FALSE
"9/13/22 19:27","Chandigarh","Chandigarh","India","Circle","More than 30 seconds.","Similar to a shining star and going in a straight line.","10/8/22","","https://www.nuforc.org/webreports/reports/171/S171715.html","357X2022.11.14.18.04.39",FALSE
"9/13/22 19:10","Manchester","Lancashire","United Kingdom","Oval","10 minutes","I was looking up at an aircraft high up in the atmosphere flying along leaving a vapour trail.","10/8/22","","https://www.nuforc.org/webreports/reports/171/S171753.html","358X2022.11.14.18.04.39",FALSE
"9/13/22 06:59","Naples","FL","USA","Changing","7 to 10 min.","Noticed an orb to the right of the moob","10/8/22","","https://www.nuforc.org/webreports/reports/171/S171756.html","359X2022.11.14.18.04.39",FALSE
"9/13/22 05:05","Prosper","TX","USA","Circle","About 10 minutes","oscillating sphere in sky sparkled various color blueish and slight red","10/8/22","Yes","https://www.nuforc.org/webreports/reports/171/S171719.html","360X2022.11.14.18.04.39",FALSE
"9/13/22 00:01","Baldwin Park","CA","USA","Changing","Still out there","Weird lights like orbs changing","10/8/22","","https://www.nuforc.org/webreports/reports/171/S171720.html","361X2022.11.14.18.04.39",FALSE
"9/12/22 22:32","California","PA","USA","Unknown","Over 30 minutes","There were 3 in the shape of a triangle and one circling around it like a fly in smooth motions but not like a plane.","10/8/22","Yes","https://www.nuforc.org/webreports/reports/171/S171722.html","362X2022.11.14.18.04.39",FALSE
"9/12/22 22:30","Windsor","","Canada","Cigar","5-10 seconds","A unknown object flying very low. Had no wings and was as loud and fast as a jet","10/8/22","","https://www.nuforc.org/webreports/reports/171/S171714.html","363X2022.11.14.18.04.39",FALSE
"9/12/22 22:30","Mount Vernon","KY","USA","Disk","15 minutes","Rotating disk","10/8/22","","https://www.nuforc.org/webreports/reports/171/S171724.html","364X2022.11.14.18.04.39",FALSE
"9/12/22 22:05","Thomaston","CT","USA","Disk","2 seconds","We saw a large ship completely lit up moving at an impossible speed across the sky for 2 seconds","10/8/22","Yes","https://www.nuforc.org/webreports/reports/171/S171712.html","365X2022.11.14.18.04.39",FALSE
"9/12/22 22:00","Kiowa","CO","USA","Light","All night","Several Bright lights in the sky. Float and will move closer.","10/8/22","","https://www.nuforc.org/webreports/reports/171/S171717.html","366X2022.11.14.18.04.39",FALSE
"9/12/22 21:19","Garson","ON","Canada","Triangle","60 to 90 seconds","Two triangular craft moving silently in a southerly direction towards my location, then westward up and out of sight. Velocity unknown.","10/8/22","Yes","https://www.nuforc.org/webreports/reports/171/S171747.html","367X2022.11.14.18.04.39",FALSE
"9/12/22 19:55","North Chesterfield","VA","USA","Fireball","It is a still shot","It looks like something entering the atmosphere two objects glowing green","10/8/22","Yes","https://www.nuforc.org/webreports/reports/171/S171716.html","368X2022.11.14.18.04.39",FALSE
"9/12/22 15:30","Isle of Mull","Argyll and Bute","United Kingdom","Star","10 minutes","Unexplained fling object in sky.","10/8/22","Yes","https://www.nuforc.org/webreports/reports/171/S171791.html","369X2022.11.14.18.04.39",FALSE
"9/12/22 13:15","Flushing","NY","USA","Unknown","5 minutes","Craft","10/8/22","Yes","https://www.nuforc.org/webreports/reports/171/S171734.html","370X2022.11.14.18.04.39",FALSE
"9/12/22 09:25","Mount Airy","NC","USA","Disk","Around 30 seconds","Strange object flying in a field.","10/8/22","","https://www.nuforc.org/webreports/reports/171/S171761.html","371X2022.11.14.18.04.39",FALSE
"9/12/22 04:31","San Diego","CA","USA","Unknown","~5-7 minutes","Not clusters from starlink satellites nor aircraft but very high and nearby flying and all emitting light. Came close then parted .","10/8/22","","https://www.nuforc.org/webreports/reports/171/S171739.html","372X2022.11.14.18.04.39",FALSE
"9/11/22 23:22","Monks Corner","SC","USA","Oval","greater than 10 minutes","an oval, double disk, with green & red lights lights appeared near full moon and Jupiter.","10/8/22","","https://www.nuforc.org/webreports/reports/171/S171812.html","373X2022.11.14.18.04.39",FALSE
"9/11/22 21:30","Lakeville","MN","USA","Sphere","13-15 seconds","Spherical Object UFO Sighting","10/8/22","","https://www.nuforc.org/webreports/reports/171/S171816.html","374X2022.11.14.18.04.39",FALSE
"9/11/22 21:16","Lubbock","TX","USA","Chevron","30 seconds","V-shaped object with about 8-10 dim white lights passed southbound directly over Lubbock, Texas.","10/8/22","","https://www.nuforc.org/webreports/reports/171/S171680.html","375X2022.11.14.18.04.39",FALSE
"9/11/22 20:35","Thornton","CO","USA","Circle","a few minutes, 3 passes","4 orange shapes moving through the night sky","10/8/22","","https://www.nuforc.org/webreports/reports/171/S171721.html","376X2022.11.14.18.04.39",FALSE
"9/11/22 20:30","Miami Beach","FL","USA","Triangle","3-4 min","1craft was definitely triangle, the other was just a bright light.","10/8/22","","https://www.nuforc.org/webreports/reports/171/S171727.html","377X2022.11.14.18.04.39",FALSE
"9/11/22 20:23","Dubai","Dubai","United Arab Emirates","Light","spotted in photo only","I took a photo of moon. Spotted something on left side in that photo","10/8/22","Yes","https://www.nuforc.org/webreports/reports/171/S171851.html","378X2022.11.14.18.04.39",FALSE
"9/11/22 20:09","waterville","ME","USA","Light","approximately 7 secs.","we observed a red light appeared descending downward then changed to green/blue then ascended about 5 ft above the building and faded","10/8/22","","https://www.nuforc.org/webreports/reports/171/S171686.html","379X2022.11.14.18.04.39",FALSE
"9/11/22 19:50","Oilton","OK","USA","Changing","Approximately 15 seconds","The object seemed to change shape and was a single light","10/8/22","Yes","https://www.nuforc.org/webreports/reports/171/S171679.html","380X2022.11.14.18.04.39",FALSE
"9/11/22 19:05","Albuquerque","NM","USA","Cylinder","About 1 minute","Black donut shaped craft","10/8/22","","https://www.nuforc.org/webreports/reports/171/S171684.html","381X2022.11.14.18.04.39",FALSE
"9/11/22 18:20","Molino","FL","USA","Cigar","Appx five minutes","Looking out to the West sky a large iridescent bright UFO moving slowly across the sky","10/8/22","","https://www.nuforc.org/webreports/reports/171/S171741.html","382X2022.11.14.18.04.39",FALSE
"9/11/22 18:20","Tuttle","OK","USA","Triangle","1 min.","Very large metal shinning the reflection of sun triangle UFO.","10/8/22","","https://www.nuforc.org/webreports/reports/171/S171742.html","383X2022.11.14.18.04.39",FALSE
"9/11/22 17:58","Waterbury","CT","USA","Sphere","50 seconds","Very large orange orb .it went dark and at point its was only visible with the phone camera not the naked eye","10/8/22","Yes","https://www.nuforc.org/webreports/reports/171/S171973.html","384X2022.11.14.18.04.39",FALSE
"9/11/22 12:16","Jericho","NY","USA","Changing","Approx. 10-15 minutes","Looking up in the parking lot","10/8/22","","https://www.nuforc.org/webreports/reports/171/S171681.html","385X2022.11.14.18.04.39",FALSE
"9/11/22 07:20","Anoka","MN","USA","Disk","12 minutes","I witnessed a suspicious aircraft in air and captured it on video.","10/8/22","Yes","https://www.nuforc.org/webreports/reports/171/S171691.html","386X2022.11.14.18.04.39",FALSE
"9/11/22 06:02","Riviera Beach","FL","USA","Cigar","45 seconds","Bright yellow orange cigar or cylindrical object appeared at the horizon.","10/8/22","Yes","https://www.nuforc.org/webreports/reports/171/S171688.html","387X2022.11.14.18.04.39",FALSE
"9/11/22 05:30","palm bay","FL","USA","Cigar","8mins","very large craft cigar shape","10/8/22","Yes","https://www.nuforc.org/webreports/reports/171/S171690.html","388X2022.11.14.18.04.39",FALSE
"9/11/22 05:20","North Topsail Beach","NC","USA","Cylinder","20 seconds","Large and easily seen in vertical position covered on white lights like dots","10/8/22","","https://www.nuforc.org/webreports/reports/171/S171696.html","389X2022.11.14.18.04.39",FALSE
"9/11/22 00:30","Hartselle","AL","USA","Sphere","1hr 30min","Two very bright bright white spheres one more so than the other. Both shape shifted. One to the west, and one adjacent to the moon","10/8/22","Yes","https://www.nuforc.org/webreports/reports/171/S171699.html","390X2022.11.14.18.04.39",FALSE
"9/10/22 23:00","Saint peters","MO","USA","Triangle","15 minutes","Bright triangle shape flying around","10/8/22","Yes","https://www.nuforc.org/webreports/reports/171/S171692.html","391X2022.11.14.18.04.39",FALSE
"9/10/22 23:00","Quincy","IL","USA","Light","Hour","Got a still video picture of our star gazing.","10/8/22","Yes","https://www.nuforc.org/webreports/reports/171/S171667.html","392X2022.11.14.18.04.39",FALSE
"9/10/22 22:45","Umatilla","FL","USA","Fireball","1 minute","Fireball flying upwards in the sky","10/8/22","","https://www.nuforc.org/webreports/reports/171/S171695.html","393X2022.11.14.18.04.39",FALSE
"9/10/22 21:10","Lake City","FL","USA","Circle","Roughly one minute","Looking South,Southeast wait for Space X to launch","10/8/22","","https://www.nuforc.org/webreports/reports/171/S171703.html","394X2022.11.14.18.04.39",FALSE
"9/10/22 20:36","Oak Grove","AR","USA","Light","3 Seconds","A bright yellow light formed above the tree line and shot straight up and disappeared.","10/8/22","","https://www.nuforc.org/webreports/reports/171/S171683.html","395X2022.11.14.18.04.39",FALSE
"9/10/22 20:00","Outer Benson/ Texas Canyon/ Sibyl","AZ","USA","Fireball","Hours","Very large portion off mountain glowing will not believe when we got closer!","10/8/22","Yes","https://www.nuforc.org/webreports/reports/171/S171697.html","396X2022.11.14.18.04.39",FALSE
"9/10/22 19:30","WESTLAKE","OH","USA","Light","1-2 s","Fast large lights in night sky","10/8/22","","https://www.nuforc.org/webreports/reports/171/S171701.html","397X2022.11.14.18.04.39",FALSE
"9/10/22 18:41","Castle Rock","WA","USA","Cross","1 minute video","Took a video of the sun against the smokey sky and saw a quick black object","10/8/22","Yes","https://www.nuforc.org/webreports/reports/171/S171687.html","398X2022.11.14.18.04.39",FALSE
"9/10/22 18:20","Owensboro","KY","USA","Formation","10 minutes","Cluster formation erratic movement and finally came to standstill and consolidated","10/8/22","","https://www.nuforc.org/webreports/reports/171/S171694.html","399X2022.11.14.18.04.39",FALSE
"9/10/22 13:35","Cocoa Beach","FL","USA","Changing","photos of a ufo over NASA","We didnt see it in the sky. No sound. No one on the beach seemed to notice.","10/8/22","Yes","https://www.nuforc.org/webreports/reports/171/S171723.html","400X2022.11.14.18.04.39",FALSE
"9/10/22 01:00","Saint Peters","MO","USA","Unknown","10 minutes, maybe longer","Bright light surrounded by light orb moving in zigzags and swirls slowly & quickly. Stopped quickly. Stayed perfectly still at times.","10/8/22","","https://www.nuforc.org/webreports/reports/171/S171671.html","401X2022.11.14.18.04.39",FALSE
"9/9/22 22:10","Ocean City","NJ","USA","Changing","Observed for 10 minutes","Observed an object alternating Red and Green light","10/8/22","","https://www.nuforc.org/webreports/reports/171/S171704.html","402X2022.11.14.18.04.39",FALSE
"9/9/22 21:20","coeur d alene","","USA","Light","About 5 minutes","I saw it flashing light on and off slowly .then it started to go red and green.","10/8/22","","https://www.nuforc.org/webreports/reports/171/S171672.html","403X2022.11.14.18.04.39",FALSE
"9/9/22 20:15","Evansville","IN","USA","Triangle","Around 2 minutes","2 objects came from east to west.","10/8/22","","https://www.nuforc.org/webreports/reports/172/S172044.html","404X2022.11.14.18.04.39",FALSE
"9/9/22 19:34","Edmond","OK","USA","Other","5 to 7 minutes","Very bright white, much slower that a jet","10/8/22","","https://www.nuforc.org/webreports/reports/171/S171665.html","405X2022.11.14.18.04.39",FALSE
"9/9/22 19:12","Juazeiro Do Norte","Ceará","Brazil","Circle","5-10 minutes","The circle was moving onto my right","10/8/22","","https://www.nuforc.org/webreports/reports/171/S171793.html","406X2022.11.14.18.04.39",FALSE
"9/9/22 19:05","plymouth","","United Kingdom","Circle","","took a picture of the sun rising only saw the dot to the right of tge photo. zoomed in and this is what I saw","10/8/22","Yes","https://www.nuforc.org/webreports/reports/171/S171693.html","407X2022.11.14.18.04.39",FALSE
"9/9/22 18:58","Laurel","MS","USA","Oval","20","Onject as bright as the sun.","10/8/22","","https://www.nuforc.org/webreports/reports/171/S171678.html","408X2022.11.14.18.04.39",FALSE
"9/9/22 18:55","Libertyville","IL","USA","Other","","Corner of Rockland Rd and Milwaukee Ave on Sept 9 2022 at approximately 6:55pmin in Libertyville IL","10/8/22","","https://www.nuforc.org/webreports/reports/171/S171675.html","409X2022.11.14.18.04.39",FALSE
"9/9/22 17:45","Chicago , montrose harbor","IL","USA","Triangle","20 min","Three pointed star fish shaped craft with fire underneath very high above airlines coming in over the lake stood there and did not move","10/8/22","","https://www.nuforc.org/webreports/reports/171/S171673.html","410X2022.11.14.18.04.39",FALSE
"9/9/22 14:28","Los Lunas","NM","USA","Oval","3 Minutes","Amazing close-up photo of this aerial phenomena","10/8/22","Yes","https://www.nuforc.org/webreports/reports/171/S171807.html","411X2022.11.14.18.04.39",FALSE
"9/9/22 06:00","Huntington Beach","CA","USA","Circle","2 minutes","Having coffee in my back yard","10/8/22","","https://www.nuforc.org/webreports/reports/171/S171706.html","412X2022.11.14.18.04.39",FALSE
"9/9/22 02:15","Los lunas","NM","USA","Oval","3min","You better check out my photo its pretty good","10/8/22","Yes","https://www.nuforc.org/webreports/reports/171/S171808.html","413X2022.11.14.18.04.39",FALSE
"9/9/22 01:09","Pearl City","HI","USA","Star","Several minutes and years","Saw the crafts moving across sky.","10/8/22","","https://www.nuforc.org/webreports/reports/171/S171883.html","414X2022.11.14.18.04.39",FALSE
"9/9/22 00:30","Bradenton","FL","USA","Star","Around four hours","They come from all directions to one location then head out in a group","10/8/22","","https://www.nuforc.org/webreports/reports/171/S171790.html","415X2022.11.14.18.04.39",FALSE
"9/9/22 00:11","East Stroudsburg","PA","USA","Star","60 seconds","Two stars moving slowly one got very bright then both disappeared","10/8/22","","https://www.nuforc.org/webreports/reports/171/S171653.html","416X2022.11.14.18.04.39",FALSE
"9/8/22 21:00","Fyffe","AL","USA","Circle","Still in sky","Spinning circular with red n yellow flashing lights","10/8/22","","https://www.nuforc.org/webreports/reports/171/S171657.html","417X2022.11.14.18.04.39",FALSE
"9/8/22 21:00","Mount Joy","PA","USA","Light","Approximately 10 minutes","3 or 4 lights moving at high speeds","10/8/22","","https://www.nuforc.org/webreports/reports/171/S171658.html","418X2022.11.14.18.04.39",FALSE
"9/8/22 20:43","Kearney","MO","USA","Light","3 mins","An unusual flashing light","10/8/22","","https://www.nuforc.org/webreports/reports/171/S171664.html","419X2022.11.14.18.04.39",FALSE
