"Date/Time","City","State","Country","Shape","Duration","Summary","Posted","Image","URL","ID","madar"
"10/8/22 21:00","wauchula and myakka city","FL","USA","Changing","two months","Nightly Sightings of UAPs blatantly in your face, military chases observes crafts nightly.","10/8/22","Yes","https://www.nuforc.org/webreports/reports/172/S172219.html","1X2022.11.14.18.04.39",FALSE
"10/8/22 19:00","","","USA","Disk","","My son, wife and myself saw a portion of a saucer shaped disc with glowing off and on different colored lights.","10/8/22","","https://www.nuforc.org/webreports/reports/172/S172150.html","2X2022.11.14.18.04.39",FALSE
"10/7/22 21:50","Brcko","Brcko District","Bosnia and Herzegovina","Diamond","For about half hour.","Half circle trail with rainbow color bright dot.","10/8/22","Yes","https://www.nuforc.org/webreports/reports/172/S172223.html","3X2022.11.14.18.04.39",FALSE
"10/7/22 19:50","Bealeton","VA","USA","Fireball","One minute","I saw a fireball swirling around in the sky like no craft can do. It split into two parts and came back together into one","10/8/22","","https://www.nuforc.org/webreports/reports/172/S172222.html","4X2022.11.14.18.04.39",FALSE
"10/7/22 16:05","Melbourne","FL","USA","Sphere","25 seconds","Saw a small dark round object in western sky","10/8/22","","https://www.nuforc.org/webreports/reports/172/S172224.html","5X2022.11.14.18.04.39",FALSE
"10/7/22 07:34","Kristiansand","","Norway","Unknown","In the morning","Aliens try to make me disposal to them.","10/8/22","Yes","https://www.nuforc.org/webreports/reports/172/S172211.html","6X2022.11.14.18.04.39",FALSE
"10/7/22 00:30","Vidisha","Madhya Pradesh","India","Fireball","60min","Both craft were light circle moving each other,as taking round of one another..","10/8/22","","https://www.nuforc.org/webreports/reports/172/S172208.html","7X2022.11.14.18.04.39",FALSE
"10/6/22 23:00","","TN","USA","Changing","2 hr","Fluid like movement","10/8/22","Yes","https://www.nuforc.org/webreports/reports/172/S172209.html","8X2022.11.14.18.04.39",FALSE
"10/6/22 21:25","Jacksonville","NC","USA","Circle","10 - 20 seconds","Me and my daughter were driving to petsmart. We saw a flying object that was very large","10/8/22","","https://www.nuforc.org/webreports/reports/172/S172210.html","9X2022.11.14.18.04.39",FALSE
"10/6/22 19:47","Vinton","VA","USA","Light","2:31","I looked up and saw one light flashing then that one went off and another one above it came on they were doing that simultaneously","10/8/22","","https://www.nuforc.org/webreports/reports/172/S172199.html","10X2022.11.14.18.04.39",FALSE
"10/6/22 19:00","Brent","AL","USA","Light","5 min plus","Watched a bright white light pass overhead.","10/8/22","","https://www.nuforc.org/webreports/reports/172/S172202.html","11X2022.11.14.18.04.39",FALSE
"10/6/22 16:12","Baltimore","MD","USA","Unknown","5-10 minutes","20+ small black objects in sky above, moving in figure 8 motion cohesively","10/8/22","","https://www.nuforc.org/webreports/reports/172/S172201.html","12X2022.11.14.18.04.39",FALSE
"10/6/22 15:59","Oro valley","","","Circle","Unknown","I pointed my cell phone to get a picture of the cloud.","10/8/22","Yes","https://www.nuforc.org/webreports/reports/172/S172203.html","13X2022.11.14.18.04.39",FALSE
"10/6/22 10:10","Centreville","VA","USA","Teardrop","45 seconds","Two objects moving east to west that had a solid string of blue light coming down from them.","10/8/22","","https://www.nuforc.org/webreports/reports/172/S172213.html","14X2022.11.14.18.04.39",FALSE
"10/6/22 09:52","Palm City","FL","USA","Cigar","1 min in West Sky","White straight long object in sky not moving for about a minute and then disappeared fr","10/8/22","","https://www.nuforc.org/webreports/reports/172/S172212.html","15X2022.11.14.18.04.39",FALSE
"10/6/22 06:05","Port orange","FL","USA","Other","5 seconds","Boomerang shaped object","10/8/22","","https://www.nuforc.org/webreports/reports/172/S172214.html","16X2022.11.14.18.04.39",FALSE
"10/5/22 23:10","Baltimore","MD","USA","Chevron","30sec","Chevron or triangle shape craft with bright orange light...awkward movements and disappeared","10/8/22","","https://www.nuforc.org/webreports/reports/172/S172197.html","17X2022.11.14.18.04.39",FALSE
"10/5/22 20:05","Duluth","MN","USA","Cylinder","2 times at 3 mins each","It came from our atmosphere and below normal aircraft flight level in less then 10 seconds. Consistently changing directions and fligh","10/8/22","Yes","https://www.nuforc.org/webreports/reports/172/S172185.html","18X2022.11.14.18.04.39",FALSE
"10/5/22 19:48","Lynwood","CA","USA","Fireball","15 minutes","6 total fireballs one of them moving super fast shedding green cylinder light like space ship.","10/8/22","Yes","https://www.nuforc.org/webreports/reports/172/S172195.html","19X2022.11.14.18.04.39",FALSE
"10/5/22 12:55","Knoxville","TN","USA","Circle","10 seconds","Black grey sphere in sky","10/8/22","","https://www.nuforc.org/webreports/reports/172/S172184.html","20X2022.11.14.18.04.39",FALSE
"10/5/22 10:02","","","USA","Cylinder","","Seen ufo Carring a missle","10/8/22","","https://www.nuforc.org/webreports/reports/172/S172170.html","21X2022.11.14.18.04.39",FALSE
"10/4/22 23:07","Prescott","AZ","USA","Circle","A few minutes","Two red lights very high in the sky","10/8/22","","https://www.nuforc.org/webreports/reports/172/S172193.html","22X2022.11.14.18.04.39",FALSE
"10/4/22 22:12","Brandon","MB","Canada","Light","10 minutes","Through the trees in the grass field beside the highway","10/8/22","Yes","https://www.nuforc.org/webreports/reports/172/S172207.html","23X2022.11.14.18.04.39",FALSE
"10/4/22 22:00","Wilmington","NC","USA","Light","1 min","Bright orange light","10/8/22","","https://www.nuforc.org/webreports/reports/172/S172198.html","24X2022.11.14.18.04.39",FALSE
"10/4/22 21:15","Tyrone","PA","USA","Disk","","Saw an unusual flying object above my house","10/8/22","Yes","https://www.nuforc.org/webreports/reports/172/S172186.html","25X2022.11.14.18.04.39",FALSE
"10/4/22 20:30","Valdosta","GA","USA","Light","1 minute","Strange, large star light the same size as Jupiter that moved gracefully and slowly disappeared into very small red light","10/8/22","","https://www.nuforc.org/webreports/reports/172/S172187.html","26X2022.11.14.18.04.39",FALSE
"10/4/22 20:30","Northplatte","NE","USA","Other","30 seconds","Caught my eye just above me, picture wouldn't pick it up so I took a video still blurry but it was very loud and seemed fast","10/8/22","","https://www.nuforc.org/webreports/reports/172/S172173.html","27X2022.11.14.18.04.39",FALSE
"10/4/22 19:30","Rochester","IN","USA","Circle","Maybe 90 seconds","We both noticed the light and then it shrunk in size until it disappeared.","10/8/22","","https://www.nuforc.org/webreports/reports/172/S172172.html","28X2022.11.14.18.04.39",FALSE
"10/4/22 17:08","","","Hong Kong S.A.R.","Unknown","literally one frame iphon","its not visible in human eyes, have multiple photos/videos at that exact second, but only one captured the plane/UFO","10/8/22","Yes","https://www.nuforc.org/webreports/reports/172/S172167.html","29X2022.11.14.18.04.39",FALSE
"10/4/22 16:09","Little Compton","RI","USA","Light","3 seconds","Glowing Orb","10/8/22","","https://www.nuforc.org/webreports/reports/172/S172176.html","30X2022.11.14.18.04.39",FALSE
"10/4/22 13:35","Schoolcraft","MI","USA","Oval","About ten seconds","Saw a small tic tack shaped object fly over very fast in a straight line, not sure of altitude","10/8/22","","https://www.nuforc.org/webreports/reports/172/S172220.html","31X2022.11.14.18.04.39",FALSE
"10/4/22 07:45","Fort Wayne","IN","USA","Disk","5 minutes","Got video","10/8/22","","https://www.nuforc.org/webreports/reports/172/S172191.html","32X2022.11.14.18.04.39",FALSE
"10/3/22 23:33","Azusa","CA","USA","Diamond","","Basket Ball sized Orb of light & floating ship","10/8/22","","https://www.nuforc.org/webreports/reports/172/S172166.html","33X2022.11.14.18.04.39",FALSE
"10/3/22 20:00","Colorado springs","CO","USA","Triangle","","My husband and I were in the hotub and this mysterious object flew over us with 3 brights lights in a triangle form.","10/8/22","","https://www.nuforc.org/webreports/reports/172/S172156.html","34X2022.11.14.18.04.39",FALSE
"10/3/22 17:02","Newnan","GA","USA","Circle","3hrs","Shiny object spotted in sky by coworker","10/8/22","Yes","https://www.nuforc.org/webreports/reports/172/S172162.html","35X2022.11.14.18.04.39",FALSE
"10/3/22 12:30","Vinita","OK","USA","Circle","30 seconds","Several round white objects flying together.","10/8/22","","https://www.nuforc.org/webreports/reports/172/S172154.html","36X2022.11.14.18.04.39",FALSE
"10/3/22 11:30","","","USA","Changing","2 minutes","Hovering at high altitude coming slow from west to east,","10/8/22","","https://www.nuforc.org/webreports/reports/172/S172164.html","37X2022.11.14.18.04.39",FALSE
"10/3/22 09:10","Fayetteville","GA","USA","Circle","7 seconds","The craft appeared to be silver and round/pear shaped. It was there then seemed to vanish.","10/8/22","","https://www.nuforc.org/webreports/reports/172/S172159.html","38X2022.11.14.18.04.39",FALSE
"10/3/22 03:30","Benton","AR","USA","Changing","1 hour","Round object in sky changing colors from red green white blue.","10/8/22","Yes","https://www.nuforc.org/webreports/reports/172/S172174.html","39X2022.11.14.18.04.39",FALSE
"10/3/22 01:30","Houston","TX","USA","Formation","45 seconds","Lights in sky","10/8/22","","https://www.nuforc.org/webreports/reports/172/S172151.html","40X2022.11.14.18.04.39",FALSE
"10/2/22 14:33","Hemet","CA","USA","Circle","3 seconds","Craft flew at extreme rate of speed SW only able to be seen on video when zoomed in and better when slowed down.","10/8/22","Yes","https://www.nuforc.org/webreports/reports/172/S172169.html","41X2022.11.14.18.04.39",FALSE
"10/2/22 13:28","Roseville","CA","USA","Circle","Aprox 30 min.","Two glinting objects on a cloudless CA sunny day - one disappeared, the other stayed visible for approximately 30 minutes","10/8/22","Yes","https://www.nuforc.org/webreports/reports/172/S172196.html","42X2022.11.14.18.04.39",FALSE
"10/2/22 13:13","Windham","ME","USA","Circle","45 seconds","Orbs moving through smoke trail from another aircraft","10/8/22","Yes","https://www.nuforc.org/webreports/reports/172/S172217.html","43X2022.11.14.18.04.39",FALSE
"10/2/22 12:11","San Bernardino","CA","USA","Disk","5 secs.","It's a sphere crossing the sky while abc films Huntington Beach Air show","10/8/22","","https://www.nuforc.org/webreports/reports/172/S172134.html","44X2022.11.14.18.04.39",FALSE
"10/2/22 06:05","Smyrna","TN","USA","Light","3 seconds","Bright light in sky vanished","10/8/22","","https://www.nuforc.org/webreports/reports/172/S172132.html","45X2022.11.14.18.04.39",FALSE
"10/2/22 00:50","Westminster","CO","USA","Triangle","5 seconds","Triangle shaped craft over Westminster, CO","10/8/22","","https://www.nuforc.org/webreports/reports/172/S172141.html","46X2022.11.14.18.04.39",FALSE
"10/2/22 00:15","Little current","ON","Canada","Circle","3 minutes","Not sure on shape... at least 3 pulsating lights, no sound","10/8/22","","https://www.nuforc.org/webreports/reports/172/S172153.html","47X2022.11.14.18.04.39",FALSE
"10/1/22 23:00","Delta","UT","USA","Formation","Maybe 3 seconds","5 objects in a tight vee formation flying very fast East to West","10/8/22","","https://www.nuforc.org/webreports/reports/172/S172137.html","48X2022.11.14.18.04.39",FALSE
"10/1/22 22:20","Granger","IN","USA","Fireball","2-3 min","Possible UFO aircraft appeared suddenly and kept moving up the sky.","10/8/22","","https://www.nuforc.org/webreports/reports/172/S172143.html","49X2022.11.14.18.04.39",FALSE
"10/1/22 22:15","Bedford","NH","USA","Circle","45 mins","Two circular lights moving in circles","10/8/22","","https://www.nuforc.org/webreports/reports/172/S172144.html","50X2022.11.14.18.04.39",FALSE
"10/1/22 21:10","Bellevue","WA","USA","Formation","5 min","While driving toward Seattle on I-90 Westbound a linear formation of 9 or so stationary lights","10/8/22","","https://www.nuforc.org/webreports/reports/171/S171982.html","51X2022.11.14.18.04.39",FALSE
"10/1/22 21:00","Lynnwood","WA","USA","Star","10 (ten) to 15 seconds","Two points self-illuminated to astonishing intensity high in the northern sky for ~ 10-15 seconds","10/8/22","","https://www.nuforc.org/webreports/reports/172/S172136.html","52X2022.11.14.18.04.39",FALSE
"10/1/22 20:46","port washington","WI","USA","Sphere","5 minutes","bright sphere of light","10/8/22","","https://www.nuforc.org/webreports/reports/172/S172138.html","53X2022.11.14.18.04.39",FALSE
"10/1/22 19:46","Hales Corners","WI","USA","Sphere","Approx 1 min","I saw a bright object silently traveling from West to East at postion angle 75 at a height of maybe 10,000 feet.","10/8/22","Yes","https://www.nuforc.org/webreports/reports/172/S172146.html","54X2022.11.14.18.04.39",FALSE
"10/1/22 19:20","Lapeer","MI","USA","Changing","7-8 minutes. I terminated","Shape changing Yellowish light orb in atmosphere, in daylight changed shape and traveling west.","10/8/22","Yes","https://www.nuforc.org/webreports/reports/172/S172140.html","55X2022.11.14.18.04.39",FALSE
"10/1/22 19:03","Newville","PA","USA","Triangle","several seconds","Walking home from store and noticed a series of lights on the triangular shaped object which moved below clouds and heard no sound.","10/8/22","","https://www.nuforc.org/webreports/reports/172/S172145.html","56X2022.11.14.18.04.39",FALSE
"10/1/22 16:10","Broomfield","CO","USA","Light","~15 seconds","Multiple bright white lights in front of black thunder clouds","10/8/22","","https://www.nuforc.org/webreports/reports/172/S172149.html","57X2022.11.14.18.04.39",FALSE
"10/1/22 15:34","Huntsville","AL","USA","Cigar","2 - 3 minutes","Cigar shaped with a bright circular light to the left of craft","10/8/22","Yes","https://www.nuforc.org/webreports/reports/172/S172157.html","58X2022.11.14.18.04.39",FALSE
"10/1/22 11:50","Gulf breeze","FL","USA","Circle","Seconds intermittent","This was circular and was blur...I've never seen anything move at this rate of speed. It moved auikl6then disappeared and reappeared.","10/8/22","","https://www.nuforc.org/webreports/reports/172/S172142.html","59X2022.11.14.18.04.39",FALSE
"10/1/22 09:52","Redwood valley","CA","USA","Other","","A very very large huge X flying in and out of the blue atmosphere","10/8/22","","https://www.nuforc.org/webreports/reports/172/S172117.html","60X2022.11.14.18.04.39",FALSE
"10/1/22 04:30","Bountiful","UT","USA","Light","45 seconds","deep above maybe outer space","10/8/22","","https://www.nuforc.org/webreports/reports/172/S172206.html","61X2022.11.14.18.04.39",FALSE
"10/1/22 03:05","Columbus","MS","USA","Light","~15 seconds to a minute","BRIGHT light panned like a spotlight in both windows in my bedroom - no sound - no cars - no people. 2nd time this has happened","10/8/22","","https://www.nuforc.org/webreports/reports/172/S172122.html","62X2022.11.14.18.04.39",FALSE
"9/30/22 22:51","Stevens Point","WI","USA","Disk","Several minutes & nights.","Shifting lights around disk with dome.","10/8/22","Yes","https://www.nuforc.org/webreports/reports/171/S171830.html","63X2022.11.14.18.04.39",FALSE
"9/30/22 21:50","Lawrenceville","GA","USA","Light","9:50pm- 12:50am","Bright star like light pulsating and moving around erratically","10/8/22","Yes","https://www.nuforc.org/webreports/reports/172/S172194.html","64X2022.11.14.18.04.39",FALSE
"9/30/22 20:48","West valley city","UT","USA","Disk","2 mins, 855pm 1 min, 9.","Caught on ring camera","10/8/22","","https://www.nuforc.org/webreports/reports/172/S172124.html","65X2022.11.14.18.04.39",FALSE
"9/30/22 20:10","victoria","BC","Canada","Circle","approx. 10 min.","long line of lights following each other, but not like pics from Space x photos these werte seperate white lights , no solid line !","10/8/22","","https://www.nuforc.org/webreports/reports/172/S172118.html","66X2022.11.14.18.04.39",FALSE
"9/30/22 19:55","Lafayette","TN","USA","Star","It is still there","It was a red and white flashing light that was moving ever so slightly very fast.","10/8/22","","https://www.nuforc.org/webreports/reports/172/S172113.html","67X2022.11.14.18.04.39",FALSE
"9/30/22 19:22","Cave City","AR","USA","Light","Several seconds","A very bright moving object that disappeared once observed.","10/8/22","","https://www.nuforc.org/webreports/reports/172/S172181.html","68X2022.11.14.18.04.39",FALSE
"9/30/22 01:47","San Francisco","CA","USA","Circle","More than 15 minutes","Object was at location for many minutes, it moved from its original location quickly back and forth with incredible speed","10/8/22","Yes","https://www.nuforc.org/webreports/reports/172/S172160.html","69X2022.11.14.18.04.39",FALSE
"9/30/22 00:30","New Miami, Ohio (Hamilton Ohio)","OH","USA","Sphere","Has not disappeared","There were 2 consistent visible spheres. 1 was lower and glowing and flashing red, the other was white and moving frequently","10/8/22","Yes","https://www.nuforc.org/webreports/reports/172/S172110.html","70X2022.11.14.18.04.39",FALSE
"9/29/22 23:12","nana District","Chongqing","China","Light","one second","Like a string, a yellow or maybe orange light continue about one second","10/8/22","","https://www.nuforc.org/webreports/reports/172/S172086.html","71X2022.11.14.18.04.39",FALSE
"9/29/22 21:50","Chatsworth","CA","USA","Unknown","","UFO","10/8/22","","https://www.nuforc.org/webreports/reports/172/S172108.html","72X2022.11.14.18.04.39",FALSE
"9/29/22 21:00","Iowa City","IA","USA","Other","30 - 40 seconds","I barely visible dark boomerang glided across the sky noiselessly. No lights.","10/8/22","","https://www.nuforc.org/webreports/reports/172/S172114.html","73X2022.11.14.18.04.39",FALSE
"9/29/22 20:55","Canyon Country","CA","USA","Triangle","20 to 25 seconds","V shaped silent craft traveling west to east about 500 feet above with 12 to 14 white lights in the V shaped, pointed front formation.","10/8/22","","https://www.nuforc.org/webreports/reports/172/S172109.html","74X2022.11.14.18.04.39",FALSE
"9/29/22 18:45","west hamlin","WV","USA","Circle","30-45 minutes","several ufo/uap seen in the south western sky from my location by 3 whitnesses. white circle shape flying objects that disappeared.","10/8/22","","https://www.nuforc.org/webreports/reports/172/S172112.html","75X2022.11.14.18.04.39",FALSE
"9/29/22 13:50","Seal Beach","CA","USA","Rectangle","About 1 minute","Taking video of an airplane with I noticed something in background","10/8/22","","https://www.nuforc.org/webreports/reports/172/S172082.html","76X2022.11.14.18.04.39",FALSE
"9/29/22 10:31","Tucson","AZ","USA","Diamond","8 Minutes","Cube Diamond UFO","10/8/22","Yes","https://www.nuforc.org/webreports/reports/172/S172120.html","77X2022.11.14.18.04.39",FALSE
"9/29/22 10:12","Denver","CO","USA","Sphere","1 minute","Looked at the sky from my balcony","10/8/22","Yes","https://www.nuforc.org/webreports/reports/172/S172115.html","78X2022.11.14.18.04.39",FALSE
"9/29/22 07:45","Leland","MS","USA","Cylinder","5 minutes","saw 1 very brite ufo: appeared to be red laser beams being shot at it from below it, ufo disappeared. 2nd bigger brighter ufo came.","10/8/22","","https://www.nuforc.org/webreports/reports/172/S172087.html","79X2022.11.14.18.04.39",FALSE
"9/29/22 03:20","Baraboo","WI","USA","Light","Around 30 minutes","Unexplained lights and formations","10/8/22","","https://www.nuforc.org/webreports/reports/172/S172088.html","80X2022.11.14.18.04.39",FALSE
"9/29/22 01:37","Tulsa","OK","USA","Cylinder","Night","With night security cameras","10/8/22","","https://www.nuforc.org/webreports/reports/172/S172089.html","81X2022.11.14.18.04.39",FALSE
"9/28/22 23:10","Quincy","CA","USA","Triangle","10-15 seconds","Extremely fast moving, dimly lit, triangular shaped object in sky.","10/8/22","","https://www.nuforc.org/webreports/reports/172/S172083.html","82X2022.11.14.18.04.39",FALSE
"9/28/22 21:15","wichita falls","TX","USA","Unknown","1.5 hours","Went out to see Neptune. I saw strange formation of lights in the west. Visible with naked eye. More details with binoculars.","10/8/22","","https://www.nuforc.org/webreports/reports/172/S172085.html","83X2022.11.14.18.04.39",FALSE
"9/28/22 20:30","Jacksonville","FL","USA","Other","3 minutes","Unusual and perfectly quiet unknown object with pink/red faint lights","10/8/22","","https://www.nuforc.org/webreports/reports/172/S172147.html","84X2022.11.14.18.04.39",FALSE
"9/28/22 05:55","Las Cruces","NM","USA","Star","Less than 1 minute","Was looking South + was astonished to see an object 4-5 times the size of Jupiter in AM sky it was an orangish 20 degrees above horizon","10/8/22","","https://www.nuforc.org/webreports/reports/172/S172100.html","85X2022.11.14.18.04.39",FALSE
"9/27/22 23:30","Crystal Lake","IL","USA","Circle","2 seconds","I saw a red circular orb that was moving slowly, then suddenly shot into the night sky","10/8/22","Yes","https://www.nuforc.org/webreports/reports/172/S172101.html","86X2022.11.14.18.04.39",FALSE
"9/27/22 22:00","Otisfield","ME","USA","Sphere","3 seconds","Saw a very bright light cross the sky completely from east to west at very high speed, keeping its luminosity the same the entire time","10/8/22","","https://www.nuforc.org/webreports/reports/172/S172094.html","87X2022.11.14.18.04.39",FALSE
"9/27/22 21:40","Just west of Edmonton","AB","Canada","Circle","I watched it for 10 min.","It was a half ring of white and red lights. It was stationary and the lights were alternating in no particular order.","10/8/22","","https://www.nuforc.org/webreports/reports/172/S172091.html","88X2022.11.14.18.04.39",FALSE
"9/27/22 21:15","Caledonia","WI","USA","Oval","Two to three minutes.","I witnessed what appeared to be an appearance of stationary oval disc, with a red glow underneath, at night on a main county highway.","10/8/22","","https://www.nuforc.org/webreports/reports/172/S172093.html","89X2022.11.14.18.04.39",FALSE
"9/27/22 20:40","Killeen","TX","USA","Triangle","May 13 or 14 minutes","6 came in view one then another, straight path S/E to N/W red/yellow glow, at a distance they at times seem to disappear and return.","10/8/22","Yes","https://www.nuforc.org/webreports/reports/172/S172090.html","90X2022.11.14.18.04.39",FALSE
"9/27/22 12:15","New Wilmington","null","","Disk","1 minutes","Soundless saucer flys overhead","10/8/22","Yes","https://www.nuforc.org/webreports/reports/172/S172067.html","91X2022.11.14.18.04.39",FALSE
"9/27/22 07:41","Eugene","MO","USA","Cylinder","10 seconds","Motionless Tic Tac","10/8/22","","https://www.nuforc.org/webreports/reports/172/S172192.html","92X2022.11.14.18.04.39",FALSE
"9/27/22 04:45","Scottsdale","AZ","USA","Star","10-15 minutes","Slowly moving low and large star shape craft was observed and watched till it passed overhead.followed by another","10/8/22","","https://www.nuforc.org/webreports/reports/172/S172152.html","93X2022.11.14.18.04.39",FALSE
"9/26/22 23:20","Spring","TX","USA","Unknown","5 minutes","I saw a low flying V shape craft with 5 lights on the underside fly over me in the backyard. The lights weren't on.","10/8/22","Yes","https://www.nuforc.org/webreports/reports/172/S172099.html","94X2022.11.14.18.04.39",FALSE
"9/26/22 22:58","Clyde","NC","USA","Fireball","30 seconds","It was a bright green round glowing object falling very slowly then disappeared behind a ridge line.","10/8/22","","https://www.nuforc.org/webreports/reports/172/S172071.html","95X2022.11.14.18.04.39",FALSE
"9/26/22 22:50","Portland","OR","USA","Light","6 seconds","Large round very bright ball of light moving slow and very low. I watched it for about 6 seconds before it just vanished.","10/8/22","","https://www.nuforc.org/webreports/reports/172/S172106.html","96X2022.11.14.18.04.39",FALSE
"9/26/22 21:40","Pottstown","PA","USA","Sphere","3 minutes","Orange Orbs","10/8/22","","https://www.nuforc.org/webreports/reports/172/S172063.html","97X2022.11.14.18.04.39",FALSE
"9/26/22 21:40","East stroudsburg","PA","USA","Changing","Over an hour at least","Craft seemed suspended in air upon video recording craft moved erratically in different directions keeping to the same area changing sh","10/8/22","","https://www.nuforc.org/webreports/reports/172/S172064.html","98X2022.11.14.18.04.39",FALSE
"9/26/22 20:30","Nipomo","CA","USA","Light","1 min","Moved faster than anything man made","10/8/22","","https://www.nuforc.org/webreports/reports/172/S172092.html","99X2022.11.14.18.04.39",FALSE
"9/26/22 20:14","Benton","LA","USA","Light","Just over a minute","Watched craft fly silently several thousand feet up. Ball of light stopped then continued","10/8/22","","https://www.nuforc.org/webreports/reports/172/S172073.html","100X2022.11.14.18.04.39",FALSE
"9/26/22 20:09","Paso Robles","CA","USA","Light","20 minutes","Distant lights dispersing from a star","10/8/22","","https://www.nuforc.org/webreports/reports/172/S172070.html","101X2022.11.14.18.04.39",FALSE
"9/26/22 19:47","Espanola (Medical Lake area)","WA","USA","Other","1 minute","A UFO like a long train shaped like a hot dog with windows with white solid lights, going slow, with no sound.","10/8/22","Yes","https://www.nuforc.org/webreports/reports/172/S172068.html","102X2022.11.14.18.04.39",FALSE
"9/26/22 18:56","Alamosa","CO","USA","Oval","60 seconds","Silent white oval hovering above house","10/8/22","","https://www.nuforc.org/webreports/reports/172/S172096.html","103X2022.11.14.18.04.39",FALSE
"9/26/22 17:20","Lake Lynn","PA","USA","Changing","3-5 seconds","Light moving across treetops","10/8/22","","https://www.nuforc.org/webreports/reports/172/S172075.html","104X2022.11.14.18.04.39",FALSE
"9/26/22 07:10","La Crosse","WI","USA","Rectangle","1 minute","This is the second time I have seen this object, in the same location, about a year's time apart.","10/8/22","","https://www.nuforc.org/webreports/reports/171/S171961.html","105X2022.11.14.18.04.39",FALSE
