"Date/Time","City","State","Country","Shape","Duration","Summary","Posted","Image","URL","ID","madar"
"6/18/22 14:25","Richmond, ky","","","Unknown","5-10seconds","Bright silver light thought to be aircraft reflection on a clear day for a few seconds instantly disappeared saw no craft or object","9/9/22","","https://www.nuforc.org/webreports/reports/170/S170400.html","1024X2022.09.15.20.54.06",FALSE
"6/17/22 21:45","Cross","SC","USA","Diamond","20 minutes","I was walking my dog about 9:30 pm at night I saw this green light and then I saw this red light come from the green light","9/9/22","","https://www.nuforc.org/webreports/reports/170/S170122.html","1025X2022.09.15.20.54.06",FALSE
"6/17/22 21:22","Allenwood","PA","USA","Triangle","12minutes","South Williamsport route 15 south heading to Allenwood","9/9/22","","https://www.nuforc.org/webreports/reports/170/S170074.html","1026X2022.09.15.20.54.06",FALSE
"6/16/22 09:05","London","City of London","United Kingdom","Oval","25 minutes","Oval object with multiple flashing lights displaying unusual flight pattern and an ability to hover motionlessly","9/9/22","Yes","https://www.nuforc.org/webreports/reports/170/S170354.html","1027X2022.09.15.20.54.06",FALSE
"6/15/22 22:00","Exton","PA","USA","Formation","1 minute","I saw a large cluster of individual bright white lights roll through. They seemed to be two distinct groups churning around","9/9/22","","https://www.nuforc.org/webreports/reports/170/S170364.html","1028X2022.09.15.20.54.06",FALSE
"6/15/22 19:00","roanoke","","","Star","3 hours","seeing effects of manmade aircraft UFO","9/9/22","","https://www.nuforc.org/webreports/reports/170/S170609.html","1029X2022.09.15.20.54.06",FALSE
"6/14/22 17:40","Puaena Point Beach Park","HI","USA","Diamond","","We were on a beach in Hawaii taking photos and this image appeared on my camera for a split second and was gone","9/9/22","Yes","https://www.nuforc.org/webreports/reports/170/S170181.html","1030X2022.09.15.20.54.06",FALSE
"6/14/22 03:00","Christmas Valley","OR","USA","Circle","3 seconds","Object floating in sky just below the clouds then it zipped across the sky instantaneous leaving a trail of light across the sky.","9/9/22","","https://www.nuforc.org/webreports/reports/170/S170103.html","1031X2022.09.15.20.54.06",FALSE
"6/11/22 23:45","Mansfield","MA","","Changing","1 1/2 months - current","3'×3' Strobing objects visible nightly","9/9/22","Yes","https://www.nuforc.org/webreports/reports/170/S170166.html","1032X2022.09.15.20.54.06",FALSE
"6/11/22 15:00","Dennis Port","MA","USA","Sphere","A few moments","small white sphere spotted on horizon off coast of Dennis Port, MA","9/9/22","","https://www.nuforc.org/webreports/reports/170/S170124.html","1033X2022.09.15.20.54.06",FALSE
"6/10/22 20:44","Highland","NY","USA","Disk","5-6 seconds","She was taking a video of sunset and caught the lights cut across them back into frame then across again and cut back to speed away","9/9/22","","https://www.nuforc.org/webreports/reports/171/S171192.html","1034X2022.09.15.20.54.06",FALSE
"6/10/22 08:28","Orange Beach","AL","USA","Circle","Did not see except on pic","I noticed the object in a picture I took on a fishing trip. Did not see in real time","9/9/22","Yes","https://www.nuforc.org/webreports/reports/170/S170101.html","1035X2022.09.15.20.54.06",FALSE
"6/9/22 21:21","Colorado Springs","CO","USA","Changing","34 seconds","Saw these objects appear, move and then vanish.","9/9/22","","https://www.nuforc.org/webreports/reports/170/S170282.html","1036X2022.09.15.20.54.06",FALSE
"6/8/22 19:30","Appleton","WI","USA","Cigar","3-5 minutes","Silver stainless steel cigar shape, no engine or navigation, clearly visible, 500 yard up, watch leave orbit with bright star burst","9/9/22","","https://www.nuforc.org/webreports/reports/170/S170877.html","1037X2022.09.15.20.54.06",FALSE
"6/5/22 17:45","Beach Haven","NJ","USA","Oval","20 minutes","Spotted tiny pill shaped object that was at commercial flight altitude while sitting at beach.","9/9/22","","https://www.nuforc.org/webreports/reports/170/S170665.html","1038X2022.09.15.20.54.06",FALSE
"6/4/22 20:59","Point pleasant","NJ","USA","Changing","Five hours","I am a security guard at a beach and I saw blinking things in the sky they formed the triangles and squares they changed colors","9/9/22","Yes","https://www.nuforc.org/webreports/reports/170/S170510.html","1039X2022.09.15.20.54.06",FALSE
"6/4/22 15:00","Portland","OR","USA","Changing","2 - 3 minutes","Shape shifting tictac object on a clear day","9/9/22","","https://www.nuforc.org/webreports/reports/171/S171383.html","1040X2022.09.15.20.54.06",FALSE
"6/1/22 22:45","Luck","null","USA","Light","2mins","Ring camera motion sensor","9/9/22","","https://www.nuforc.org/webreports/reports/171/S171608.html","1041X2022.09.15.20.54.06",FALSE
"6/1/22 15:00","Port Blair","Andaman and Nicobar Islands","India","Circle","","That was a UFO lot's of people saw that","9/9/22","Yes","https://www.nuforc.org/webreports/reports/171/S171346.html","1042X2022.09.15.20.54.06",FALSE
"5/31/22 09:20","","","USA","Unknown","not sure, 10-20 min","As passenger on plane, cruising altitude, daylight, saw 3 bright lights,(headlights, oncoming) in triangle pattern, approach plane","9/9/22","Yes","https://www.nuforc.org/webreports/reports/170/S170423.html","1043X2022.09.15.20.54.06",FALSE
"5/30/22 03:30","Toomsboro","GA","USA","Diamond","4 hours","Two aircraft spotted and observed for about 4 hours","9/9/22","Yes","https://www.nuforc.org/webreports/reports/170/S170735.html","1044X2022.09.15.20.54.06",FALSE
"5/29/22 22:45","Hamburg","NY","USA","Circle","Went on for about 17 min","Was enjoying the evening by the fire always looking at the sky..then this object came out of the west skies","9/9/22","","https://www.nuforc.org/webreports/reports/170/S170371.html","1045X2022.09.15.20.54.06",FALSE
"5/29/22 22:06","Arlington","VA","USA","Circle","46 seconds","I spotted a white and greenish object that was flashing and moved eastward at a steady rate of speed until it disappeared","9/9/22","","https://www.nuforc.org/webreports/reports/170/S170205.html","1046X2022.09.15.20.54.06",FALSE
"5/29/22 19:53","Knoxville","TN","USA","Other","Maybe About 30 Minutes","Black, maybe car size and shape, non-symetrical. Maybe metal","9/9/22","","https://www.nuforc.org/webreports/reports/170/S170472.html","1047X2022.09.15.20.54.06",FALSE
"5/29/22 00:00","Middlebourne","WV","USA","Light","Videod orb for 4 to 5 mi","I was in the back of my vehicle when I just happened to look ahead and out of the ground came a pulsating light. 2 others confirmed","9/9/22","Yes","https://www.nuforc.org/webreports/reports/170/S170283.html","1048X2022.09.15.20.54.06",FALSE
"5/28/22 23:42","Largo","FL","USA","Light","3 minutes","5 orange globes","9/9/22","","https://www.nuforc.org/webreports/reports/171/S171315.html","1049X2022.09.15.20.54.06",FALSE
"5/25/22 22:00","North hampton","NH","USA","Light","3-5 mins","Went outside to smoke, and saw something very bizzare","9/9/22","","https://www.nuforc.org/webreports/reports/170/S170539.html","1050X2022.09.15.20.54.06",FALSE
"5/24/22 22:30","Houston","TX","USA","Formation","less then a minute","Two events into one.","9/9/22","","https://www.nuforc.org/webreports/reports/171/S171599.html","1051X2022.09.15.20.54.06",FALSE
"5/24/22 21:08","Carmel","CA","USA","Circle","2-3 min","Huge, bright red/orange lights over the ocean.","9/9/22","","https://www.nuforc.org/webreports/reports/170/S170136.html","1052X2022.09.15.20.54.06",FALSE
"5/23/22 19:15","Spartanburg","SC","USA","Other","3 to 5 seconds","They flew by me so fast. Like one was chasing the other.","9/9/22","","https://www.nuforc.org/webreports/reports/170/S170161.html","1053X2022.09.15.20.54.06",FALSE
"5/17/22 20:24","Pine Hill","AL","USA","Disk","","I was watching the stars and caught a light flashing it wasnt anything I had ever seen bf","9/9/22","Yes","https://www.nuforc.org/webreports/reports/170/S170721.html","1054X2022.09.15.20.54.06",FALSE
"5/17/22 04:36","Lake tomahawk","WI","USA","Cigar","3 minutes","Saw two bright lights, daylight had already broke, the one light took off extremely fast, the other just stayed still","9/9/22","Yes","https://www.nuforc.org/webreports/reports/170/S170900.html","1055X2022.09.15.20.54.06",FALSE
"5/15/22 23:29","Carrollton","GA","USA","Sphere","4 or 5 or so hrs","A bright glowing Sphere all over the sky.","9/9/22","Yes","https://www.nuforc.org/webreports/reports/170/S170748.html","1057X2022.09.15.20.54.06",FALSE
"5/15/22 21:53","Phoenix","AZ","USA","Other","","Caught On Camera During Blood Moon Lunar Eclipse","9/9/22","Yes","https://www.nuforc.org/webreports/reports/170/S170619.html","1058X2022.09.15.20.54.06",FALSE
"5/14/22 19:27","Chesterfield, England","","United Kingdom","","50 seconds but video only","Clear sky, object moving rapidly in multiple directions appeared large but somewhat smaller when video taken.","9/9/22","","https://www.nuforc.org/webreports/reports/170/S170616.html","1060X2022.09.15.20.54.06",FALSE
"5/13/22 20:30","Lansing","MI","USA","Sphere","3 to 5 min on Camera","Did CE5 (Dr Greer) Protocols Thursday night/Fri Am, Craft Arrived at my House Fri 830/9pm","9/9/22","Yes","https://www.nuforc.org/webreports/reports/170/S170187.html","1061X2022.09.15.20.54.06",FALSE
"5/13/22 00:30","Miranda de Ebro","Burgos Province","Spain","Sphere","30 minutos","Realizo una foto a la Luna. Veo algo oscuro, amplio la foto y veo esta esfera rocosa. Y en 30 minutos no podía verla","9/9/22","Yes","https://www.nuforc.org/webreports/reports/170/S170119.html","1062X2022.09.15.20.54.06",FALSE
"5/11/22 20:40","Speers","PA","USA","Sphere","10 minutes","Watched a UAP emerge from a bright white area in sky, moved non-linearly as I began videoing on my phone, moved and dropped near Speers","9/9/22","","https://www.nuforc.org/webreports/reports/170/S170965.html","1063X2022.09.15.20.54.06",FALSE
"5/11/22 12:17","Morganton","NC","USA","Changing","About an hour","1 object looking like a transparent changes to rectangle","9/9/22","","https://www.nuforc.org/webreports/reports/170/S170169.html","1064X2022.09.15.20.54.06",FALSE
"5/10/22 15:12","Blue Ridge","GA","USA","Other","5 Minutes","Video recorded using a cell phone affixed to a stationary object with velcro","9/9/22","Yes","https://www.nuforc.org/webreports/reports/170/S170147.html","1065X2022.09.15.20.54.06",FALSE
"5/6/22 03:00","Madiera beach33708","FL","USA","Disk","30 mins visible took pic","Took pic of light anomaly then seen orange craft in pic","9/9/22","Yes","https://www.nuforc.org/webreports/reports/170/S170927.html","1066X2022.09.15.20.54.06",FALSE
"5/1/22 13:00","Pittstown","NY","USA","Other","5 minutes","Saw something hovering in the sky","9/9/22","Yes","https://www.nuforc.org/webreports/reports/170/S170958.html","1068X2022.09.15.20.54.06",FALSE
"4/30/22 17:45","Brooklyn","NY","USA","Formation","30 minutes","I looked in the bright blue sky and saw a large formation of white discs.","9/9/22","Yes","https://www.nuforc.org/webreports/reports/170/S170182.html","1069X2022.09.15.20.54.06",FALSE
"4/29/22 05:33","Kitchener","ON","Canada","Circle","15 plus mins","Two bright circular objects, bigger than any star just standing still.","9/9/22","Yes","https://www.nuforc.org/webreports/reports/170/S170740.html","1070X2022.09.15.20.54.06",FALSE
"4/26/22 23:53","Salt Lake City","TX","USA","Formation","I found it in a pic","I actually did not see this live I was just taking pics of my view from standing outside on my balcony","9/9/22","Yes","https://www.nuforc.org/webreports/reports/170/S170524.html","1071X2022.09.15.20.54.06",FALSE
"4/24/22 19:30","Jonesboro","AR","USA","Other","1 min","Just was filming a storm in front of a tornado.","9/9/22","Yes","https://www.nuforc.org/webreports/reports/171/S171033.html","1072X2022.09.15.20.54.06",FALSE
"4/17/22 23:52","Cleveland","OH","USA","Rectangle","5 to 10 minutes","Long organic like a train, cigar, serpent 2 football fields long.","9/9/22","Yes","https://www.nuforc.org/webreports/reports/171/S171596.html","1073X2022.09.15.20.54.06",FALSE
"4/15/22 19:39","Tesuque","NM","USA","Light","1 minute","Mothership hovering above Los Alamos, NM","9/9/22","Yes","https://www.nuforc.org/webreports/reports/171/S171117.html","1074X2022.09.15.20.54.06",FALSE
"4/15/22 17:04","Phoenix","AZ","USA","Rectangle","2 seconds","Taking photos of sky/cloud formations on iPhone on 4/15/2022, reviewed photos in July and noted movement in Live","9/9/22","Yes","https://www.nuforc.org/webreports/reports/171/S171524.html","1075X2022.09.15.20.54.06",FALSE
"4/15/22 17:04","Phoenix","AZ","USA","Rectangle","3 seconds (Live Photo)","I am a nature hobby photographer and randomly took photo  in looking through photos I saw movement in live shot","9/9/22","Yes","https://www.nuforc.org/webreports/reports/170/S170968.html","1076X2022.09.15.20.54.06",FALSE
"4/14/22 21:23","Casa Grande","AZ","USA","Unknown","Just a few minutes","Sitting watching the view","9/9/22","","https://www.nuforc.org/webreports/reports/170/S170320.html","1077X2022.09.15.20.54.06",FALSE
"4/11/22 18:00","Fort LauderdaleTrying","FL","USA","","Occurred all evening,","Cameras or video aimed at the stars was being broadcast through the hospital on Chanel #8","9/9/22","","https://www.nuforc.org/webreports/reports/171/S171363.html","1078X2022.09.15.20.54.06",FALSE
"4/10/22 22:43","Egg harbor twp","NJ","USA","Light","Time stamed 13sec video 2","13 seconds of video of light orb","9/9/22","","https://www.nuforc.org/webreports/reports/170/S170736.html","1079X2022.09.15.20.54.06",FALSE
"4/9/22 06:05","Los Angeles","CA","USA","Circle","15 seconds","ENORMOUS CIRCULAR OBJECT SETTING INTO THE WESTERN HORIZON ABOUT 20 TIMES BIGGER THAN THE FULL MOON","9/9/22","","https://www.nuforc.org/webreports/reports/170/S170786.html","1081X2022.09.15.20.54.06",FALSE
"4/2/22 15:00","Jackson","MI","USA","Oval","","Over a house with a funnel going down to the house","9/9/22","","https://www.nuforc.org/webreports/reports/171/S171503.html","1082X2022.09.15.20.54.06",FALSE
"3/28/22 23:01","Seattle","WA","USA","Oval","1-5 minutes","I was walking home from work when I saw this glowing object changing shape  ((NUFORC Note:  Profanity in video.  PD))","9/9/22","","https://www.nuforc.org/webreports/reports/170/S170865.html","1083X2022.09.15.20.54.06",FALSE
"3/27/22 20:10","Spokane","WA","USA","Disk","15 minutes","Disk with flashing lights, figure at treeline with glowing eyes","9/9/22","","https://www.nuforc.org/webreports/reports/170/S170617.html","1084X2022.09.15.20.54.06",FALSE
"3/26/22 21:30","Stafford","Staffordshire","United Kingdom","Unknown","4 minutes","I parked on carpark facing my property and on the sky was a strange flashing object moving across the sky. I immediately grabbed my pho","9/9/22","Yes","https://www.nuforc.org/webreports/reports/170/S170353.html","1085X2022.09.15.20.54.06",FALSE
"3/24/22 06:10","Port richey","FL","USA","Triangle","15 seconds","5 circle what looked like lights underneath in the shape of a ""v"". Craft was transparent and very quite.","9/9/22","","https://www.nuforc.org/webreports/reports/170/S170158.html","1086X2022.09.15.20.54.06",FALSE
"3/22/22 19:32","San Juan Capistrano","CA","USA","Light","35 seconds","Bright, spherical light observed in person and short video recording","9/9/22","Yes","https://www.nuforc.org/webreports/reports/170/S170457.html","1087X2022.09.15.20.54.06",FALSE
"3/20/22 22:17","Grants Pass","OR","USA","Fireball","60 sec","Deep red and yellow with multiple tails behind","9/9/22","Yes","https://www.nuforc.org/webreports/reports/170/S170610.html","1088X2022.09.15.20.54.06",FALSE
"3/19/22 19:54","Georgetown","SC","USA","Changing","Approximately 51seconds","Object moved from west to east, I was looking towards the north","9/9/22","","https://www.nuforc.org/webreports/reports/171/S171633.html","1089X2022.09.15.20.54.06",FALSE
"3/15/22 21:00","oak Hill","FL","USA","Unknown","5-6 seconds","Came from north to south flashing like a strobe light. It went from one horizon to the other in about 4 seconds and made no sound","9/9/22","","https://www.nuforc.org/webreports/reports/170/S170204.html","1090X2022.09.15.20.54.06",FALSE
"3/12/22 23:35","Oaxtepec, Morelos, Mexico","Morelos","Mexico","Other","8 seconds","At least six lights locked together like attached to a dark hidden object moving slowly from north to south between two large t","9/9/22","","https://www.nuforc.org/webreports/reports/170/S170789.html","1091X2022.09.15.20.54.06",FALSE
"3/12/22 15:00","Mimbres","NM","USA","","10 minutes","It appeared in the sky across the road","9/9/22","","https://www.nuforc.org/webreports/reports/170/S170061.html","1092X2022.09.15.20.54.06",FALSE
"3/10/22 13:00","Virginia Beach","VA","USA","Sphere","5 minutes","Cloudlike spherical object with no real form but hard edges appeared and held a position at altitude despite winds aloft then vanished","9/9/22","","https://www.nuforc.org/webreports/reports/170/S170179.html","1093X2022.09.15.20.54.06",FALSE
"3/9/22 07:00","Carlingford","County Louth","Ireland","Triangle","3 mins roughly","99% sure eye of proviance","9/9/22","","https://www.nuforc.org/webreports/reports/170/S170487.html","1094X2022.09.15.20.54.06",FALSE
"3/3/22 13:16","Lakeway","TX","USA","Triangle","1 second","I was getting mail and took a picture of chemtrails","9/9/22","Yes","https://www.nuforc.org/webreports/reports/170/S170097.html","1095X2022.09.15.20.54.06",FALSE
"2/28/22 20:41","Saint Louis","MO","USA","Chevron","About one to two minutes","Tic Tac to Chevron","9/9/22","Yes","https://www.nuforc.org/webreports/reports/171/S171044.html","1096X2022.09.15.20.54.06",FALSE
"2/24/22 23:00","Bismarck North Dakota","","United States Minor Outlying Islands","Disk","Still seen 6am on blink","It appeared on my blink camera clips.","9/9/22","","https://www.nuforc.org/webreports/reports/170/S170102.html","1097X2022.09.15.20.54.06",FALSE
"2/24/22 10:48","Santa Fe","NM","USA","Sphere","Short","Second floor of Capitol building while on self guided tour","9/9/22","Yes","https://www.nuforc.org/webreports/reports/170/S170492.html","1098X2022.09.15.20.54.06",FALSE
"2/22/22 18:50","Lafayette","GA","USA","Fireball","Over an hour","A fireball looking circle orangeish and blueish colors illuminating","9/9/22","Yes","https://www.nuforc.org/webreports/reports/170/S170129.html","1099X2022.09.15.20.54.06",FALSE
"2/14/22 18:00","West Lafayette","","","Triangle","30 seconds or so","Driving along South River Rd. and saw three big white lights in triangle formation above the Wabash River","9/9/22","","https://www.nuforc.org/webreports/reports/170/S170494.html","1100X2022.09.15.20.54.06",FALSE
"2/12/22 04:17","Orland","CA","USA","Other","","Reappearing serpent like creatures that bite","9/9/22","","https://www.nuforc.org/webreports/reports/170/S170963.html","1101X2022.09.15.20.54.06",FALSE
"2/10/22 21:15","Whittier","CA","USA","Unknown","2.28","Color changing orbs of some kind","9/9/22","","https://www.nuforc.org/webreports/reports/171/S171448.html","1102X2022.09.15.20.54.06",FALSE
"2/7/22 19:34","Hillsboro","IL","USA","Fireball","30 to 40 minutes","I was sitting out on my porch and there was 3 red lights in a triangle shape. I thought well it must be a tower. Then one was a firebal","9/9/22","","https://www.nuforc.org/webreports/reports/170/S170511.html","1103X2022.09.15.20.54.06",FALSE
"2/6/22 11:13","Baltimore","MD","USA","Unknown","Just under 5 minutes","It was just hovering around like a drone but moved very rapidly and disappeared in the blink of an eye","9/9/22","","https://www.nuforc.org/webreports/reports/170/S170885.html","1104X2022.09.15.20.54.06",FALSE
"2/5/22 18:50","Yuma","AZ","USA","Circle","1 second probably","Captured inadvertently in photo","9/9/22","Yes","https://www.nuforc.org/webreports/reports/170/S170139.html","1105X2022.09.15.20.54.06",FALSE
"2/4/22 13:08","Plains","","USA","Light","Two mintues","I was laying on my living room floor,and seen what looked like a fire on the mountain.i got my phone took pictures and video","9/9/22","Yes","https://www.nuforc.org/webreports/reports/171/S171602.html","1106X2022.09.15.20.54.06",FALSE
"1/24/22 05:00","Columbus","OH","USA","","10 to 20 minutes or longe","Unknown vehicle Hovering over tree front west back east bottom cover with led lights two strobe north and south of wingspan","9/9/22","","https://www.nuforc.org/webreports/reports/171/S171285.html","1107X2022.09.15.20.54.06",FALSE
"1/20/22 23:59","marathon","FL","USA","Triangle","10 seconds","Giant black triangle goes from horizon to horizon 8 seconds mock 30 or 40 without a sound barley visible","9/9/22","","https://www.nuforc.org/webreports/reports/170/S170337.html","1108X2022.09.15.20.54.06",FALSE
"1/19/22 17:30","Avinger","TX","USA","Cigar","2 Minutes","3 Cigar Shaped Craft, form a Triangle formation higher in sky, then moved apart and flew off below the treeline horizon with no sound","9/9/22","Yes","https://www.nuforc.org/webreports/reports/170/S170235.html","1109X2022.09.15.20.54.06",FALSE
"1/19/22 16:00","Taylorsville","KY","USA","Circle","10 minutes","Viewed UAP from my back yard","9/9/22","Yes","https://www.nuforc.org/webreports/reports/170/S170056.html","1110X2022.09.15.20.54.06",FALSE
"1/19/22 02:30","farmville","","","Light","12 minutes","8-10 objects moving at incredible speeds in and out of cloud cover","9/9/22","","https://www.nuforc.org/webreports/reports/171/S171296.html","1111X2022.09.15.20.54.06",FALSE
"1/15/22 18:00","York","PA","USA","Other","5 Minutes","Witnessed glowing orb followed by 2 Helicopters","9/9/22","","https://www.nuforc.org/webreports/reports/170/S170596.html","1112X2022.09.15.20.54.06",FALSE
"1/4/22 11:55","Taylorsville","KY","USA","Oval","2 mins","Recorded in back yard","9/9/22","","https://www.nuforc.org/webreports/reports/170/S170093.html","1113X2022.09.15.20.54.06",FALSE
"12/31/21 22:00","Cuautla","Morelos","Mexico","","10 min","Typical UFO right above my head about 20 meters stopped then started slowly rising and later disappeared into the horizon","9/9/22","","https://www.nuforc.org/webreports/reports/170/S170787.html","1114X2022.09.15.20.54.06",FALSE
"12/31/21 06:36","Morganton","NC","USA","Changing","Unknown","I saw a geometric orb that changed into what looked like a pumice stone","9/9/22","Yes","https://www.nuforc.org/webreports/reports/170/S170924.html","1115X2022.09.15.20.54.06",FALSE
"12/23/21 21:30","Denver","CO","USA","Circle","7 minutes","Ball of light caught on video","9/9/22","","https://www.nuforc.org/webreports/reports/171/S171534.html","1116X2022.09.15.20.54.06",FALSE
"12/3/21 07:00","boynton beach","FL","USA","Cylinder","about 45 minuets","I saw craft exit portal/vortex","9/9/22","","https://www.nuforc.org/webreports/reports/171/S171113.html","1117X2022.09.15.20.54.06",FALSE
"11/30/21 21:30","Rossville","GA","USA","Circle","About 30 min?","A bright orb coming towards my window, which became two alien beings.","9/9/22","","https://www.nuforc.org/webreports/reports/170/S170869.html","1118X2022.09.15.20.54.06",FALSE
"11/28/21 23:21","North Highlands","CA","USA","Changing","15 to 20 minutes","This anomaly appeared to be a very large living creature that communicated with me and a person that was present","9/9/22","","https://www.nuforc.org/webreports/reports/170/S170683.html","1119X2022.09.15.20.54.06",FALSE
"11/23/21 23:15","Greenbelt","MD","USA","Triangle","10 minutes","Squadron of 12 triangular objects flying in linear formation","9/9/22","","https://www.nuforc.org/webreports/reports/171/S171612.html","1120X2022.09.15.20.54.06",FALSE
"11/20/21 17:19","Nampa","ID","USA","Changing","3-4 minutes","Small craft with smoke trails and extraordinary maneuvers","9/9/22","Yes","https://www.nuforc.org/webreports/reports/170/S170413.html","1121X2022.09.15.20.54.06",FALSE
"11/18/21 18:30","Cordesville","SC","USA","Circle","approximately 15 minutes","I saw an orb of light that swung as if on a pendulum and it's appearance caused the entire forest to go quiet.","9/9/22","","https://www.nuforc.org/webreports/reports/170/S170634.html","1122X2022.09.15.20.54.06",FALSE
"11/18/21 15:58","Houston","TX","USA","Light","Brief","I was taking pictures of the eclipse when I saw it.","9/9/22","Yes","https://www.nuforc.org/webreports/reports/170/S170247.html","1123X2022.09.15.20.54.06",FALSE
"11/11/21 21:05","Southampton","City of Southampton","United Kingdom","Unknown","2 minutes","Flashing behind clouds and cilindric flying object","9/9/22","","https://www.nuforc.org/webreports/reports/170/S170063.html","1124X2022.09.15.20.54.06",FALSE
"11/11/21 11:00","Leavenworth","KS","USA","Circle","Approximately 3 minutes","I was taking a video of the flyover and during review I noticed several shinny objects mimicking the aircrafts","9/9/22","Yes","https://www.nuforc.org/webreports/reports/170/S170615.html","1125X2022.09.15.20.54.06",FALSE
"11/10/21 20:11","Basalt/ Carbondale/ Glenwood Springs","CO","USA","Circle","11/26/2021 to 8/8/2022","There are over 400 unnderground in the ridge off Willits lane","9/9/22","","https://www.nuforc.org/webreports/reports/171/S171034.html","1126X2022.09.15.20.54.06",FALSE
"11/8/21 06:49","Morganto","NC","USA","Changing","Unknown","Blue orb that had a light run into it and flare up of light","9/9/22","","https://www.nuforc.org/webreports/reports/170/S170923.html","1127X2022.09.15.20.54.06",FALSE
"11/1/21 21:00","Flowery branch","GA","USA","Triangle","5 months","Would see different crafts over the course of of 5 months","9/9/22","","https://www.nuforc.org/webreports/reports/171/S171306.html","1128X2022.09.15.20.54.06",FALSE
"10/23/21 21:44","Fresno","CA","USA","Fireball","Took a 19 second video.","Saw a fireball heading up towards zigzagging flashing lights.","9/9/22","","https://www.nuforc.org/webreports/reports/171/S171425.html","1129X2022.09.15.20.54.06",FALSE
