"Date/Time","City","State","Country","Shape","Duration","Summary","Posted","Image","URL","ID","madar"
"8/13/22 03:20","Nampa","ID","USA","Light","30 minutes of observing","Saw a big explosion in sky within seconds the 1st ufo appeared was flying in strange pattern and hovering. 2nd was seen 20 min later","9/9/22","","https://www.nuforc.org/webreports/reports/171/S171100.html","311X2022.09.15.20.54.06",FALSE
"8/13/22 01:30","Cleveland","OH","USA","","2 hours","Tone in the air.","9/9/22","","https://www.nuforc.org/webreports/reports/171/S171099.html","312X2022.09.15.20.54.06",FALSE
"8/13/22 01:00","Between Corinth and Burnsville","MS","USA","Light","aprx 10 s","Saw the light pulsate 5 times while moving toward the SE.","9/9/22","","https://www.nuforc.org/webreports/reports/171/S171157.html","313X2022.09.15.20.54.06",FALSE
"8/13/22 00:07","Eureka","CA","USA","Changing","90 sec","Captured pics of glowing ufo","9/9/22","","https://www.nuforc.org/webreports/reports/171/S171097.html","314X2022.09.15.20.54.06",FALSE
"8/13/22 00:01","Chapel Hill","NC","USA","Star","15 minutes","Satellite with red and blue lights flew close by then 3 distant satellites disappeared within seconds of each other","9/9/22","","https://www.nuforc.org/webreports/reports/171/S171126.html","315X2022.09.15.20.54.06",FALSE
"8/12/22 22:30","Centreville","MD","USA","Circle","5 + minutes","Pulsating and moving light that changed colors","9/9/22","Yes","https://www.nuforc.org/webreports/reports/171/S171205.html","316X2022.09.15.20.54.06",FALSE
"8/12/22 21:54","Clinton","IL","USA","Cylinder","","Spiral light flashing in the sky","9/9/22","Yes","https://www.nuforc.org/webreports/reports/171/S171103.html","317X2022.09.15.20.54.06",FALSE
"8/12/22 18:30","Berkley","MI","USA","Circle","25 minutes","6 stationary objects very high in a clear sky. One object was stationary but rotating.","9/9/22","","https://www.nuforc.org/webreports/reports/171/S171106.html","318X2022.09.15.20.54.06",FALSE
"8/12/22 05:30","Abbeville","MS","USA","","1 minute","I don't believe what I saw was a craft.","9/9/22","","https://www.nuforc.org/webreports/reports/171/S171062.html","319X2022.09.15.20.54.06",FALSE
"8/12/22 02:07","Franklinton","LA","USA","Light","Over 30 minutes","5 lights in my neighbors field that blinked and spun.","9/9/22","","https://www.nuforc.org/webreports/reports/171/S171114.html","320X2022.09.15.20.54.06",FALSE
"8/12/22 02:00","NY","NY","USA","Star","25+ min","Star like object pulsing, above it a spuratic light pulsing and changing locations. Something shot down to earth large orange oval.","9/9/22","Yes","https://www.nuforc.org/webreports/reports/171/S171086.html","321X2022.09.15.20.54.06",FALSE
"8/11/22 23:00","Youngstown","NY","USA","Light","1 second","No light seen beforehand, light comes out of nowhere and drops below treeline within a second.","9/9/22","","https://www.nuforc.org/webreports/reports/171/S171102.html","322X2022.09.15.20.54.06",FALSE
"8/11/22 22:15","Duvall","","","Light","A few minutes","Small light in night sky moving in an unnatural way and unlike any known aircraft.","9/9/22","","https://www.nuforc.org/webreports/reports/171/S171112.html","323X2022.09.15.20.54.06",FALSE
"8/11/22 22:08","Lebanon","OR","USA","Triangle","Four minutes","A stationary or slow moving object either dimly lit or illuminated by the moon.","9/9/22","Yes","https://www.nuforc.org/webreports/reports/171/S171094.html","324X2022.09.15.20.54.06",FALSE
"8/11/22 22:05","Wayne","NE","USA","Diamond","30 seconds","We saw a bright diamond shape fly across the sky.","9/9/22","","https://www.nuforc.org/webreports/reports/171/S171115.html","325X2022.09.15.20.54.06",FALSE
"8/11/22 22:00","Union Springs","NY","USA","Unknown","20 minutes","Hovering bright light thought to possibly be Venus near the horizon intensity grew brighter then it turned north until out of sight.","9/9/22","","https://www.nuforc.org/webreports/reports/171/S171066.html","326X2022.09.15.20.54.06",FALSE
"8/11/22 21:30","West Molesey","Surrey","United Kingdom","Light","30 mins","Bright white light silently moving East to West at impossible speed back at least 6 times over 30 minute period.","9/9/22","","https://www.nuforc.org/webreports/reports/171/S171067.html","327X2022.09.15.20.54.06",FALSE
"8/11/22 21:14","Willimantic","CT","USA","Triangle","3minutes","2 craft flying side by side","9/9/22","","https://www.nuforc.org/webreports/reports/171/S171070.html","328X2022.09.15.20.54.06",FALSE
"8/11/22 20:59","Leicester","Leicestershire","United Kingdom","Unknown","20 mins","Unexplainable bright object in sky","9/9/22","Yes","https://www.nuforc.org/webreports/reports/171/S171078.html","329X2022.09.15.20.54.06",FALSE
"8/11/22 20:57","Newcastle-Under-Lyme","Staffordshire","United Kingdom","Light","5 minutes","A moving/hovering light appeared and then disappeared whilst observing","9/9/22","","https://www.nuforc.org/webreports/reports/171/S171065.html","330X2022.09.15.20.54.06",FALSE
"8/11/22 20:15","AFTON","VA","USA","Oval","3 camera shots","Capturing cloud pics on iPhone in eve at 2015, 2016 and 2020 AFTON Va","9/9/22","Yes","https://www.nuforc.org/webreports/reports/171/S171165.html","331X2022.09.15.20.54.06",FALSE
"8/11/22 01:00","Covington","WA","USA","Triangle","3 seconds about","We were driving by the real life church to McDonalds and I saw the thing to my right, and my friend saw a craft while we were eating","9/9/22","","https://www.nuforc.org/webreports/reports/171/S171051.html","332X2022.09.15.20.54.06",FALSE
"8/10/22 23:45","Youngstown","NY","USA","Light","15 minutes","See one craft darting around all directions in the sky. Then something zips over the tree-line literally right in front of us.","9/9/22","","https://www.nuforc.org/webreports/reports/171/S171053.html","333X2022.09.15.20.54.06",FALSE
"8/10/22 23:15","Huntington Beach","CA","USA","Unknown","10 minutes","Slow moving and looked like it was floating and on fire. Saw it first at roof height. saw it last at about 1000ft or higher.","9/9/22","Yes","https://www.nuforc.org/webreports/reports/171/S171050.html","334X2022.09.15.20.54.06",FALSE
"8/10/22 23:10","roma","Lazio","Italy","Circle","non lo so","Blue light in a circle and blue lines in it","9/9/22","Yes","https://www.nuforc.org/webreports/reports/171/S171096.html","335X2022.09.15.20.54.06",FALSE
"8/10/22 22:29","Maple Valley","WA","USA","Sphere","45 minutes","A bright light in the sky","9/9/22","","https://www.nuforc.org/webreports/reports/171/S171129.html","336X2022.09.15.20.54.06",FALSE
"8/10/22 22:09","Everett","WA","USA","Cylinder","1 minute","I was alone when I looked out the patio door and saw a fast white dot when it passed a tree this light started to spin.","9/9/22","","https://www.nuforc.org/webreports/reports/171/S171057.html","337X2022.09.15.20.54.06",FALSE
"8/10/22 22:00","Lacey","WA","USA","Circle","30 min","Fiery red egg shaped object rose above tree line and maneuvered up and down for 30 seconds","9/9/22","Yes","https://www.nuforc.org/webreports/reports/171/S171072.html","338X2022.09.15.20.54.06",FALSE
"8/10/22 21:42","Sacramento","CA","USA","Circle","3mins","One light appeared then suddenly another and same location. But moved opposite directions nether blinked and both zoomed out of view.","9/9/22","","https://www.nuforc.org/webreports/reports/171/S171052.html","339X2022.09.15.20.54.06",FALSE
"8/10/22 20:50","Norcross","GA","USA","Oval","15 Seconds","I was driving home and was able to get a quick picture of this object.","9/9/22","Yes","https://www.nuforc.org/webreports/reports/171/S171068.html","340X2022.09.15.20.54.06",FALSE
"8/10/22 20:40","","","USA","Light","2-3 seconds","blue-white bright light resembling Venus or the ISS.","9/9/22","","https://www.nuforc.org/webreports/reports/171/S171054.html","341X2022.09.15.20.54.06",FALSE
"8/10/22 20:27","East Lyme","CT","USA","Formation","Less than a second","25-50ppl on Hole In The Wall boardwalk viewing rising supermoon, none of us saw it w/naked eyes. I captured on cell camera.","9/9/22","Yes","https://www.nuforc.org/webreports/reports/171/S171150.html","342X2022.09.15.20.54.06",FALSE
"8/10/22 19:31","Sierra Madre","CA","USA","Chevron","30 seconds","Was taking photo of strange cloud formation over the moon. First picture shows","9/9/22","Yes","https://www.nuforc.org/webreports/reports/171/S171047.html","343X2022.09.15.20.54.06",FALSE
"8/10/22 19:30","Gulf Shores","AL","USA","Light","12 to 15 minutes","It seemed like a biggish drone except silent, faster than drones we know about, and the time in the air was way more than any drone.","9/9/22","","https://www.nuforc.org/webreports/reports/171/S171075.html","344X2022.09.15.20.54.06",FALSE
"8/10/22 16:15","Taunton","MA","USA","Cigar","I seen for about a min","Looked like a Very low plane with no wings and wasn't moving","9/9/22","","https://www.nuforc.org/webreports/reports/171/S171032.html","345X2022.09.15.20.54.06",FALSE
"8/10/22 11:19","Orange City","FL","USA","Cigar","10 secs","Thought it was a blimp (could be) but I had a weird feeling when seeing it and it had this haze & was straddling the bottom of clouds.","9/9/22","","https://www.nuforc.org/webreports/reports/171/S171036.html","346X2022.09.15.20.54.06",FALSE
"8/10/22 05:11","Madison","MO","USA","Rectangle","Approximately 3 minutes","Watching for meteors, saw what look like a cloud to the north in the shape of a very defined rectangle.","9/9/22","","https://www.nuforc.org/webreports/reports/171/S171038.html","347X2022.09.15.20.54.06",FALSE
"8/10/22 04:40","Shinglehouse pa","","Armenia","Cigar","30 seconds","Very Long lit up cigar shaped object traveling west to East","9/9/22","","https://www.nuforc.org/webreports/reports/171/S171063.html","348X2022.09.15.20.54.06",FALSE
"8/10/22 03:16","New York","NY","USA","Light","10 seconds","1 super bright light 1 dimmer","9/9/22","","https://www.nuforc.org/webreports/reports/171/S171040.html","349X2022.09.15.20.54.06",FALSE
"8/10/22 02:33","Brocton","NY","USA","","Seen them last 2 weeks","They look to be a multi colored light but up close they are 3 to 4 lights spinning around each other","9/9/22","","https://www.nuforc.org/webreports/reports/171/S171177.html","350X2022.09.15.20.54.06",FALSE
"8/10/22 02:00","Keller","TX","USA","Circle","2 min 18 sec","I saw a light from a distance zig zag left to right","9/9/22","","https://www.nuforc.org/webreports/reports/171/S171039.html","351X2022.09.15.20.54.06",FALSE
"8/9/22 23:30","London east","City of London","United Kingdom","Light","30-40mins","Pulsating light that changed colour","9/9/22","","https://www.nuforc.org/webreports/reports/171/S171037.html","352X2022.09.15.20.54.06",FALSE
"8/9/22 22:45","Oshkosh","WI","USA","Cone","10 minutes ar Least","In eastern sky noticed randomly moving bright object so I went in and got phone to take pics and videos.","9/9/22","Yes","https://www.nuforc.org/webreports/reports/171/S171076.html","353X2022.09.15.20.54.06",FALSE
"8/9/22 22:10","Orlando","FL","USA","Triangle","5min","Coming home from WDW, we observed a hovering object","9/9/22","Yes","https://www.nuforc.org/webreports/reports/171/S171043.html","354X2022.09.15.20.54.06",FALSE
"8/9/22 19:53","","FL","USA","Disk","4 minutes","Was on my way home from work and saw a huge disc shaped UFO it was black semi naked eye","9/9/22","Yes","https://www.nuforc.org/webreports/reports/171/S171035.html","355X2022.09.15.20.54.06",FALSE
"8/9/22 19:32","Camden point","MO","USA","Cigar","1 1/2 minutes long","I saw a white cigar shape/ paper towel roll shape object, white in color, no wings, no sound flying very slow , headed north.","9/9/22","","https://www.nuforc.org/webreports/reports/171/S171025.html","356X2022.09.15.20.54.06",FALSE
"8/9/22 05:40","Mountain Home","AR","USA","Changing","15 minutes","Sparkling light stationary with various colors near the horizon before dawn.","9/9/22","","https://www.nuforc.org/webreports/reports/171/S171030.html","357X2022.09.15.20.54.06",FALSE
"8/9/22 03:30","Tijuana","Baja California","Mexico","Light","5 seconds roughly","Green blue propulsion with sharp banking manuever","9/9/22","","https://www.nuforc.org/webreports/reports/171/S171018.html","358X2022.09.15.20.54.06",FALSE
"8/9/22 03:26","El Paso","TX","USA","Unknown","Several minutes","Visit happend in dream. It's not the 1st time. They give me a mission I don't know how to complete. They send me on my way and say I-","9/9/22","","https://www.nuforc.org/webreports/reports/171/S171046.html","359X2022.09.15.20.54.06",FALSE
"8/9/22 00:26","West of Montrose CO.","CO","USA","Light","Approximately 10 to 12 mi","Large lights red blue white hanging and oscillating in sky.. Have seen it 3 times, same place and then just vanishes","9/9/22","","https://www.nuforc.org/webreports/reports/171/S171029.html","360X2022.09.15.20.54.06",FALSE
"8/8/22 23:45","Cincinnati","OH","USA","Formation","5 seconds","Almost midnight, two dark unlit objects, maybe boomerang shaped, flying close formation, glided by swiftly and silently","9/9/22","","https://www.nuforc.org/webreports/reports/171/S171343.html","361X2022.09.15.20.54.06",FALSE
"8/8/22 22:30","Chicago","IL","USA","Sphere","2 hours","Three orangish warm light emanating hovering in the southwest. They would descend until out of sight and some would come back.","9/9/22","Yes","https://www.nuforc.org/webreports/reports/171/S171021.html","362X2022.09.15.20.54.06",FALSE
"8/8/22 22:15","Finksburg","","USA","Light","6 seconds","Saw shootings star and about a minute later same spot a bright light was sitting in that spot like it was coming to me then shot fast","9/9/22","","https://www.nuforc.org/webreports/reports/171/S171017.html","363X2022.09.15.20.54.06",FALSE
"8/8/22 22:15","Chicago","IL","USA","Light","90 minutes","Downtown Chicago 3 bright lights hovering in night sky","9/9/22","Yes","https://www.nuforc.org/webreports/reports/171/S171023.html","364X2022.09.15.20.54.06",FALSE
"8/8/22 22:00","Pacific","MO","USA","Changing","Ten minutes","Object came across sky and appeared to be crashing airplane then went at 45 degree angle incredible fast back into sky","9/9/22","","https://www.nuforc.org/webreports/reports/170/S170917.html","365X2022.09.15.20.54.06",FALSE
"8/8/22 20:24","Little Egg Harbor Twp","NJ","USA","Light","3 minutes and 1 minute","Saw three glowing orbs","9/9/22","","https://www.nuforc.org/webreports/reports/171/S171134.html","366X2022.09.15.20.54.06",FALSE
"8/8/22 17:49","Firestone","CO","USA","Formation","1 minute","Saw two white spaceships come together and went from white to invisible. Saw another spaceship above them","9/9/22","Yes","https://www.nuforc.org/webreports/reports/171/S171016.html","367X2022.09.15.20.54.06",FALSE
"8/8/22 15:37","Cardiff","Wales","United Kingdom","Diamond","approx 9 minutes","Bright shape moving very slowly from north to south,","9/9/22","","https://www.nuforc.org/webreports/reports/170/S170990.html","368X2022.09.15.20.54.06",FALSE
"8/8/22 13:17","Great Falls","MT","USA","Circle","1 minute","Two floating objects were observed for about 1 minute. Flying in alignment and tandem. Faded off to the west.","9/9/22","Yes","https://www.nuforc.org/webreports/reports/171/S171160.html","369X2022.09.15.20.54.06",FALSE
"8/8/22 12:40","Harrisburg","PA","USA","Triangle","Still on sky","Circle light, triangle lights came out around it. It went away(up) barely visible , then disappeared and the came back.","9/9/22","Yes","https://www.nuforc.org/webreports/reports/170/S170998.html","370X2022.09.15.20.54.06",FALSE
"8/8/22 10:52","Chula Vista","CA","USA","Circle","About 10 Minutes","I was walking to class when me and my friends saw a possible UFO in the sky","9/9/22","","https://www.nuforc.org/webreports/reports/170/S170988.html","371X2022.09.15.20.54.06",FALSE
"8/8/22 08:50","Salt lake city","UT","USA","Teardrop","5 minutes","Saw a unidentified object moving silently through the sky above tree level.","9/9/22","Yes","https://www.nuforc.org/webreports/reports/170/S170987.html","372X2022.09.15.20.54.06",FALSE
"8/8/22 04:30","Cottonwood","CA","USA","Circle","4 minutes","It changed color and disappeared","9/9/22","","https://www.nuforc.org/webreports/reports/171/S171026.html","373X2022.09.15.20.54.06",FALSE
"8/8/22 01:15","Bloomington","IN","USA","Circle","60 seconds","2 black circles flying through the clouds","9/9/22","","https://www.nuforc.org/webreports/reports/170/S170986.html","374X2022.09.15.20.54.06",FALSE
"8/8/22 00:00","Grayson","LA","USA","Changing","2 hours multiple objects","Multiple objects for the 4th night in a row. 12am to 2am","9/9/22","","https://www.nuforc.org/webreports/reports/170/S170996.html","375X2022.09.15.20.54.06",FALSE
"8/7/22 22:50","Apple valley","CA","USA","Light","4-5 minutes","34°36'05""N 117°05'34""W","9/9/22","","https://www.nuforc.org/webreports/reports/170/S170947.html","376X2022.09.15.20.54.06",FALSE
"8/7/22 22:45","Sammamish","WA","USA","Egg","5 seconds","I saw a green egg shaped object flying in the sky heading north.","9/9/22","","https://www.nuforc.org/webreports/reports/170/S170993.html","377X2022.09.15.20.54.06",FALSE
"8/7/22 22:30","Morgantown","WV","USA","Fireball","2+ hours","UFO bounces and zips infront of house for over 2 hours","9/9/22","","https://www.nuforc.org/webreports/reports/170/S170984.html","378X2022.09.15.20.54.06",FALSE
"8/7/22 21:59","Richmondville","NY","USA","Light","~ 5 minutes","Temporary Light illuminated SW sky - 4 point of light rays","9/9/22","Yes","https://www.nuforc.org/webreports/reports/170/S170989.html","379X2022.09.15.20.54.06",FALSE
"8/7/22 21:25","Mobile","AL","USA","Triangle","Less than 45 seconds","I was outside and looked up and saw a triangular shape flying few seconds later it disappeared with a flash of light.","9/9/22","","https://www.nuforc.org/webreports/reports/171/S171002.html","380X2022.09.15.20.54.06",FALSE
"8/7/22 21:20","Weatherly","PA","USA","Circle","1 minute","Seen a plane flying east and above it at least 2 times higher than the plane a circular light was traveling opposite direction","9/9/22","","https://www.nuforc.org/webreports/reports/171/S171014.html","381X2022.09.15.20.54.06",FALSE
"8/7/22 20:15","Crystal City, Arlington","VA","USA","Oval","12 seconds","Was eating dinner on the terrace with my friend when I saw this tic tac moving through a clear sky","9/9/22","Yes","https://www.nuforc.org/webreports/reports/170/S170994.html","382X2022.09.15.20.54.06",FALSE
"8/7/22 17:30","Lexington","KY","USA","Circle","15 to 20 seconds","Stationary orb, very bright and very high altitude.","9/9/22","","https://www.nuforc.org/webreports/reports/171/S171009.html","383X2022.09.15.20.54.06",FALSE
"8/7/22 15:37","West Springfield","MA","USA","Unknown","Approx. 20 Seconds","Traveled west to east, then slightly curved off. No lights and pigmented gray, did match the night sky and was quite.","9/9/22","","https://www.nuforc.org/webreports/reports/170/S170946.html","384X2022.09.15.20.54.06",FALSE
"8/7/22 13:00","Named in the video","","Germany","Cigar","Andreas Trimmel","It was one thing.","9/9/22","","https://www.nuforc.org/webreports/reports/170/S170939.html","385X2022.09.15.20.54.06",FALSE
"8/7/22 12:00","Grayson","LA","USA","","Over a 2 hour period","Multiple sightings for 2 hours straight for 3 consecutive nights.","9/9/22","","https://www.nuforc.org/webreports/reports/170/S170944.html","386X2022.09.15.20.54.06",FALSE
"8/7/22 07:31","Over Toledo bend lake","TX","USA","Triangle","Maybe a minute","I noticed it when it came up through the cloud. It made a plume with the cloud. Seems to hover a little and then disappeared.","9/9/22","","https://www.nuforc.org/webreports/reports/171/S171101.html","387X2022.09.15.20.54.06",FALSE
"8/7/22 06:29","Bradenton","FL","USA","Circle","about 2 minutes","A very bright circle of light came from the southwest and moved across the sky to the northeast and disappeared.","9/9/22","","https://www.nuforc.org/webreports/reports/171/S171013.html","388X2022.09.15.20.54.06",FALSE
"8/7/22 03:30","Lebanon","OH","USA","Unknown","3 minutes","A vertically orientied and tight collection of dozens and dozens of random, blinking lights.","9/9/22","","https://www.nuforc.org/webreports/reports/171/S171005.html","389X2022.09.15.20.54.06",FALSE
"8/7/22 03:00","Gridley","CA","USA","Oval","30 seconds","Super bright green oval","9/9/22","","https://www.nuforc.org/webreports/reports/171/S171022.html","390X2022.09.15.20.54.06",FALSE
"8/7/22 01:00","Tacoma","WA","USA","Circle","3-4 hrs","A cluster of blue- white lights descending slowly into forest","9/9/22","Yes","https://www.nuforc.org/webreports/reports/170/S170937.html","391X2022.09.15.20.54.06",FALSE
"8/7/22 00:30","Vineyard","UT","USA","Chevron","","My friend and I both saw a translucent chevron shape flying through the night sky.","9/9/22","","https://www.nuforc.org/webreports/reports/170/S170945.html","392X2022.09.15.20.54.06",FALSE
"8/7/22 00:11","Waterlooville","","United Kingdom","Circle","20 minute's","4 different circles making 90 degree turns that were in a pattern but not coordinated with a weird green white glow.","9/9/22","","https://www.nuforc.org/webreports/reports/170/S170942.html","393X2022.09.15.20.54.06",FALSE
"8/7/22 00:00","Hickory","NC","USA","Light","10-12 minutes","I took my dog outside to the backyard one last time before bed, blue light about size of basketball circling my house","9/9/22","","https://www.nuforc.org/webreports/reports/170/S170935.html","394X2022.09.15.20.54.06",FALSE
"8/6/22 23:30","Conifer","CO","USA","Sphere","Twenty seconds","Glimpse of thirty-foot diameter orb that can only be described as an ""orb of dark red fire""","9/9/22","","https://www.nuforc.org/webreports/reports/171/S171080.html","395X2022.09.15.20.54.06",FALSE
"8/6/22 23:11","Spokane","WA","USA","Circle","5 seconds","A circular or ovular craft moving at high speed SW to NE which left a light blue to lavender-blue ripple/ haze in its wake","9/9/22","","https://www.nuforc.org/webreports/reports/170/S170948.html","396X2022.09.15.20.54.06",FALSE
"8/6/22 22:37","Itasca","TX","USA","Light","A little over a hour","1 was red , floating then shot straight up & disappear, 2 were basically white with some blue, they were hovering over the solar farm","9/9/22","","https://www.nuforc.org/webreports/reports/170/S170985.html","397X2022.09.15.20.54.06",FALSE
"8/6/22 21:35","Warminster","Wiltshire","United Kingdom","Circle","30 minutes","Saw two circle shaped lights flying in sync for 30 minutes","9/9/22","","https://www.nuforc.org/webreports/reports/171/S171110.html","398X2022.09.15.20.54.06",FALSE
"8/6/22 21:30","Lebanon","TN","USA","Light","1 minute","Strange lights appeared then disappeared","9/9/22","","https://www.nuforc.org/webreports/reports/171/S171465.html","399X2022.09.15.20.54.06",FALSE
"8/6/22 21:15","Brampton","ON","Canada","Disk","1 minute","Was shocking at first, not knowing what it was but when it left I had a very good idea","9/9/22","","https://www.nuforc.org/webreports/reports/171/S171045.html","400X2022.09.15.20.54.06",FALSE
"8/6/22 21:00","Friant","CA","USA","Changing","Approx. 1 minute","""Ribbon"" of light materialized on disk shaped object","9/9/22","","https://www.nuforc.org/webreports/reports/171/S171378.html","401X2022.09.15.20.54.06",FALSE
"8/6/22 20:45","Mt. Pleasant","WI","USA","Sphere","4-5 minutes","Two lights, one following the other crossed the sky. leisurely pace, from SW to NE.","9/9/22","","https://www.nuforc.org/webreports/reports/171/S171073.html","402X2022.09.15.20.54.06",FALSE
"8/6/22 20:30","Indianapolis","IN","USA","Circle","2 minutes","Circular black object with two protrusions floating just under the cloud line","9/9/22","","https://www.nuforc.org/webreports/reports/170/S170952.html","403X2022.09.15.20.54.06",FALSE
"8/6/22 20:12","Godley","TX","USA","Other","21","I saw something in the sky it was very bright and kinda dazzling it had a circle in front and at diamond shape on the back.","9/9/22","","https://www.nuforc.org/webreports/reports/170/S170957.html","404X2022.09.15.20.54.06",FALSE
"8/6/22 20:09","Littleton","CO","USA","Cylinder","Approx 11-15 sec","No sound or lights","9/9/22","Yes","https://www.nuforc.org/webreports/reports/170/S170955.html","405X2022.09.15.20.54.06",FALSE
"8/6/22 19:27","Caldwell","ID","USA","Light","10 minutes","7 lights and peering above Caldwell Idaho disappeared after 10 minutes","9/9/22","","https://www.nuforc.org/webreports/reports/170/S170956.html","406X2022.09.15.20.54.06",FALSE
"8/6/22 17:50","Albuquerque","NM","USA","Unknown","About one (1) minute","I saw approximately 5 aluminum/silver objects flying at high speed from south to north over the Sandia Mountains","9/9/22","","https://www.nuforc.org/webreports/reports/170/S170959.html","407X2022.09.15.20.54.06",FALSE
"8/6/22 17:00","Bloomington","IN","USA","","30 seconds","Black tic-tac shaped ufo. Moved with insane speed","9/9/22","","https://www.nuforc.org/webreports/reports/170/S170961.html","408X2022.09.15.20.54.06",FALSE
"8/6/22 15:15","Erie, Presque Isle","PA","USA","Formation","2-3 minutes","One sphere become 2 then 3 then 4. They change formation from triangle to a straight line then went up and disappeared","9/9/22","","https://www.nuforc.org/webreports/reports/171/S171010.html","409X2022.09.15.20.54.06",FALSE
"8/6/22 11:50","Chilliwack","BC","Canada","Other","2hrs","Singular no moving","9/9/22","Yes","https://www.nuforc.org/webreports/reports/170/S170999.html","410X2022.09.15.20.54.06",FALSE
"8/6/22 06:21","High Springs","FL","USA","Cross","40+ minutes","Saw a cross-shaped ball of light moving very, very slowly and steadily straight upwards in the east.","9/9/22","Yes","https://www.nuforc.org/webreports/reports/170/S170972.html","411X2022.09.15.20.54.06",FALSE
"8/6/22 05:23","Garden City","SC","USA","Circle","14:03","Luminous orbs in night sky over beach area","9/9/22","Yes","https://www.nuforc.org/webreports/reports/171/S171429.html","412X2022.09.15.20.54.06",FALSE
